	home_id	scores_cleanliness	scores_location	review_id	comments
23586	2693137	9.0	9.0	15354452	"We stayed at Mark's place for three nights. My previous Airbnb experiences were all superb. Unfortunately, this time it was a less than nice experience. I will start with the positive. 
Despite the host not being there, an acting host named Mario welcomed us. He was very nice and helpful. Although not very familiar with the city he tried to provide with useful tips. The apartment has a nice view and is in a good location if you want to be near downtown, not so much if you want to take a walk or grab a bite in the surroundings though, because it is right across the street to a major highway. Parking was a bit of an issue because other people took the spot that was assigned to us. Mario told us that should've not happened because that was the host's spot as well. He suggested us to park around the corner in the back parking lot of the apartment complex, and it worked. However, we noticed we took someone else's spot so Mario suggested to put a piece of paper to let them know, and I had to leave my name and phone number in a visible place inside the car so they could call me in case they wanted to park their car. Fortunately, no one called. The bed was comfortable and two clean towels were provided.
There were two main issues we had. Number one was cleanliness, or the lack of thereof. The entire apartment needs a cleaning,  especially the carpet floor. Even more so the bedroom. Moreover, the bedside tables in the bedroom were covered in dust and there were backpacks and shopping bags all over the carpet floor.
The second issue was the pets, and let me explain why. When we saw the listing we knew there were a cat named Elizabeth in the place, which sounded great to us because we're huge animal loving people. The problem is that she and her recently born kittens, they all live under the bed. So all three nights we had to deal with the miaows from under the bed, which can be a real inconvenience for someone trying to sleep. Moreover, Elizabeth is used to come in and out of the bedroom at her will, so we had two choices: sleeping with the bedroom door open or having her, in the middle of the night, sitting in the bed, or on our chests, moving and making sounds for us to open the door. It may sounds fun, but it wasn't, specially when one is looking to sleep and relax. 
All in all the place has potential, but it needs serious cleaning. I'm not sure what to suggest about the cat. As it is right now, I could not, in a good heart, recommend this place for someone to stay at. "
23587	2693137	9.0	9.0	16312441	My boyfriend and I stayed with Mark while we were in Seattle and had a lovely time! Mark was very nice, made us feel at home in the apartment and shared lots of great information about the city. We loved our stay and I would recommend it to anyone :) 
23588	2693137	9.0	9.0	18221853	Mark was a fine host.  My plans changed somewhat and I ended up showing up later than anticipated; and Mark waited until I arrived so I could find the place and he could show me amenities.  He provided some simple stuff for breakfast, which was nice.  His place is clean and in a good, safe location; close the interstate so it has good access to other parts of the city.  Only stayed 1 night, but I would have no problem staying there again if in Seattle.  
23589	2693137	9.0	9.0	18360322	Mark was friendly and the place was nice. He gave me some space but was available if I needed anything. The neighbourhood is great and really easy to get downtown from. 
23590	2693137	9.0	9.0	18446691	At Mark's place you will get clean sheets, towel, comfy place to crash, good conversations, in addition to great view. Further two kittens kept me company. 
23591	2693137	9.0	9.0	18667721	Really cool guy. Actually picked me up from the airport the first day! Gives you space but is also very hospitable and welcoming. As nerdy as it sounds, I feel like I actually got a friend out of it lol. If I can I'll definitely stay with him again next time I'm in Seattle.
23592	2693137	9.0	9.0	18878979	"Mark was the best hosts one could ask for.  Polite, courteous, fun and giving.  Had supplied me with keys, a place to park and a bagel, all before I met him.  Even though I was barely there for 3 days, we had some great conversations and Mark made me feel like a friend staying with him rather than a airbnb guest.  

The place was tidy and very clean.  Great view of Seattle, Lake Union and the Space Needle.  The couch was comfortable.  He provided sheets, pillows, blankets and a towel.

The cat, Queen Elizabeth, was cute and soft, very well mannered.  She even slept next to me the first night.

Do not hesitate to contact Mark about your next Seattle stay as I will not.

"
23593	2693137	9.0	9.0	19354161	Mark was great! Very friendly, welcoming and responsive. I left my toiletries there and it was not a problem to go get them from him two days later. 
23594	2693137	9.0	9.0	19650996	"l had good experience that stay at home in seattle. Mr, Mark offered me environment that can be very relaxing. So l thanks to him.
But I am not good at using English. I wanted to talk with him. If I can speak English, I want to visit again !"
23595	2693137	9.0	9.0	19764503	We had a great time at Marks Place! Thanks for having us
23596	2693137	9.0	9.0	19901032	Mark hosted me and my friend for 3 nights. The house was nice and the bed was very comfortable too. He picked us up from the bus station in downtown and gave us a rough guidance on the places we could visit. Very good host with a comfortable house.
23597	2693137	9.0	9.0	19990707	We had a great stay at Great View Eastlake. Mark was extremely helpful and very communicative. The apartment was very clean and welcoming. Queen Elizabeth is so cute and funny. Thank you very much Mark !!
23598	2693137	9.0	9.0	20128439	Loved my time in Seattle. Mark was a great host and the location was perfect
23599	2693137	9.0	9.0	20325364	Mark was a great host. Though we couldn't talk for long, he was sincere and kind throughout. 
23600	2693137	9.0	9.0	20751591	Really good experience, Mark is very hospitable and helped me alot to settle down in Seattle. 
23601	2693137	9.0	9.0	20983073	"Home is a place where you can come back in the evening and relax. 
With the home theatre, the comfy sofa, the great view out the window and the pets, home is exactly what the place feels like.
Mark is a friendly guy and I enjoyed chatting with him.

Elizabeth needs a separate mention. 
If you like cat's, you will LOVE elizabeth ! She is one playful cat who will come running to you the instant you sit down on the sofa !

P.S, Seattle isn't on a plain and there are many slopes around the city. Mark's beautiful  place is on the top of a slope (hence the views). So if you have heavy baggage with you and are taking the bus, avoid taking any of the (phone number hidden) irrespective of what the maps suggest.
The #25 is your best bet and stops very near the house."
23602	2693137	9.0	9.0	21273948	We were greeted by a friendly Mark and his furry side kicks Luke and Miss queen kitty ...nice place, comfy sleep.  Thanks for having us last minute. 
23603	2693137	9.0	9.0	21371394	What a great experience, Mark was very helpful and very friendly.  I would quickly recommend staying here to any of my friends.  
23604	2693137	9.0	9.0	21571554	"Thank you, Mark, for hosting me.

This is a beautiful place and a great spot for a calm night and a good sleep. And definitely a great view!

You are an easy going host; thank you for a good talk. "
23605	2693137	9.0	9.0	22054248	I absolutely loved my experience in Seattle-thanks to Mark! He was an amazing host and has an awesome apartment in a cute part of town. I enjoyed a neighborhood run and a cute, cozy coffee shop nearby. There are also buses conveniently located near his spot!
23606	2693137	9.0	9.0	22220273	Mark was great!! He was very acomidating. It was a privilege to stay is this home with suck a wonderful view!!
23607	2693137	9.0	9.0	22661002	Mark was a great host. He played provided some useful information about places in the area. The fold-out bed is really very comfortable. I had a good time and would recommend this spot if you need a place to stay while visiting Seattle 
23608	2693137	9.0	9.0	22991355	This is my first time booking through airbnb and was a little hesitant just because I like my own privacy. For a cheap rate, I couldn't pass this opportunity up. I am glad I booked the Bnb with mark. Mark and River were the most friendly person I've ever met. I was new to Seattle, but mark provided many great suggestions for places to eat and things to do. Will definitely recommend staying with mark if you are looking for a place to crash in Seattle. 
23609	2693137	9.0	9.0	23141693	Mark is an awesome host! We got great tips from him and if you are looking for a cheap shared space then it's definitely the place for you! 
23610	2693137	9.0	9.0	24181035	We had a wonderful time in Seattle. Mark was an excellent host and his home was lovely. The home was in a great location and I definitely recommend staying with Mark and River if you're ever in Seattle.
23611	2693137	9.0	9.0	27311713	Experience was positive, Mark was very friendly, place was clean and in proximity to Lake Union and downtown. I recommend staying at this property.
23612	2693137	9.0	9.0	28889099	I can't say enough good things about my experience with Mark and River. They both made me feel very welcomed and helped me quickly adjust to a new city (teaching me about the different areas, bus routes, music festivals etc etc). Their home is in a great area with a fantastic view and some very sweet animals. I truly only have positive things to say about these two and my time staying with them - Thanks, guys!
23613	2693137	9.0	9.0	29078995	"My girlfriend and I had a lovely time at Mark and River's home.  The pets (kittens and a dog) were adorable.  Mark and River were quiet and sociable.  We had a great trip!  
"
23614	2693137	9.0	9.0	30108106	Mark was extremely accommodating, especially considering I had initially booked the room for the wrong date.  He was flexible and thank goodness the place was free for the date I actually needed.  The room was clean and offered everything I needed and the view of Lake Union is amazing.  
23615	2693137	9.0	9.0	30415758	I had a great time in Seattle thanks to Mark! He was a great host and provided me with info on what to do and see! His house is clean and well decorated. The view from the living room is spectacular!
23616	2693137	9.0	9.0	30645606	Mark & River were great hosts - their apartment was exactly as seen in the pictures. Mark and River were also nice to offer a beer and chatted  with me during my stay. They made my first visit to Seattle very pleasant. Hope to be back in Seattle soon! 
23617	2693137	9.0	9.0	30750904	"Mark was very friendly and helpful. We had to find a place last minute and he quickly responded to our request. When we showed up the place was a bit disheveled, but that could have been due to having unexpected overnight guests. We also ended up having to cancel one night, and he was flexible and understanding. He gave us a lot of recommendations on places to visit in the area, as neither of us had been to Seattle before. Also, the view is pretty amazing!
I would add that we knew beforehand that a cat lived in the apartment but when we showed up there were also three kittens. So if you're not a cat person, this probably isn't the place for you. His dog Luke was a sweetheart though. "
23618	2693137	9.0	9.0	31156013	Mark was very accommodating and friendly. Great view, nice vibe. 
23619	2693137	9.0	9.0	31481432	Mark was a very nice host. His home is a very comfortable place in a beautiful neighborhood. Easy to go to downtown by bus. My girlfriend and I enjoyed very much our stay. Thanks a lot Mark!
23620	2693137	9.0	9.0	32086116	I loved my stay at Mark's Apt, Mark keeps an incredibly clean and welcome place for visitors.  The apartment is in a great part of city close to bars, restaurants and the lake view is awesome.  I intend to come back to Seattle, I would definitely work with Mark again.
23621	2693137	9.0	9.0	32831720	"이 곳은 접근성이 좋다. 왠만한 곳은 도보로 가능하기도하고(10분에서 1시간정도) 주요거리들을 지나다니는 왠만한버스들은 다 지나가기때문에 교통편이 편리하다.

처음부터 끝까지 마크와 리버는 우리를 친절하게 대해줬고 전혀 우리생활에 지장을주거나 불편함을 주지않았다. 시차가 거의 반대인 나라라 우리가 새벽에 잠을 못이뤄서 불편하기도했을텐데 그들은 우리에게 전혀 불만도 없었다. 

불편한 사항들을 이야기하면 바로 도움을주었고 이 곳에 있는 듬듬한 강아지 루크와 매력적인 고양이 엘리자베스는 항상 사랑스러웠다. 

비가올때나 날씨가 좋을때나 전망이 좋은것이 가장큰 장점이다. 집주변에 카페나 식당이있고 간단하게는 샌드위치가게도있다. 그리고 집앞에있는 마켓이 한국인이 운영하던 곳이라 더욱 좋았다. 

다음번 시애틀이 갈일이 있다면 다시한번 이 곳에 머물고싶다. "
23622	2693137	9.0	9.0	32927993	Mark and River were great hosts!  I will stay again in June and am looking forward to it.  The apartment is modest but clean, very convenient, with a great view, and a great value over a hotel.  Very close to downtown and UW campus, in the very cool East Lake area. My room and bed were comfortable, the shower was hot, and the fruit they shared was delicious.  I got to experience a great new neighborhood and meet some new friends, something that would not have happened in a hotel!
23623	2693137	9.0	9.0	33286476	My bf and I had a wonderful stay at Mark's place. The apartment is clean and the location is great. You can see the lake and Space Needle from the window. Mark gave us some great travel suggestions, and River made us delicious hot tea. The kitty was friendly and so adorable. 
23624	2693137	9.0	9.0	33537128	Mark and River very great host in seattle! mark's house is so comfortable, clean, so beautiful! and their cat Elizabeth, dog luc are great mate in seattle. Mark and River gives me great memory of seattle. talking with me long times, give me information of seattle tour, and they recommend seattle's beautiful tour spot! if i going to seattle again, i will going mark's house again. thanks Mark, River! 
23625	2693137	9.0	9.0	34708404	The view over Lake Union was even more amazing than described, and Mark was an excellent host! Communication was easy and fast, and Mark was very easy-going and helpful when needed. River and the pets were nice too. I had a lot of freedom coming and going when I liked. Location was good, and it was easy to get to Capitol Hill / downtown / University district by buses. I can sincerely recommend this place! 
23626	2693137	9.0	9.0	34875246	Another great stay with Mark and River.  They are very warm, welcoming, and make you very comfortable.  The fresh cherries were delicious and the Jelly Belly's a nice treat.  Their location is so convenient and there are great coffee places, restaurants, and convenience stores a short walk away.
23627	2693137	9.0	9.0	35090387	Mark and River are lovely. The place is clean and comfortable, and the view from the living room is gorgeous. I wasn't there often, but I encountered no problems in the time I was there. I'd certainly recommend staying here if you're visiting Seattle.
23628	2693137	9.0	9.0	35662992	Mark and River were very kind and welcoming. The room was clean as well as the bathroom. The apartement is close to public transportation and interstate 5. At night, we would suggest to turn the fan on in order to mask noise coming from I5.
23629	2693137	9.0	9.0	35892923	Mark and River were very acomodating when I needed somewhere to stay at short notice. They were very hospitable, and their kitten was adorable
23630	2693137	9.0	9.0	36033549	Mark and River were very hospitable to my boyfriend and I. Mark had many good suggestions to give for Seattle. We really enjoyed our stay at their place, a real plus point too if you're an animal lover. Their poodle luc and their cat are both adorable. 
23631	2693137	9.0	9.0	37170868	Mark was a cool, easy going guy with cool pets. The spot was nice and cool, and the view was great. 
23632	2693137	9.0	9.0	37436565	Mark's home was very quiet and cozy. We didn't see him much but he provided us with everything we would need for our stay. Particularly loved the cat and dog -- neighborhood was very cute and green, and had a good breakfast place nearby. 
23633	2693137	9.0	9.0	37506717	Mark was very welcoming, lots of ideas of places to see and things to do.  Loved his dog and cat too!  Mark was great about helping us find the place and feel at home.  
23634	2693137	9.0	9.0	37570299	Great location and neighborhood. A bit tricky to find as Google maps seems to not find the address but once we got there it was no problem. Free parking on site was great. Mark and his partner were helpful and checking in was super flexible and easy. He gave me some things to check out in town and great place to go for breakfast. Their kitty Elizabeth is such a cutie pie we fell in love with her. 
23635	2693137	9.0	9.0	37698780	Mark and his husband River were great hosts. Their apt was very clean, quiet, and we were welcomed home by the cutest little kitten. 
23636	2693137	9.0	9.0	38269600	Mark and River were very welcoming, and the kitten greeted us with joy each time we came through the door. Mark had many good suggestions to give for Seattle, and invited us along for a night out. We really enjoyed our stay at their place: the location is wonderful for everything we wanted to do, and easily accessed without a car. The view is amazing and can't be adequately captured in photos. 
23637	2693137	9.0	9.0	38651762	His hospitality was pretty good :) I had a great night. I would love to come back!
23638	2693137	9.0	9.0	38733499	Mark and River were so welcoming when I stayed with them. Their pets are also equally as welcoming! We didn't stay for very long, but enjoyed it nonetheless. 
23639	2693137	9.0	9.0	38951795	"Sorry to say, our experience wasn’t good and I wouldn’t recommend this place to friends. I originally asked for my daughter, her husband and their 3 month old baby. The listing said “kid friendly” and Mark was most friendly and encouraging that the baby would be welcome, so we confirmed. Fortunately, because of an afternoon event that conflicted with check-in time, we picked up the key early. Seeing that there was not enough room for a baby, two adults, and their combined luggage, my husband and I switched accommodations with my daughter. 

When we returned in the early evening, no one was home. With a fan on, the power blew in the bedroom when we tried to turn on a light. I called Mark, who said he’d fix it, and we went out. I’m sure Mark and River are very nice and helpful, but we barely saw them. They arrived just after midnight, thinking that they would get there before us to fix the power outage. We were on our way to bed. I’m capable of flipping a circuit breaker, but it’s hard to hunt for a fuse box in the dark. 

It was a very hot weekend, and things happen. But I was disappointed again in the morning when I found the kitchen sink so full of someone else’s dishes, pots, pans, etc. that I couldn’t get my water bottle under the tap to fill it. (Rule #1: clean up after yourself in the kitchen!) We left by about 8:30 with no sign of our hosts.  

The inside of the apartment, sheets and towels were clean, but cluttered, with no place to sit in the small bedroom and only an open futon to sit and enjoy the view, the featured draw of the location. This may be OK if you need a clean bed and don’t mind the freeway noise, but not if you expect a bit more.

Recommendations to Mark:
1)List the correct apartment number and get the locks fixed – took us quite a while to get the doors open. After a while, I saw that the door was a different number than listed w/airbnb, so we tried the other apartment – no luck. We then returned, knowing that the “décor” on the floor outside your apartment was distinctive and had to be correct.
2)Provide guests instructions for “free parking”, that was not obvious, ahead of time. If the “back alley” is best, it would have been good to have directions for how to get there and how to get from the alley into the apartment
3)Would be nice if you could get the carpets cleaned. That was a real turn off.
4)Clear the clutter from the rooms (including picture frames between the bed and the window wall) or be honest that the space can only sleep two with only a small amount of luggage. And warn guests about the power!
"
23640	2693137	9.0	9.0	39138659	Great apartment in a great location with great hosts! We got a lot of good tips and suggestions to where are all the cool places. Very clean and nice apartment with great view
23641	2693137	9.0	9.0	39315684	Mark and River were excellent hosts! Mark  gave us tons of pointers on where to go in Seattle.  Walk to the space needle was not bad at all, very flat and the weather was perfect for it. Their pets couldn't have been any sweeter. Great experience, would absolutely stay with them again!
23642	2693137	9.0	9.0	39415981	My girlfriend and I spent one night with River and Mark. We actually didn't see Mark as we came home kind of late and left early. The apartment is as nice as shown - everything was great. River was nice, the pets were nice, the space was nice.  A good first airbnb experience.  If we had to pick something we didn't like it would be the proximity of the highway, but that didn't bother us.
23643	2693137	9.0	9.0	39730253	Mark was a great host! Whenever there was a concern he was easily reachable, and he warmly welcomed us into his home. The location is quiet and close to bus lines. It is also conveniently located near the entrance to the highway, making for a stress-free drive to the house! Also, his cat is truly the best cat I have ever come into contact with :). 
23644	2693137	9.0	9.0	40137520	Mark and River were absolutely accommodating and delightful. We had poor communication in contacting them, yet they still were prepared for us. I appreciate their presence in the house, and they have a gorgeous view!
23645	2693137	9.0	9.0	40334409	"We had a good time at Mark's house. Mark was very friendly, helpful and we had a nice chat with Mark. His cat is very very cute. :)
To downtown it's about 3 miles. You can walk or you can take the bus. The public transport system in Seattle is not much as good as in other city but if you have a bit time than it is ok. In the neighborhood there are a few restaurants."
23646	2693137	9.0	9.0	40516822	I enjoyed my brief stay with Mark and River. Their place is comfortable, clean, and quiet; the location is well-served by public transit.
23647	2693137	9.0	9.0	41206439	Mark and River have been responsive and helpful in catering to my various requests.
23648	2693137	9.0	9.0	41733905	Great host and was very accommodating to when my friend had to crash with me for a night and my other friend showing up the next day. Clean place and friendly pets
23649	2693137	9.0	9.0	42413240	Mark I use Chinese to write reviews, because the Chinese to express my gratitude to you.Mark和他的丈夫是一个非常好的房东，西雅图是我们这次美国之行最喜欢的城市，没有之一。我们抵达西雅图的时间稍晚，但Mark还是来机场接了我们，并且在我们没抵达西雅图之前，想办法帮我们安排车辆去波音公司，这是非常棒的，特别热情与热心。昆明小哥（可以这样形容吗），我们有看到你的画，是要多么细心的人才能画得那么精致，虽然很想开口让你送我一幅，因为真的太漂亮了。谢谢你们俩对我们的照顾，下次西雅图再见。
23650	2693137	9.0	9.0	42669785	"We stayed for two nights at Mark's place. The house itself is perfect, with a very impressive view over the lake. The room is clean and the bed is nice.  The location is great too, you can easily walk to downtown and capitol hill  (great for food) is even closer.  Mark knows a lot about the direct area as well a the rest of the city. We followed some of his suggestions and all of these were perfect. 

Would recommend a stay here to everybody and wouldn't hesitate to book again."
23651	2693137	9.0	9.0	42898780	Mark and River were amazing and accommodating hosts, the view was even better than advertised and especially beautiful at night. Mark's restaurant recommendations were spot on, and the pets were both adorable temporary companions!
23652	2693137	9.0	9.0	43245737	Mark and River were the cutest, nicest, and most welcoming hosts! Even tho we were only there to shower and sleep we felt right at home! They have a gorgeous view of Lake Union and the apartment was very cozy. Transportation to and from was very accessible. We would highly recommend people to stay here and will hopefully be returning sometime in the future!
23653	2693137	9.0	9.0	43963874	"Mark was very accommodating for our late arrival. Apart from the rapid chat that we had to welcome us in, because of his timetable and our plans, we actually did not see him at all for the two days that we stayed.

The pictures represent well the place, which is conveniently located. We walked most of the time."
23654	2693137	9.0	9.0	44908182	Mark was very welcoming - he was home to greet me and got me settled in my room and answered my questions about all things Seattle  where to go, how to get there, etc.  Eastlake is a great neighborhood, I felt safe walking alone at night as a solo female traveler.  
