	home_id	scores_cleanliness	scores_location	review_id	comments
32111	3592838	9.0	10.0	42244287	"We enthusiastically endorse Anton and his apartment, and would be happy to have the opportunity to use this Airbnb site in the future!
Anton made it easy for us to enter and use the place.  It was well represented - and had all the great features that it advertised.  The 19th floor gave a spectacular view, and being on a high floor wasn't a bother because the two elevators were speedy. The location was good for folks like us who like to wander on foot, which we did. The Market, the space needle, even Chinatown were easily reached by foot.  The place was clean and neat, and arranged so that we could (and did) have guests join us for meals without feeling crowded. A big plus for us was that the bed was comfortable! An extra we hadn't counted on was having a trash/garbage chute handy.  Plenty of dishes, glasses and cookware. All we missed having was a can opener and a cutting board.
Great place - great location - and we will visit again when possible! 

One other thing - the hot tub and heated pool on the 7th floor was a great addition.  We used it daily and had it to ourselves each day during our two week stay!"
32112	3592838	9.0	10.0	42505490	The unit was as described in the listing. Great views and location!  Just a little hot this mid-August with higher than normal temps without air conditioning.  
32113	3592838	9.0	10.0	43033120	Neighborhood right in the center of Belltown and the view was perfect. Condo setting gave less of a tourist feel while visiting and a few of our favorite restaurants were in walking distance.  Anton was very communicative throughout the process and a superb host. 
32114	3592838	9.0	10.0	43374266	The view was great as was the location. Was not impressed at all with the condo cleanliness. Toni seemed distracted when we met him and getting information from him was scant although he was better via text.
32115	3592838	9.0	10.0	43600122	Nice place, just as described. Easy walking to wherever you want to go and to transportation. 
32116	3592838	9.0	10.0	43751044	Apartment is situated close to the city with great views.  Really a two persons accommodation (we had 3 adults)
32117	3592838	9.0	10.0	44762286	"I booked this with the understsnding as stated in the ad that it was 1 bedroom and 2 beds and slept 3. Not true as there is only 1 doubke bed and a futon that does not lie flat and a lounge that does not pull out flat.Our adult daughter had to sleep on floor.Not good and this unit is only suitable for 2,so do not beleive the ad.Also their was no electric kettle or toaster,so had to boil water in a saucepan. And no wine glasses to enjoy a wine with tge view,sorry but the onky thing good is the view and location.
"
32118	3592838	9.0	10.0	45653293	The place was very nice and we felt welcome.  The apartment was in a good location and the views are magnificent.  
32119	3592838	9.0	10.0	45935589	Nice clean place with an amazing view of the water and space needle. Host was very informative. Balcony has chairs and a table to hang out. Fast WiFi. We didn't cook, but it looks like the apartment has all the necessary kitchenware.
32120	3592838	9.0	10.0	46463948	Anton was a great host, very attentive, very helpful. The apartment was very neat and tidy and had all the amenities we needed. Fantastic views and a good location being about 10 minutes walk to Pike Market and the other nice shopping areas.
32121	3592838	9.0	10.0	46869869	We really had a great trip, and the views were spectacular. The apartment was pretty comfortable. The check in process was really easy, and Anton was very flexible with check in and check out times. The parking spot was a great bonus, and the garage seemed very secure and safe. I loved the location because it was a five minute walk to Pike's Place Market, and is surrounded by many wonderful restaurants. We walked everywhere and enjoyed our time in Seattle. We would come back.
32122	3592838	9.0	10.0	47632124	Crazy beautiful location, view and apartment!!
32123	3592838	9.0	10.0	48163987	"Awesome location, unbelievable view.  Anton met me at the place, gave me the keys, explained how parking worked quickly and painlessly.  The appliances and furnishings all worked as expected, nothing broken or damaged.

What sets this place apart is the views of the sound.  They are spectacular.  Would definitely rent again if I went back to Seattle."
32124	3592838	9.0	10.0	48676104	This was our first experience with Airbnb and it was wonderful!  Tony was a gracious host who provided everything we needed for a great trip.  He met us as a prearranged time and had everything ready to go.  The apartment was perfect for our needs - spacious and with an outside balcony that gave us a fantastic view of the water and surrounding islands.  We watched a couple of incredible sunsets from it!  The location was perfect for us as well-close to great restaurants and within walking distance of the waterfront, Space Needle and shopping venues.  Overall, a great experience! 
32125	3592838	9.0	10.0	50159913	"Stayed for a week early October 2015. Pro's: Anton helped to make our arrival easier by texting me instructions; but, he should've been THERE AT THE UNIT to facilitate our access ! The views from the unit were good. Con's: The small, 1 bedroom condo was FILTHY! It took our entire first day there to clean the slimy cabinets, microwave, sink, washer/dryer, fridge, (visible residue was on all cabinet doors, drawers, and handles) etc.... there was rotting produce left in the fridge along with 7 or 8 other old food items that should've been cleaned/removed; the food residue throughout the fridge had obviously been there for months! One of the things you'd expect from an airbnb place is the ease and convenience of a functional kitchen.....NOT HERE! There was no coffee maker and no toaster; no coffee and bagels for us! We couldn't even cook breakfast due to lack sufficient of utensils and pots and pans! ""Oh well, we'll have to go out for breakfast just as if we had stayed in a hotel; at least hotels have room service"". The toaster we bought was worth the $12, along with the coffee cone and filters ($8), the pillows ($15) and the cleaning supplies (bleach, soap, Lysol, wipes etc... $30). Well worth it considering we were living there for 1 week. Sorry future guests; we DIDN'T leave any of those things behind! We gave all those items to the homeless people directly outside the building (We didn't want Anton to get the credit for a functioning kitchen and nice, new pillows). The floors were completely covered with dirt and cat hairs; we had to mop the floors twice to get the animal hairs down to a manageable level. There is a large music venue DIRECTLY NEXT TO THE BUILDING (The Crocodile Club) with VERY LOUD acts every night! It's OK unless you like to go to sleep before 2:30 AM. The small full size spring mattress was dirty and ancient; it hadn't been rotated for years, if ever; very worn and extremely uncomfortable! Pillows were old and nasty, we bought our own pillows along with all the cleaning supplies we HAD to use! I'm envious of the tenants following us; that place has NEVER been as clean as we left it! The sliding glass door leading out to the balcony didn't have a handle on it; instead there was a crude, strap tied through the holes! It broke our 2nd day there. No screens on the windows; but the bugs were an added source of protein! Only 1 of 4 lights working in the tiny bathroom, but the fire from the candles we had to use wasn't too serious! The washer/dryer all-in-one unit was weird; it took 3 to 4 hours to wash and dry a small load of laundry; stuff smelled better going in than coming out! Please spend the extra $$$ to avoid this uncomfortable, old and unkempt unit from ruining your stay of more than 1 or 2..."
32126	3592838	9.0	10.0	51885501	Neighborhood was a bit sketchy but ok. The unit had fabulous views.
32127	3592838	9.0	10.0	52473110	Anton worked with me on my late arrival into Seattle and greeted me at the property to provide me with the keys to the unit and a quick walk-through.  The unit was easy to find and well situated in downtown Seattle.  The view is great and is represented well in the pictures.  The unit was clean.  The best part is the balcony.  Too bad I didn't have more time to enjoy it.
32128	3592838	9.0	10.0	53035505	Great apt with a great view of Peugeot Sound as well as downtown Seattle. Anton was reliable and professional, very convenient parking situation as well. All pictures are very accurate. Exceptional value here; would have spent twice as much for a similar space at a local hotel. Essentially unbeatable at this price.
32129	3592838	9.0	10.0	53587510	Anton was very responsive, helpful, and communicative.  He got me setup in the apartment quickly - the check-in and check-out process was a breeze.  I had a great time staying in this apartment... it really does have a fantastic view and location.  The space is comfortable and luxurious, especially the kitchen and bathroom.  I'd certainly stay again on another trip to Seattle.
32130	3592838	9.0	10.0	54013468	"The place was exactly as described and truly ""Unbeatable Location"". My Wife and I absolutely loved the views, nearby restaurants, bars, and overall proximity to everything. We basically walked everywhere (Pike's, Space Needle, Downtown, ETC) or grabbed an Uber once or twice. Anton was super easy to communicate with and even checked us in late due to our delayed flight in. Overall awesome experience and can't beat it if looking to be right in the middle of everything Seattle has to offer.  "
32131	3592838	9.0	10.0	55634668	Great stay, excellent location and beautiful view. Exactly what you should expect from listing.
32132	3592838	9.0	10.0	56325587	Anton was great, and very helpful, the place was clean, and overall it was a great experience. Would definitely stay here again!
32133	3592838	9.0	10.0	56412055	The apartment was clean and as pictured with awesome views. Location was great and near lots of shopping, sight seeing places, and restaurants (walking distance in Seattle is a plus). I didn't get to meet Anton but we communicated via text and directions were clear and easy to follow on how to get in and out of the apt. The apartment had floor based radiant heat and somehow it just felt a bit too cold for me and I did't know how to fix it (could be operator error here). Just an observation if you have little ones and/or get too cold yourself. Parking on site was a plus, just note that the parking space is small in case you have a big vehicle like me (it fit but it was very tight, i had to climb to the front seat via the trunk of my SUV). Only stay one night but recommend it if you are planning to stay somewhere close to everything in downtown Seattle. 
32134	3592838	9.0	10.0	56692306	"Let me start by saying this place was awesome!! The views and the photos are accurate, making this place a true gem for the money. I would stay at this place again in a heart beat. It is the perfect location for walking to most destinations. Parking is included and is in a locked parking garage which makes you feel secure. It was wonderful working with Anton. He allowed for easy communication and was very flexible with our check in and out times. It kind of feels like you're borrowing a friends place for the weekend. We didn't see him but once and only had communication when there was a need regarding check in and out times. I struggled on the 4 vs 5 star rating with this review because I LOVED this place; however, there were a few items in the unit requiring maintenance (such as lights and a missing door handle for the balcony). I'm sure he will have  those fixed in no time and the place will return to a 5 star stay!

For those of you who like some (email hidden) husband and I were only staying for 1 night. We really enjoyed the Pike's place market (Matt's was delicious!) be warned, though, several places require a reservation to get a seat as they stay very busy! We also enjoyed the space needle lookout and the Underground Seattle tour (I wish we had more time in this area as there were several nice local odd/in stores). Lastly, my husband really liked dropping in at the Crossfit Gym that's also within walking distance of this unit."
32135	3592838	9.0	10.0	56794179	Anton was very helpful and attentive. The apartment and neighborhood are fabulous. I am from Seattle originally and loved staying at Anton's place. The view from the apartment is incredible. Anton was a great host. I would definitely stay here again. 
32885	1163345	9.0	9.0	5003632	Great location. Nicely renovated space. The neighborhood is a little noisy, but hardly the fault of the owners. Had a great stay. Recommended. 
32886	1163345	9.0	9.0	5280177	"Darcy and Sean are absolutely fantastic. Great hosts and the apartment is clean and tidy. There is a full kitchen (although no microwave) and laundry facilities (SO helpful!)

The only drawback about this place is that it's very noisy - it's right over a club - and that the neighborhood isn't very nice. 
There are lots of homeless people on the streets surrounding the property and you might want to be a little cautious if you're travelling on your own.

All that being said though, if you know that the neighborhood isn't perfect, this apartment is excellent. And, as one of the other reviewer's said: the location really isn't the fault of either of the hosts! They're marvelous :)"
32887	1163345	9.0	9.0	5328643	"Darcy is awesome. So welcoming and friendly. No hassle getting in or out of the space. It was spotless and everything was incredibly comfortable. The space was great. And the price was just right.
Let me say this though. There is a club downstairs. And it can get very loud on the weekend. So if you aren't prepared for that or have kids I would suggest not staying at this location."
32888	1163345	9.0	9.0	7189324	The reservation was canceled 3 days before arrival. This is an automated posting.
32889	1163345	9.0	9.0	7464194	"Darcy and Sean is a very very nice!!
A description of the house was well haejugo friendly.
Flight delays due to late check-out requests was for.

Apartment historic Pioneer Square
location is very close Downtown-
Was comfortable and clean.
Although the noise itgin Club...
If you're not keen on the sound is recommended.

Length of stay is shorter ahswiwotda.
If the opportunity presents itself again, I want to go next."
32890	1163345	9.0	9.0	7511852	"Darcy's apartment was clearly beautifully renovated recently and it was perfect for our stay.  An excellent location for anyone traveling for football and baseball-- or any kind of tourism; we saw multiple tour groups passing by to talk a little bit about the building and area.

Have a beer at the Merchants Cafe!  Darcy and her colleagues made us feel very welcome and I look forward to staying again on a future trip."
32891	1163345	9.0	9.0	7805588	The reservation was canceled 50 days before arrival. This is an automated posting.
32892	1163345	9.0	9.0	7838347	The apartment was very cool and well located.  Darcy was a pleasure to work with.  The restaurant downstairs is tasty!
32893	1163345	9.0	9.0	8084373	This was my first time using airbnb and it was great.  I had a great trip Darcy was there to meet me even though my times keep changing. The apartment was above a club so I was expecting it to be loud but it was so not a factor. The apartment is in a great location and close to the light rail which made it really convenient.  Darcy also allowed me a late check out.  All in all I would give my stay a 10 out of 10. I would definitely stay there again.  
32894	1163345	9.0	9.0	8373107	Awesome stay, great location, easy check-in/check-out!
32895	1163345	9.0	9.0	8825436	Darcy and the place were both wonderful!  Darcy's bar and restaurant downstairs was both tasty and convenient. Darcy was so easy to work with and went out of her way to make our stay extra-special.  Great location too!
32896	1163345	9.0	9.0	9505003	"I went to Seattle for a Seahawks game and rode the train up.  This location couldn't be more convenient for arriving by train or for attending games at the stadiums.  It's right on Pioneer Square, and walking distance to more bars, restaurants and activities than you could possibly do in a weekend.  

The place was clean, the bed was fine, and access was convenient. It had free wifi and coffee available.  Very nice.  

Darcy and the team at Merchants Cafe were friendly and helpful.  

Only downsides: there is a nightclub just below this apartment that thumps pretty good until the wee hours on weekends.  If you're a light sleeper, that may be a problem.  Also, since the place is in Pioneer Square, there are plenty of homeless folks around. Like homeless everywhere, they are mostly harmless, just trying to make a living in their own way.  "
32897	1163345	9.0	9.0	10685738	"I stayed at Darcy's apt. with three other young women for a conference that was being held at the Convention Center and we had a great experience. We are students on a budget so this apt. is a great value. Checking in and out was very easy because we picked up and dropped off the (email hidden) downstairs. Darcy was very responsive, flexible and a great host! 

Hop on the light rail at the aiport for about $3 and get off at Pioneer Station which is a 5-minute walk to the apt. The apt. is about a 20-minute walk to the convention center or a $7-$10 cab ride and is also very near to the International/Chinatown district. It is a 10-minute walk to Pike Place. 

I would say it can comfortably fit four people. Two of us shared the queen bed in the bedroom the other two stayed on futon mattresses in the living room. 

Some tips for travelers: We packed light and was able to wash our clothes in the washer and dryer. It was great to have a kitchen. We bought food at the Target on the way to the convention center so we could save money on lunch when we were at the convention center to use later for all the great eats Seattle has to offer. I would also recommend looking into car2go and registering an account before you go to Seattle so you can rent smart cars by the minute to navigate around the city. They'll send you a card to unlock the cars in the mail.  

Like the other reviewers said, the music downstairs can get loud, but we were so tired from our days exploring the city and attending the conference that sleeping was not a problem at all. If it is for you, this may not be the place for you. But, if you're looking for a great place for a great value with an awesome host, book it!"
32898	1163345	9.0	9.0	10854711	"
Very nice room to stay and Darcy is a very friendly lady. I changed my schedule last min, but Darcy is very kind to help me get my key to check in. When I arrived the house, I was surprised I got a whole apartment with one living room, one kitchen, one bedroom and bathroom. Wash machine and dry machine are available, all cooking facilities are available in kitchen too. There's TV and DVD player in living room too. The sofa in living is bendable, I guess it could become a bed. So this apartment could fit 4 people maxim. 

The building is next to Underground tour center, just cross the street. Darcy's cafe bar is downstairs. Starbuck is only 1 min away, 7/11 convenient store is 2 min away, a very interesting kid toy store is 2 min away, also some good clothing store around. I really like a restaurant named Bengodi, Italian food, only 3 min away, I went twice in two days.....haha

Taxi is accessible, Darcy helped me to call yellow cab, only 5 min waiting. Bus is also around, 3 min walking to bus station, get #1, #2, #13  to city center and space needle. King Street station is 10 min walking distance or spend 5USD taking taxi. 

There is a big parking area next to Darcy's house too, very convenient. 

Pike market is not far away, I was shopping and walking on the way back from Pike market to Darcy's house, there are many stores on the way. "
32899	1163345	9.0	9.0	11159066	Our stay at Darcy's place was amazing. The check in and check out processes were very smooth. We were comfortable during our stay and will stay again in the future!
32900	1163345	9.0	9.0	11372033	I recently traveled to Seattle to attend Emerald City Comic Con and I wanted to stay somewhere centrally located in case I wanted to hang around the city. The convention center is a short 20 minute walk from Darcy's place and you can also use public transportation if you don't want to walk.  Darcy was very helpful and cordial. I had read previous reviews commenting about the noise, but this was a non issue for my family and I.  I sometimes have trouble falling asleep after an exciting day, but this was not the case at the apartment. There is some noise due to the fact that you are in a city but it isn't a big deal. I would certainly recommend this nice and clean apartment. 
32901	1163345	9.0	9.0	11484631	The rental was smooth and without a hitch. It was a nice one-bedroom apartment with a kitchen and washer & dryer (a big plus). As an added bonus there was even a bar downstairs. Very positive experience overall.
32902	1163345	9.0	9.0	11560471	"Wonderful place, centrally located... Walk to Pike's Place Market, restaurants, groceries, nightlife, etc... Easy access, safe, comfortable.  Darcy was a great host, helping to accommodate us, by providing assistance in stocking some light groceries prior to our arrival. 

Only difficulty is parking.  "
32903	1163345	9.0	9.0	12032862	This was an awesome space! I felt safe and the room was clean. The shops in this area of town were also very quaint as are the places to eat. The host was nice and her staff great. I would stay again and may soon. 
32904	1163345	9.0	9.0	12093389	Darcy is a very personable and helpful host.  The accommodations were just what I was looking for. The place is interesting, comfortable, well-located, well-priced, clean, fully-equipped and with help/service nearby.  I slept well!
32905	1163345	9.0	9.0	12444334	Great space, great location. Easy to work with. Cheers!
32906	1163345	9.0	9.0	12831480	My wife and I had an incredible anniversary weekend at Darcy's apartment. Right from minute one she was helpful and friendly. We got to the apartment from the airport later than expected and didn't have much time to eat before the march to the Sounders game started. Darcy immediately helped us out by putting in a stat order for a couple burgers and even let me wear her Sounders jersey to the game. The apartment was in the most perfect location - easy walking distance right in between the stadiums and Pike's Market. The music from the club next door really wasn't an issue at all and Darcy will continue to make things better and better with the sound proofing the apartment. It seemed like every accommodation was thought about and taken care of - towels, linens, pots/pans, dinnerware, even shampoo and conditioner. I would HIGHLY recommend staying at this apartment. Not only was it beautiful with the natural exposed brick walls and high ceilings, but Darcy was amazing and helped so much in making our experience unforgettable. 
32907	1163345	9.0	9.0	12931727	"The apartments are clean and spacious. Darcy is a friendly host. We had a lunch in her restaurant. It was tasty.
It was vary interesting to leave in this home, cause home is very old. But it well designed and it had everything we need."
32908	1163345	9.0	9.0	13764145	"This place is so awesome and Darcy is a great host.  I was transitioning from one Airbnb to another.  I didn't think it could better, but I was so blown away by the room, location, amenities (including a bar right downstairs) and the host. 
Backpacking it? Need to do wash? There's a washer and dryer!  I came downstairs for a beer while I washing clothes and Darcy picked up the tab!  So nice.
The room has tons of character and charm.  Super clean. If you're hanging about Pioneer Square, Pike Place or Belltown.  This is a great place to stay!"
32909	1163345	9.0	9.0	13935532	We stayed at Darcy's only one night, but wish it was longer! Getting in was so easy, and the (email hidden) downstairs were so friendly! The location could not be better, and the suit itself was clean and comfortable with all amenities. There was even a parking garage right across the street. We would definitely book again!  
32910	1163345	9.0	9.0	14268803	Did not have a chance to meet Darcy, but working with her over email was very easy.  Checking in and out at the Merchant's Cafe was also a breeze.  The unit was very charming and had all the amenities we could ask for (including washer and dryer!).  The only downside, as others have mentioned, is the Trinity club nearby that has music playing until approx 3:30a, but since we knew about it ahead of time we planned around this.  Great location and price, and the unit is comfortable.
32911	1163345	9.0	9.0	14368506	We loved our experience!  So cool to be in such a historic building.  Great location and so fun.
32912	1163345	9.0	9.0	14477653	"What a great place, people and overall atmosphere in the heart of Pioneer Square!
We loved the room and was super comfy in all aspects.  The folks working downstairs in the cafe were excellent and always there to help answer questions or needed anything.  Darcy  is wonderful.  There was a renovation(carpet and paint) in hallway but staff were apologetic and very kind and the renovation is looking great!  Cannot wait to come back and visit!  If you want to be in the heart of Pioneer Square; this is the place."
