	home_id	scores_cleanliness	scores_location	review_id	comments
1874	1148517	9.0	10.0	5124856	The reservation was canceled 43 days before arrival. This is an automated posting.
1875	1148517	9.0	10.0	5326752	Great little house! We had a perfect stay and loved being close to the action in Ballard. Also loved the outdoor space.  Fleur was extremely helpful in helping us plan our trip. 
1876	1148517	9.0	10.0	5419666	I loved staying at Fleur's house.  It is in my favorite part of the city, Ballard neighborhood!  It is a lovely and comfortable home.  She had everything I needed for my 5 day stay.  I would definitely stay there again!
1877	1148517	9.0	10.0	5662749	Fleur was easy to make arrangements with, and her cottage is a perfect, cozy place to stay in Seattle. The location is convenient to so many great neighborhoods and activities. Thanks Fleur for a wonderful stay!
1878	1148517	9.0	10.0	5761322	Fleur's place was perfect for us and we were really happy we decided to stay in Ballard so we could spend our two days in Seattle exploring this great neighbourhood. Fleur's place was really well located, easy walking distance to everything. It was also full of character and felt very  homey. It was a pleasure meeting Fleur towards the end of the trip.
1879	1148517	9.0	10.0	6130583	Fleur is a great host. Easy to communicate with and very accommodating. Her place is close to all the action in Ballard. The house is well equipped, spacious, and comfortable. I would recommend her place to anyone visiting Seattle.
1880	1148517	9.0	10.0	6459292	Absolutely loved Fleur's little Ballard cottage! (We would have left you flowers, Fleur, but we ran out of time!) My girlfriend and I stayed a weekend as we attended a workshop in the Greenwood area and this was the perfect hide-out. Market Street with it's coffee shops, restaurants and bars is all within easy walking distance. The house was lovely and clean... and the little kitchen well equipped. I will definitely stay there again!
1881	1148517	9.0	10.0	6684715	What a terrific location! We loved it~it's an especially perfect house for someone who is young and laid back. We walked all over Ballard to restaurants, Ballard Market, Farmer's market, galleries, bars...it was great. Took the bus to the city and Car2go is a a good alternative,too. We had rented a car and never had a problem with parking out front. 
1882	1148517	9.0	10.0	7013942	Fleur's cottage was very clean and comfy. It is in an excellent location central to everything in Ballard. We would stay there again next time we visit the city. 
1883	1148517	9.0	10.0	7180188	Fleur did a great job of creating a cute and comfortable home for us to stay in. Her cottage is convenient to Seattle hotspots, not least of which her immediate neighborhood. The beds were comfortable and she was a friendly and accommodating host.
1884	1148517	9.0	10.0	8540222	Fleur's place is awesome! You couldn't ask for a better spot in Ballard. I look forward to coming back again.
1885	1148517	9.0	10.0	8665473	Fleur's house was perfect!  Very cozy and great location.  1 block to a grocery store and great breakfast/coffee place, and lots of restaurants just a couple blocks away.  Both the bed and futon were comfortable (4 female friends slept there comfortably) and the house was charming.  I highly recommend it. 
1886	1148517	9.0	10.0	9133912	Such a cozy place, everything we needed for our weekend get away and a perfect location to hanging out in Ballard. Fleur was very helpful and accommodating to our plans.
1887	1148517	9.0	10.0	9191997	We stayed at this cute outage in Ballard during a visit to family there. The cottage is in a great location, close to shops, cares and restaurants.  The cottage was clean and comfortable.  We hope to be able to stay here again next time we visit!!
1888	1148517	9.0	10.0	9404143	"Fleur's cute house was wonderful for our stay over Christmas.  Everything was so clean and cozy....  We did a little cooking and even walked to Old Ballard for dinner. 
Thanks Fleur!       We had a great stay!"
1889	1148517	9.0	10.0	10290414	In spite of record-setting cold weather, Fleur's cottage was warm and cozy when we arrived!  Everything was great, and we really enjoyed our stay.  We'll probably stay here again, as we regularly visit the area.
1890	1148517	9.0	10.0	11181523	Just finished a weekend trip at the cottage with another couple. There was enough room for all four of us and the location was within walking distance to great pubs and restaurants. We didn't get a chance to meet fleur but her home was a great spot and a welcome change to a tiny hotel room. No issues, great trip. 
1891	1148517	9.0	10.0	11880075	The reservation was canceled 22 days before arrival. This is an automated posting.
1892	1148517	9.0	10.0	13454383	The cottage is exactly as pictured ... a little house with 2 bedrooms, a separate living room and kitchen and a little back yard.  You are a block away from food, coffee, etc.  Fleur was a great host.  We enjoyed our stay and will stay again next time in Seattle.
1893	1148517	9.0	10.0	14348655	Enjoyed our stay.  The beds were comfortable and the location cannot be beat.  There was a fully stocked kitchen although we only used some glasses and French press.  24 hour grocery within 2 blocks and we walked to restaurants, too.  Fleur met us there and she was very nice and filled us in on what to do.  She also answered our questions during the stay via email.  Highly recommend!
1894	1148517	9.0	10.0	15186583	"Great location and great place if you have kids. 

Walking distance from anything you might need and less than 10 minutes to downtown. Lost of parks in the area and very family friendly."
1895	1148517	9.0	10.0	15685785	Fleur's home was a wonderful place to relax and unwind during our trip to Seattle for a wedding. Her home is cozy and offered great space for the four of us who were staying there. The location was fantastic, as it was a 10 minute walk to the actual ceremony. The bus took us straight to Pike Place market in a direct route and allowed us all to see parts of the city we normally passed by on the I-5. We spent Saturday morning in Ballard at the markets and had a surprisingly great breakfast from the Smoke Shop diner. We were all very happy with our experience, spending a beautiful, hot weekend in Seattle.
1896	1148517	9.0	10.0	16202192	Our group of 4 visited Seattle and had a very comfortable stay at Fleur's cottage.  The neighborhood was great for walking to get dinner/drinks after a long day out.  The living room/kitchen area was roomy enough to hang out and chat or have a few beers too.  There is even room to sit outside.  All of my friends loved the cottage and, to my knowledge, slept comfortably.  We definitely chose the right accommodations for our trip.
1897	1148517	9.0	10.0	16973683	"My family really enjoyed staying in Fleur's cottage. It was clean, charming, and comfortable. Its location was really great - a convenient walk to a very good grocery store and perfect for exploring downtown Ballard. The whole family walked to the Farmer's Market on Sunday morning. Given the very warm weekend, we thought the house stayed cool enough to relax in during the afternoon, ventilated only by fans.

Fleur was also a pleasure to work with in renting the cottage. She was very quick to respond to messages and left very organized and clear instructions in using the cottage's amenities.  "
1898	1148517	9.0	10.0	17437752	Fleur's cottage couldn't have been a better find. The location was perfect, one block from a grocery store and 2 blocks from the center of Ballard. The house had everything we needed and was very welcoming. The rooms and amenities were as described and we definitely felt like we were staying at a friend's house. We'd love to stay again next time we travel to Seattle.
1899	1148517	9.0	10.0	17851459	"Fluer,
Loved your information book for guests.  Very helpful.
This is a charming cottage & we enjoyed our stay.  Thanks for calling to check with us that all was OK.
This home is conveniently located, close to Seattle downtown, & Ballard has a charm of its own, with some excellent restaurants, & a particularly good children's toy store, Clover.
Ballard Farmer's Market is great.  Much smaller than Pike Street Market, with more charm, & smaller crowds.
Due to the number of steps up to the cottage, it would not be convenient for those with disabilities."
1900	1148517	9.0	10.0	18358478	"Wow what a great place! Unfortunately we did not get to Meet Fleur as she was away for the weekend, but she made a great remote host. She was communicative from the beginning and continued to be so during our stay. 

The place was perfect for our needs. The two bedrooms were exactly what we needed for both couples on our trip and each had comfy beds. The common areas had everything we needed to unwind in-between outings (the new couch in the living room is über-comfortable) and the whole cottage had a great cozy atmosphere. It felt lived in and loved, but was still neat and clean. I particularly enjoyed the art and decorations (props for the skateboards and theater seats!) scattered throughout. Something to keep in mind is that this is actually a cottage and not a full-sized house, but as long as you don't have large group, or don't mind doubling up, it's perfect. A picture of this place should be found next to the dictionary definition of quaint :)

As for the location: Parking was really the only aspect that left more to be desired, however this was mostly due to a lot of construction in the neighborhood, and Fleur was very upfront concerning this. The cottage is located in a sweet neighborhood called Ballard about 10-15 min away from downtown, but has a bunch of stuff to do and see in its own right (which Fleur was happy to list out in her extensive info binder) and we had just as much fun exploring the surrounding area as we did the usual tourist hangouts. 

I definitely would not mind staying here again, and in all likeliness will probably seek it out on my next trip to the area. "
1901	1148517	9.0	10.0	18880143	"We loved our stay at Fleur's place.  It was clean, well-supplied, cozy and welcoming.  Very pretty too and the location was so convenient.  Just a block to many facilities in Ballard.

The 4 of us felt that we were at our own home and our 4 days passed too quickly.  We give the cottage our highest recommendation."
1902	1148517	9.0	10.0	19223308	"Our group of four enjoyed staying at Fleur's cozy home.  It is very conveniently located near bike trails, the locks,  and the community center where our training was held.  It is also a short walk from wonderful dining options which Fleur nicely outlined in her welcome book. 
We especially loved her quaint and well equipped kitchen! The cast iron skillets were a huge bonus! We loved the fresh flowers throughout her space. There was plenty of space in the refrigerator too (perfect for the daily meals we prepared).
The shower had good water pressure,  and the bedrooms were comfortable.  We appreciate having the fans as one of the rooms got hot during the night. 
Although we never met Fleur, we felt very much at home in her space. She checked in with us the day after we arrived and made herself available via phone of we needed. 

We did arrive at her home later than we had originally planned so, it was dark, parking was a bit awkward, but we were able to work things out.

We would definitely recommend Fleur's cozy cottage as a great place to stay and a very reasonable price!"
1903	1148517	9.0	10.0	22558312	We really enjoyed the Ballard neighborhood.  We were able to walk to alot of restaurants, coffee places and shopping.  The house is in a nice, safe enviroment.  It has street parking, so sometimes couldnt park right in front but no problems finding a spot.  The house was nice but a little cool in the livingroom, luckily the room had a heater.  
1904	1148517	9.0	10.0	26621128	We had a wonderful stay at Fleur's home. It is the perfect size for two couples and is very conveniently located. We had no issues with parking. Fleur was very responsive and provided great recommendations. We would stay there again in a heartbeat!
1905	1148517	9.0	10.0	32428673	Fleur went out of her way to welcome us to her cute cottage on very short notice when we came to town after the birth of our grand baby. The cottage was perfect for our needs, clean, great location, and very cozy. The neighborhood was quiet, and walking distance from anything we needed. We would very much recommend this cottage, and Fleur as a gracious host.
1906	1148517	9.0	10.0	33331717	"Staying at Fleur's place was a real pleasure for us. Located in one of the nicest areas of the city, we felt at home immediately and enjoyed our evenings in the house a lot. It is a very clean and tidy place with more than enough room for four to five people to stay in. Communication with Fleur was a bit difficult as she was not in the house and could not be contacted via phone but we were able to communicate with her upon our arrival, so that was not a big problem either.
Overall, I would definitely recommend the cottage if you are looking for a neat little place in one of the nicer and less busy areas of the city."
1907	1148517	9.0	10.0	33640144	The host canceled this reservation 38 days before arrival. This is an automated posting.
1908	1148517	9.0	10.0	34498652	Upon arriving at Fleur's place, we were happy to find a clean cottage with all household items provided. The beds were very comfortable and the other rooms were just perfect for our needs. The cottage is located within walking distance to everything in Ballard. Unfortunately  we did not get to meet our host Fleur but were able to communicate as needed. This accommodation was perfect for us and we would definitely recommend this place to others. 
1909	1148517	9.0	10.0	36023890	Fleur was very welcoming and met me for a tour of the place before my family arrived, who would be staying at her place. The house was very clean with plenty of linens and kitchen tools. The location was wonderful because you can walk to downtown Ballard in 3 blocks!
1910	1148517	9.0	10.0	36568485	Fleur's home was just as described.  Our family of four was really comfortable and enjoyed all the great neighborhood of Ballard had to offer.  We hope to come back again soon.
1911	1148517	9.0	10.0	39047452	Great peaceful little sanctuary in Ballard. Fleur was easy, flexible and professional. Absolutely recommend!
1912	1148517	9.0	10.0	39958933	We had a really lovely stay at Fleur's home in Ballard, great location for someone who wants to explore this neighborhood! Super easy check in & out! Really cozy feel, would definitely recommend!
1913	1148517	9.0	10.0	42854888	Great location and super cute place! Fleur was a very sweet host and made us feel so welcome. 
1914	1148517	9.0	10.0	44299505	Our family of three had a magical time staying at Fleur's place. She clearly is good at what she does.  The place is so charming and accommodating.  The neighborhood is highly walkable, and street parking was never an issue.  Thanks for providing such delightful accommodations for us, Fleur. 
1915	1148517	9.0	10.0	44911122	Fantastic place in a fantastic neighborhood.  Great cottage within walking distance of shops, bars, restaurants, and grocery stores.  Clean & cottage with all the amenities you would need.  Would stay again in a heartbeat.
1916	1148517	9.0	10.0	45835915	Our group of four had a wonderful stay in Fleur's sweet little cottage in Ballard. The cottage was clean and comfortable, with everything we needed for a laid back weekend. The location was great, an easy walk to lots of good restaurants and bars. Highly recommend!
1917	1148517	9.0	10.0	46935236	We loved staying at Fleur's house! Our beds were comfy & we love Fleur's cottage style. Everything we needed was available. Eateries and entertainment are only a couple of blocks away. Parking skills come in handy! Thanks Fleur! We enjoyed our stay.
1918	1148517	9.0	10.0	47806143	Thank you for the wonderful cottage.  We loved the lcoation in Ballard and loved the homey feel of this place.  Fleur also left a book with great recommendations of places to go and see in the surrounding area!
5226	5671843	9.0	10.0	28859070	The reservation was canceled 2 days before arrival. This is an automated posting.
5227	5671843	9.0	10.0	29805704	"Emiliya's room is very pleasant, very comfortable, and is in a great location. Ballard is one of Seattle's up-and-coming districts and Emiliya's house is a 10/15-minute walk away from dozens of excellent restaurants and interesting stores. Overall, this is very good value accommodation for the price. 

We only stayed one night at Emiliya's place, but she did everything she could to make us feel welcome and help us get around. We particularly appreciated the fact that she let us use her parking spot for several hours after we had checked out, so that we could hang around Ballard for brunch before leaving town."
5228	5671843	9.0	10.0	29902240	The reservation was canceled 33 days before arrival. This is an automated posting.
5229	5671843	9.0	10.0	30170198	Great experience! Host was very friendly and hospitable, and the room was very clean, quiet and comfortable.
5230	5671843	9.0	10.0	30432662	Emiliya was a great host and the room was clean and nice. It was also in a good neighborhood.
5231	5671843	9.0	10.0	30593604	"Perfect location, lovely art everywhere, private and clean room just as advertised. Emiliya is a wonderful host and I look forward to a future stay.  

Thanks Emiliya! Was just what I needed."
5232	5671843	9.0	10.0	30815972	Emiliya was a gracious host to my two out of town guests. They felt at home and loved her morning coffee service. The room was quaint and the location perfect for ease of getting around Ballard.
5233	5671843	9.0	10.0	31241355	A sweet little spot within easy walking distance from downtown Ballard.  Emiliya was welcoming and kind, and the accommodations were homey and comfortable.  
5234	5671843	9.0	10.0	32589016	Really nice place to stay especially if you appreciate tasteful paintings. Great location if you like Ballard, have a car (easy and free street parking) or don't mind taking the bus to go downtown - which runs all the time. Great experience overall
5235	5671843	9.0	10.0	32867476	Emiliya was so very accommodating to my sister and I. We just needed a quick place to stay for the night on our way out to the Cascades and Emiliya could not have been sweeter about our very* late arrival and super early start. Day break french press coffee and fruit!! 
5236	5671843	9.0	10.0	33381570	It was fantastic and you were a great host. I appreciate you being communicative and all the goodies you left out were very considerate. I can't recommend you more highly. 5 stars. 
5237	5671843	9.0	10.0	36273924	I was in this cute city for the summer internship at Amazon. With completely zero knowledge of this city, I came in around 10 P.M at night. You got your own room with private bathroom. Everything is just there and I actually like how she put the bed in the corner with windows right next to it. Just image woke up in the charming-May-morning-of-Seattle, the first thing you would ever feel is the gentle breeze! Emiliya is a super friendly and easy-going lady. She helped me with everything I need and explain to me with great patience. I loved this place, right off the intersection of 15th and NW 60th street. I kinda enjoy walk for eight minutes to Leary and hop on a bus #40. I moved out to U district after my lease ends. Will absolutely miss this place! So if you are a future Amazonian or your company is located in the south lake union area, I would definitely recommend this place!
5238	5671843	9.0	10.0	36777296	Emiliya was a thoughtful host.  It was hot during our trip and she left us water bottles to use while we were out.  The space was as listed and perfect for two.  An added bonus is that her artwork is truly beautiful!  I would recommend this listing for sure.  
5239	5671843	9.0	10.0	37302214	Emiliya was a wonderful host! She was extremely flexible, allowing me to pick up the key and drop off my luggage for an early check in when I arrived in the city in the morning. Her place is on a quiet street, which I prefer, and bus stops and Market Street were still very accessible. Emiliya also offered to make coffee and breakfast in the morning. My sister and I had a lovely stay in Emiliya's home and would definitely stay with her again in the future.
5240	5671843	9.0	10.0	39379719	Emiliya's place was very convenient for me to visit family and to visit the Ballard and Freemont areas and to take the bus to downtown Seattle. Very close to bus stops, the Ballard Market and coffee shop, downtown Ballard, and the Sunday Ballard vegetable market. The perfect place to stay while visiting Seattle! 
5241	5671843	9.0	10.0	39851724	This was our first airbnb experience and it was great! The room was very comfortable and the location was amazing. Our host was great at checking with us through text messages and make us feel welcome. We barely saw her because we came in late at night and left early in the morning, but she was very sweet and we will definitely recommend her :) 
5242	5671843	9.0	10.0	40160460	Perfect! Easy check in, with no issues. Comfortable place, very clean. Beautiful artwork, too!
5243	5671843	9.0	10.0	40754998	"Emiliya is a gracious, thoughtful host.  Her home is bright & cheerful; she is an accomplished artist and her creativity and talent are nicely showcased in her living space!  

The location is wonderful. It's a short walk to many of Ballard's fun shops & restaurants, and public transportation is nearby. 

I had a great stay, and hope to return again!
I 
"
5244	5671843	9.0	10.0	41769957	"This was my first experience with AirBNB and I was not disappointed at all. Room was nice and cozy. Had a lot of well done paintings which created a nice atmosphere. Emiliya was a very nice host who was always making sure I was comfortable. Overall a great experience. 

"
5245	5671843	9.0	10.0	42036818	Our stay was very pleasant! Our room was beautiful! We would definitely like to return.
5246	5671843	9.0	10.0	43243854	"Hey Emiliya,  Thank you for being my first Airbnb host.  Your place was perfect for my needs.  I was able to be located near the venue where my niece was getting married, and also near enough to where the rest of my siblings were staying.  I loved the room, the art on the walls, the fan in the window cooling the room, the private bathroom.
You were a friendly and welcoming host, and making your home available to me was considerate and special, though I didn't really take advantage of the kitchen area.  I hope you liked the tomatoes from my garden.  If I was to come back again, I would definitely call you up and be your guest again.          Dave Berens"
5247	5671843	9.0	10.0	43414288	Beautiful art, a nice clean bedroom with a well stocked bathroom met all our needs for the stay.  In the morning a great cup of coffee was a good way to start our last day in Seattle.  We came in late and left early since we were cramming our time with activities, so not much time to interact with Emiliya.  Her place is waling distance to many good places to eat.  Try Morsel for breakfast on 15th and 60th.
5248	5671843	9.0	10.0	43651611	Emiliya was a very welcoming hostess & very responsive to any questions that I had. I stayed with her for a few days on a solo trip to the PNW & felt very safe. This was also my first time using airbnb. It was super easy to take the bus downtown & to walk to all of the restaurants/shops in Ballard. I would highly recommended staying here.
5249	5671843	9.0	10.0	44325079	"We had a wonderful stay with Emiliya. We arrived after spending six hot days in Portland (which we loved). We were happy to see that we had our own private room and bathroom attached. The bathroom is fully stocked and the room includes a big closet to hang clothes as well as hide away your luggage. There is also a fan in the window, which made for relaxing, cool nights and evenings. This is a shared space so the rest of the home includes Emiliya's things including tons of beautiful paintings so please be respectful. 

Emiliya is a fantastic host. She was quite busy painting, but still made time to chat with us and make us feel at home. She made coffee for me that was super yummy. We were allowed to use her kitchen and things to make breakfast and even decided to cook dinner one night after many days and nights eating out. Because of our lengthy travel she was even kind enough to let us do a load of laundry. 

In terms of the location, Ballard is a bit of a haul from the downtown area. HOWEVER, exploring Ballard and the marina was one of my favorite parts of our stay. There are so many great restaurants, cafes, and shops in Ballard. You have to check out Golden Gardens!!!!! We ended up using car2go to get around the city a lot. Fremont, Green Lake, Capitol Hill, etc. It was all very beautiful. I really fell in love with Seattle and have Emiliya to thank for a relaxing home base for all of our explorations. "
