	home_id	scores_cleanliness	scores_location	review_id	comments
68113	3040278	9.0	10.0	34575995	"Compact condo with all you need. Absolutely a great place to stay. From the start Jenn's communication was excellent. 

Our transcontinental flight put us in Seattle early in the day but Jenn worked to get the condo ready for us early so that we could tour without the burden of our belongings. Although we weren't able to meet in person, Jenn made it easy for us to feel at home. 

Jenn's place is very comfortable, features a great view of the Sound and the Olympic Mountains when nature cooperates (as it did for us).  The condo is in a great location and Jenn's recommendations list on restaurants was quite helpful.  Jenn was always just a text message away. 

Jenn, thanks very much for your concern relative to our comfort, for your recommendations on things to do and see and for the fresh fruit!"
68114	3040278	9.0	10.0	34690264	Access was made very easy despite late arrival.   Great location with views just as promised. Much personal type stuff around the apartment which gives the definite feeling of staying in Jenn's home despite having the whole apartment to ourselves.
68115	3040278	9.0	10.0	34849101	Jenn's condo is gorgeous, it is close to so many touristy things, we walked everywhere. It truly was like staying in a friends home. Jenn's communication was amazing, she really cared about our experience in Seattle. Just remember people, you are a guest in a home, make sure you treat her home with the respect it deserves. Leave it as beautiful and clean as you found it.
68116	3040278	9.0	10.0	35382156	Although I only stayed one night at Jenn's apartment, it was still a great experience. It has a great location where you can walk to all of the major sights. Major benefit that it has a parking space - just leave your car there and walk everywhere! There was a bit of confusion in the time before we got our keys to the place and parking garage because there wasn't any available street parking nearby. One of us ended up sort of parking illegally while the other person grabbed the key. Finding the right garage door took a couple of tries too, but once we were settled in it was well worth it. While I did not meet Jenn, she was available for all of my questions. The apartment is clean, comfortable, and homey. Another benefit for me was being able to do laundry inside the apartment. Also, the view is amazing! I loved seeing the water from the living room and balcony. All in all I would definitely would recommend this place. 
68117	3040278	9.0	10.0	35535244	Jenn's condo was everything we expected and more. Description and photos are very accurate and might not due the space justice. Walking distance from downtown or a $5 Uber ride. View and beds were first class. Can't thank Jenn enough for her correspondence and hospitality . Would not think twice about staying here again. Loved our stay
68118	3040278	9.0	10.0	35665998	"Jenn is a great host! Great place! Great city!

Would definitely stay here again!"
68119	3040278	9.0	10.0	35999963	We can't say enough about Jenn and this apartment. It was perfect! Clean, comfortable and the most amazing location. We were absolutely thrilled with everything. And while we never got to meet Jenn she answered our many questions and took good care of us. 
68120	3040278	9.0	10.0	36167955	Jenn was a lovely host at an amazing apartment. She provided super tips on local eats, where to go and what to avoid. Special shoutout to the balcony views, a perfect place to watch the ferrys at sundown.  Would stay again. 
68121	3040278	9.0	10.0	36282280	Jennifer was a fantastic host!!  She was very accommodating and had tons of ideas for first time visitors. The home was exceptional!  Super comfortable beds, all you need in the home in the way of accommodations, and boy oh boy... that view!!!!  If we ever move here we will try to buy this condo from her as it was perfect in every way. We will definitely stay here again! 
68122	3040278	9.0	10.0	36814822	Jenn and Jenns place were fantastic.  Beautiful place, perfect to see the waterfront.  Jenn was extremely well organized and getting in was a breeze.  I heavily recommend staying here.
68123	3040278	9.0	10.0	36938766	Jenn was amazing.  She let us check in early, let us leave the car in the lot late, left unbelievable amounts of information about the city for us to read, and was easily reachable.  What's more, these pictures do not do this condo justice.  It is unbelievably beautiful and comfortable.
68124	3040278	9.0	10.0	37128863	Jenn was very easy to work with.  She made sure the condo was very clean upon our arrival.  She was able to be flexible with our travel schedule, making our stay that much more comfortable.  The condo is very homey, and there was lots of good, easy to find information so we could maximize our time there. Definitely will consider staying again, should we need a place in downtown Seattle.
68125	3040278	9.0	10.0	37295908	Not much else can be said but phenomenal.  The two bedroom unit has an amazing view, wonderful kitchen to cook, and just a lovely ambiance to relax and enjoy.  Highly recommend NOT renting a vehicle if able to walk on foot.  Just minutes (walking) to EMP and downtown.  Would highly recommend this place, and hope to visit again. Seattle is gorgeous! 
68126	3040278	9.0	10.0	37637820	Jenn's condo in the Queen Ann section of Seattle was perfect...great location, an amazing view day or night as advertised and a comfortable, beautifully decorated apartment with everything we needed for our stay. Jenn herself was great, providing us with lots of useful info and suggestions. It was a pleasure to have the chance to meet and chat with her.
68127	3040278	9.0	10.0	37751797	Great place - very convenient location!  Jenn was great about providing information about check-in and lefts tons of info in the condo regarding restaurant recommendations, places to go see, etc.  It was pretty warm when we were there, and there is no a/c, but she did leave fans there, and in the evening there was a nice breeze due to the location so we were fine.  Would definitely stay here again!
68128	3040278	9.0	10.0	38253653	Great view and Jenn was available to help with any questions we had!  
68129	3040278	9.0	10.0	38406169	Amazing place, great location. Would definitely stay here again and Jenn was so helpful and friendly!
68130	3040278	9.0	10.0	38579701	"Jenn communicated fully and immediately once our booking had been made, as well as throughout our stay. She has plenty of guides and materials about the city of Seattle on hand, and she is complete in her instructions about the condo. The photographs and descriptions of the flat are detailed and accurate. The neighborhood is quiet and the condo is situated very close to the sites and the bustle of the downtown. The view from the small balcony is wonderful--we sat out there for coffee in the morning and for drinks well into the evening. The condo itself is outfitted with everything you might need. We would definitely book to stay here again. Thanks for such a wonderful time! 
"
68131	3040278	9.0	10.0	39142285	"100% recomondation to all visitors of Seattle. 
Pros: all sightseeing could be done by foot, great view from the balcony, style of the flat
Cons: none"
68132	3040278	9.0	10.0	39738437	Awesome time.   Location great.  We walked to pike place market through sculpture park.  We walked to space needle.  We took bus to safeco field.  We had rental car and ventured to Fremont woodland park Rei store and Ballard locks.  Jenn place center to it all. 
68133	3040278	9.0	10.0	40194105	A great place to stay, with a lovely view.  Lots of handy hints and whimsical notes left by Jenn were so helpful.  
68134	3040278	9.0	10.0	40419068	'Amazing View' was everything we wanted for our stay in Seattle.  The apartment has a great view of Elliot Bay and the shoreline was a safe walk distances away.  In this day of 'IKEA' furnished places, it was refreshing to stay in a place that was personalized and comfortable.  
68135	3040278	9.0	10.0	40568113	"Jenn's place was terrific-the view and location not to be surpassed!
Everything we needed-"
68136	3040278	9.0	10.0	41192906	"First, let me say that I would recommend this listing to anyone.  It is conveniently located and a quality apartment at a fair price for the location.  I felt the host was a very good communicator and very prompt in her responses.  Any questions I had were promptly answered and she always made herself available.  

I liked the following things about the apartment: 1) The view off the balcony.  You can seat two on the balcony and honestly if I was sitting in the apartment it was on the balcony. 2) The host has many kitchen items available for use if you would like to cook. 3) There is onsite parking in a secure garage.  You never have to worry about your car.  4) The location is a couple blocks from the Space Needle and the Science Center.  In a whim we decided to go to an IMAX movie and it was a 3-4 block walk.  5) Pike Place Market is about 1 mile away.  We took a cab/Lyft/Uber to the market and walked back.   6) There was a large grocery store nearby if you need anything. 7) The furniture was classy looking and comfortable.  8) The wireless internet was fast and reliable.

Only one thing struck me as a (email hidden)ere is no air conditioning.  This is clearly stated in the listing so there is no deception...just take note if you plan to visit in July and August.  The apartment is exposed to the afternoon sun and it heats up quickly.  This is not normally an issue in Seattle as the weather is usually cool.  But, I traveled at the end of July and August when the outdoor temperatures reached 90.  There was also no rain during my 2 week trip to the Pacific Northwest.  However, the host does have numerous fans for your use (2 in the master bedroom, 1 small one in the living room, and 1 in the guest bedroom).  After the sun went down the apartment quickly became more tolerable as there are many windows.

Overall, I would not hesitate to rent this apartment again especially at cooler times during the year."
68137	3040278	9.0	10.0	41426487	"Jenn gave a detailed message on how to arrive to the apartment. 

She met us at the garage and took us up to the apartment to give us a tour. She also gave us great recommendations of where to eat, visit, and catch a good view of Seattle. 

We walked along the waterfront to Pike's Place, it took about twenty minutes. The Space Needle and Chihuly Glass & Garden is about a ten minute walk. 

The only bummer about this place is we didn't stay longer! Would love to come back if we ever come back to Seattle. 
"
68138	3040278	9.0	10.0	41717053	Lovely unit very close to the major attractions, and it was easy to get downtown. Nice view overlooking Puget sound.
68139	3040278	9.0	10.0	42244726	Jenn's Amazing View, Amazing Location holds up to the name. We found the unit to appear as advertised in the photos,tidy and clean. It is close to the touristy activities (seattle center,space needle) and about a $6 uber ride to the sports stadiums/pike place market. Jenn has a binder she prepared with a bunch of her local suggestions on food/drink locations, the ones we tried were on point! We had a great time and the unit felt like home! 
68140	3040278	9.0	10.0	42515682	Jenn's place is fantastic - it feels very homey, has a great view and is amazingly located in a quiet neighborhood just a door away from many of Seattle's attractions. And Jenn is such a thoughtful host, anticipating our needs, answering our questions promptly and making great suggestions (that binder of hers demonstrates such care). We would definitely book with Jenn again. Thanks again for a wonderful stay.
68141	3040278	9.0	10.0	44088955	"Great host, stunning view. Jenn was very responsive, caring and very helpful indeed. The condo is in a great, lively location, walking distance to the places of interest and a great supermarket.
Best choice for visiting Seattle. "
68142	3040278	9.0	10.0	44514927	I went to Seattle with my Dad and Uncle as we try to see  a baseball game in a new city each year and this year was Seattle.  I have used various other B&B's in other city's and have had positive experiences but Jenn was above and beyond helpful.  She was in constant contact and ensuring that we had everything we needed at all times.  The apartment itself is amazing with a great view and most importantly in a perfect location...I cannot stress how great the location is.  Jenn is not joking when she says that you do not need a car.  I am 27 and my Dad and Unlce are in their 60's and do not like to walk much more than a couple blocks.  Between Uber and the ideal location of the apartment we never needed a car and were very glad that we opted out of renting a car.  The bottom line is that Jenn is most interactive, helpful and concerned host (in a good way) possible.  Combine that with her perfect location, you cannot go wrong!  Highly recommend her! 
68143	3040278	9.0	10.0	44749805	Jenn is an amazing host and her space couldn't have been better for our precruise stay.  We arrived early and she was so accommodating for a luggage drop off.  The condo is in the heart of Queen Anne and within walking distance to all the touristy attractions.  The view was wow!  It was also very nice to have coffee and all the condiments available.  Jenn was just a text away at all times and her dinner recommendations were perfect.  We much enjoyed our stay and will be back!!!
68144	3040278	9.0	10.0	45233806	"What a beautiful condo! More amenities than I even have at home - no detail went over looked! So well decorated to make you feel completely welcomed and comfortable. 

The view was fantastic and I wish we could have stayed longer! The neighborhood is absolutely perfect. A $6 Uber ride from the downtown Westlake station and a very brief walk to ""Seattle Center"" which has the Space Needle, Chihuly Gardens and Glass, Key Arena, and Armory which hosts an upscale food court, Children's Museum, and function space. "
68145	3040278	9.0	10.0	45492683	We were staying for 2 nights at Jen's place and we had a wonderful time. The place is very clean, with a great view and has more than enough space for four adults. It's location is perfect with everything easily accessible on foot. Jennifer is a fantastic host who made us feel welcome and was always available for questions/restaurant recommendations and so on. We highly recommend this place for everyone who wants to spend some time in Seattle.
68146	3040278	9.0	10.0	45652285	"Jenn and her place are awesome!

Her instructions were clear and easy to follow.

The condo location is pretty much perfect and is in walking distance of all the major Seattle landmarks (Pike Place, Space Needle, etc.). 

I was able to go to leisurely walk to Pike Place Market (twice), Pioneer Square, and Myrtle Edwards park along the Waterfront all within the course of a single day.

Much thanks to Jenn for opening up her place to visitors. I'll definitely be back next time I'm in Seattle.

-Jonathan Anderson"
68147	3040278	9.0	10.0	45920508	If you're looking for a place to stay in Seattle and are reading this review, stop looking and book this place! This apartment is amazing and so close to everything! You will instantly feel at home as soon as you walk in. I cannot say enough good things about it, so you need to find the rest out yourself! I will definitely be back! Thank you Jenn for an amazing stay! 
68148	3040278	9.0	10.0	46367124	We had a wonderful stay! Jenn was a great hostess; everything we needed for our stay was available. Her place was adorable and comfortable (the beds were sooo great!)  Everything was within walking distance to all the major tourist attractions. We really enjoyed ourselves and would stay again if we come back to Seattle!
68149	3040278	9.0	10.0	46487307	I couldn't have asked for a better experience than what we had with Jenn. She was warm, responsive, and accommodating from the beginning, helping us with early check-in and parking. She was always available for us. Her place in Queen Anne was airy, well-kept, and comfortable, with a fantastic view. I would love to come back and stay again! What a fantastic host and location. 
68150	3040278	9.0	10.0	46693959	"Location and unit were amazing.  Jenn was fabulous - absolutely flexible with a varying arrival time.  Lots of tips, notes, articles, on the city.  For my first time using Air BnB, it met and exceeded mine and my friends expectations.  So great to have a ""home"" to come back to after a long day.  "
68151	3040278	9.0	10.0	46907682	Jenn's place is great!  Great location, very welcoming, clean and cozy.  It was the perfect size for two couples.  We rode the train up from Portland for a Mariners game and a Seattle overnighter.  Had we stayed longer it would have had everything we needed.  We'll definitely try and book this place again.
68152	3040278	9.0	10.0	47139848	Awesome apartment with amazing views. Jenn was very helpful. Thanks for everything!!
68153	3040278	9.0	10.0	47621444	Jen is amazing!  Her directions on everything was spot on and the view was exactly as shown in her pictures.  The apartment was very much like a home away from home feel.  Felt relaxed immediately.  Loved the place, the view and the location is incredible for sight seeing like we did.  
68154	3040278	9.0	10.0	48162372	Very nice place to stay with an amazing view over the Bay from the balcony. The apartment really showes who Jenn is with a lot of personal touch. It made it cozy to stay at the apartment. Very close to downtown and the water. Jenn was great to communicate with and in the apartment you will find lots of recommendation for bars, restaurants etc.. We would stay at Jenn's again. Tanja and Carsten 
68155	3040278	9.0	10.0	48677568	The title says it all - Amazing view, Amazing location.  We had everything we needed.  Jenn was very responsive to any questions. It really felt like you were staying in a friends apartment.  We will definitely stay again the next time we are in Seattle.
68156	3040278	9.0	10.0	49006985	Wonderful place to stay. We had 4 adults that fit comfortably in the two beds. The place is walking distance to most of the tourist attractions (pikes place, space needle, lots of food) We didn't have a car and walked or used a quick taxi ride. We would definitely stay here again. 
68157	3040278	9.0	10.0	49767990	"le logement était conforme a la description donnée, les explications de Jenn sont très claires ,il n'y a pas problème pour accéder et utiliser l'appartement malgré le fait que nous  communiquons  par mail et que nous ne nous voyons pas.
l'emplacement est très pratique pour visiter la ville


"
68158	3040278	9.0	10.0	50427358	Jenn was excellent at communication and her attention to detail is outstanding. Her apartment is really nice, very homey feel and in a great location. Jenn has so much information meticulously organised in her compendium and on her listing that you don't need to stress, she has got everything covered from transport, dining through to attractions. Jenn truly is a Superhost, best so far! Highly recommend
68159	3040278	9.0	10.0	50858972	"We really enjoyed our stay at Jenn's apartment. It was very cozy for a couple with a baby and another friend. We enjoyed the view too! 
The location is excellent. It's an easy walk to the Space Needle, the sculpture garden, Lower Queen Anne, and Belltown. In quick walks from the apartment we liked the Boat House Cafe and Petit Toulouse for eats. "
68160	3040278	9.0	10.0	51264126	Such a cozy place!  I felt so warm and welcomed at Jenn's place!  Very close to the Space Needle and all it's wonderful attractions.  A quick Monorail ride away from downtown shopping and Pike Market.  Very nice! The view from the master was a nice sight to wake up to. 
68161	3040278	9.0	10.0	51735745	The reviews speak for themselves. Everyone loves this location, accommodations, and Jenn. I agree with all the 5 star ratings. If in Seattle this is a must book apartment.
68162	3040278	9.0	10.0	53831313	"Jenn's place is perfect! It has a fantastic view, and is close to everything! Seattle Center and downtown. The neighbourhood offers great restaurants and shopping, and the apartment is homey, and really nice. 2 bedrooms and very comfortable beds.
We are actually staying here 3 more days, and will return!
I highly recommend this apartment for your stay in Saettle. Jenn is also super sweet and answered all my questions immediately. Great host, great apartment!"
68163	3040278	9.0	10.0	54124410	"Jenn is a great host....she answers questions immediately and was a very flexible with our check-in and check-out.
Her apartment is a wonderful 2 bedroom, with a great view, and has everything you need. The beds are very comfortable, and we had a wonderful stay. It has an extraordinary view over Puget Sound, and is located in lower Queen Anne close to shopping, Seattle Center and restaurants!
We will definitely stay again and I highly recommend Jenn's apartment!
"
68164	3040278	9.0	10.0	54751970	Weekend trip to Seattle for a friend's birthday & booked Jenn's condo. WOW, that was a GREAT idea! Very nice accomodations & hostess! 
68328	6971260	9.0	9.0	36355252	really fast answer, uncomplicated, funny and helpfull, couch a little bit short, really nice view..
68329	6971260	9.0	9.0	38039254	Cassie was a great host, and the apartment was perfect for my quick trip! The apartment was very nice and tidy and had an incredible view of the city. Her sweet house cat was the best, so lovable and cuddly. Nothing but good things to write about my stay!
68330	6971260	9.0	9.0	38548892	"Cass's apartment is in an excellent location, about 2 blocks from the heart of Lower Queen Anne, so we were easy walking distance to lots of great restaurants, coffee shops, grocery stores, ect., yet on a street that felt quiet and residential.  The apartment was basic, clean, tidy and cute and has a terrific view of the Puget Sound.  Class left a clear note with instructions regarding wifi, TV, etc.

This is Cass's primary residence and it is her cat's only residence.  So Cass left during our stay, but her cat stayed.  The cat is very sweet but I am not used to living with cats so some of the cat behaviors were a surprise to me. 

It is a terrific spot and the photos don't do it justice."
68331	6971260	9.0	9.0	38642246	Cass was a great host. Quick to respond to any messages. Cute studio apartment in a great location, walking distance to plenty of restaurants and grocery store. House cat is friendly and loves attention. The only down side, at the time I stayed at the apt, the key was not located on property and was bit of a walk, so I ended up taking Uber since I had luggage with me. Otherwise, a great place to stay:-)
68332	6971260	9.0	9.0	39071110	The studio apt was as listed .Very quaint and comfortable in an awesome district of downtown (website hidden) easy walk to the Key arena with lots of pubs and great eating spots within walking distance .Cass was very helpfull and quick to respond with help when i got lost :)  Overall i enjoyed my visit ...Colin
68333	6971260	9.0	9.0	39547032	Cass was great. Very responsive. Listing was as described. Neighborhood wasn't particularly happening but safe and clean. Safeway nearby for groceries and bars, restaurants, nearby. Apartment itself was clean, comfortable, and had an unexpectedly nice view. All the amenities I needed. Her cat is adorable and very affectionate. Actually kind of a dog-like. My favorite kind of cat but if you don't like animals or cats in particular, look out. In whole, definitely would stay here again if I visited the Queen Anne neighborhood again.
68334	6971260	9.0	9.0	39806983	Loved my stay. The place was clean, spacious, and with a great view of the water. Her directions for navigating the building were very helpful, and she was super accommodating. Plus, her kitty is the sweetest! Best snuggler ever. Would definitely stay here again. Thanks!
68335	6971260	9.0	9.0	40829264	I really enjoyed staying here.  The studio was very charming and was all that I needed since I knew I'd be mostly out and about in the area.  Cass was very kind and checked in on my frequently to make sure that things were going well.  
68336	6971260	9.0	9.0	42160684	Cass's place was a perfect pit stop for the rest of my stay.  Chester the cat is awesome (if you happen to be a cat person like me).  Cass is easy to work with & is very accommodating.
68337	6971260	9.0	9.0	43709987	Cass was very nice and communicative. She was a great host and accommodating for my late check-in. Her studio is very clean and in a great location in Seattle.
68338	6971260	9.0	9.0	44809711	Cass met us at the agreed time and was very responsive via the site's messaging app. We didn't have any issues. The neighborhood was exactly what we were looking for (walking distance to Pike Place Market, Space Needle, EMP, etc) and had several great options for dinner and coffee. We were able to spend our entire stay without driving our car. Thanks for a fun weekend Cass!
68339	6971260	9.0	9.0	45099483	Cass was great. Had everything well put together. The apartment was clean and very comfortable. She made me feel very welcome. If you need good conversation, Chesti the cat will provide (he was also pretty playful with me... apparently thought my foot was some kind of monster). And the view is pretty good.  Also, the neighborhood's great (just a few blocks from Seattle Center).
