	home_id	num_of_reviews	num_of_sents	aspect	num_of_sents_0.5	num_of_sents_0.6	num_of_sents_0.7	sents_0.5	sents_0.6	sents_0.7
0	41401	26	121	cleanliness	56	7	7	"['She adds little touches on your arrival that make you feel very welcome, and she is charming!\r\n\r\n', 'The place is very comfortable and has easy public transport wherever you want to go in the city.', 'She adds little touches on your arrival that make you feel very welcome.  ', 'she simply went above and beyond to make our stay a good one.\r\n\r\n', 'Pina was very welcoming and did she whatever she could to make our stay as pleasant as possible!  ', 'Pina was the best, she was very accomidating to our needs as well as respected our privacy.', 'The accommodations were simple but everything we needed.', 'The place is very convenient to all attractions in and around Seattle.', 'The price is very competitive and for the money we could have not done any better.', ""Pina's place is very comfortable and she is a great host.  "", 'Pina was very helpful.', 'Good location and easy I-5 access.', 'Pina was very responsive and easy to work with.', ""Due to the snow and the busy holiday week, I didn't get to see her accommodations myself, but my father said it was perfect for his visit."", ""I'll keep Pina in mind for future visitors."", ""Pina's place was perfect for our month long stay in seattle."", 'but she was around when we needed something and had lots of good tourist tips for us.', 'Whenever we travel to seattle again we would definitely stay with pina again!The apartment is very well equipt complete with plenty of coffee, milk and cereal to get us started.  ', 'Everything was clean, nicely decorated and in a pleasant neighborhood.  ', 'Great hostess, charming, considerate and warm.', 'It was charming, clean, and very cozy.', 'Clean, fully furnished with kitchen, bath, cable, Wifi and even washer-dryer.  ', 'Great location that enables easy access to downtown.  ', 'Walking distance to Georgetown and many community parks and trails.', ""Pina's home was perfect."", 'You will not regret staying with Pina :) take care', 'all!We thoroughly enjoyed our stay with Pina.', 'The space was comfortable and had everthing we needed including clothes washer and dryer, which was very helpful.', 'She made our stay very pleasant and helped us get started in Seattle easily.', 'Pina was very kind during my stay in Seattle.', 'The place is very comfortable and has everything you would ever need!', 'I thoroughly enjoyed my month there and really felt at home.', 'Thank you Pina!Pina is very warm & welcoming and a real people person.', 'The MIL suite is decorated nicely and has everything you need, making you feel right at home.', 'Place is cozy and private, nice community and quiet just like the ad says, worth the money and the time.', ""The hospital is only a 5 minute walk from Pina's place which was tremendously convenient, and there are other nearby locations that make this area walk and bike friendly (fruit stand, green space, Chief Sealth Trail).  "", ""- she's super friendly, relaxed, and very responsive.  "", 'The arrangement in the suite is well-thought out with a particularly nice open plan kitchen / island area next to the living space.  ', 'The area is very pretty and we enjoyed living close to multiple parks and a fruit stand.\r\n\r\n', 'The description is perfect, ""Home away from home"" I used to live in Seattle and staying at Pina\'s was like feeling at home.', 'The apartment is clean, comfortable and convenient to most parts of town.', 'and I was very happy to have  a washer/dryer. \r\n\r\n', 'The apartment is very warm and welcoming, is nicely decorated (by Pina!)', 'The house is on a main street so it has good transit service, but there is no street noise in the unit.  ', 'The location is also very central to Seattle so it is a good jumping-off point to areas north, south, east and west via major interstates/highways.  ', 'There is also a biking/walking trail a half block away.  \r\n\r\n', 'Both the bed and the couch/futon were very comfortable, the linens were nice and there were plenty of extra pillows, blankets, etc.\r\n\r\n', 'We stayed for several months and were very happy.\r\n', 'I needed a place near the VA hospital and this was  perfect.  ', 'This place is clean and huge for one person.  ', 'Pina is nice and friendly.', 'The MIL apartment was quiet, ample space, clean, well-stocked kitchen and very comfortable for living in, especially with the addition of the relaxing yard.', 'She was easy going and very friendly,', 'her mother in law apartment was very clean and had everything we needed for a month stay.  ', 'Easy access to the #60 bus that dropped right in front of Swedish Hospital for work,  great grill to cook dinners on and a nice cool apartment on the hot Seattle summer days!  ', 'We will certainly keep in touch when back in the area!  ']"	['Everything was clean, nicely decorated and in a pleasant neighborhood.  ', 'It was charming, clean, and very cozy.', 'Clean, fully furnished with kitchen, bath, cable, Wifi and even washer-dryer.  ', 'The apartment is clean, comfortable and convenient to most parts of town.', 'This place is clean and huge for one person.  ', 'The MIL apartment was quiet, ample space, clean, well-stocked kitchen and very comfortable for living in, especially with the addition of the relaxing yard.', 'her mother in law apartment was very clean and had everything we needed for a month stay.  ']	['Everything was clean, nicely decorated and in a pleasant neighborhood.  ', 'It was charming, clean, and very cozy.', 'Clean, fully furnished with kitchen, bath, cable, Wifi and even washer-dryer.  ', 'The apartment is clean, comfortable and convenient to most parts of town.', 'This place is clean and huge for one person.  ', 'The MIL apartment was quiet, ample space, clean, well-stocked kitchen and very comfortable for living in, especially with the addition of the relaxing yard.', 'her mother in law apartment was very clean and had everything we needed for a month stay.  ']
1	261912	28	131	cleanliness	55	13	13	"[""Natalie's place was perfect for this - it was close to our venue & also close to our house.  "", 'Natalie was perfectly accommodating & perfectly hospitable.  ', ""She made everything so much easier & I never felt like I had to worry or feel the least bit stressed knowing that my family would be well taken care of in Natalie's beautiful home.  \r\n"", 'Absolutely beautiful, very clean and well decorated, and amazing neighborhood!', 'Our hosts were very friendly and welcoming, and responded within minutes to a minor problem we had with the bathtub plumbing.', 'Would /definitely/ stay here again :-)We had a wonderful stay, the house is perfectly furnished and very clean.', 'Everything was awesome! \r\n', 'The master bedroom was very comfortable and quiet with dark curtains, plenty of storage and a comfy bed, and the whole house was clean and modern, including a spotless renovated bathroom.', 'The place was pleasant and clean.   ', ""Natalie's place was in a great neighborhood, SOO close to Green Lake, and it was spotless with all the necessary amenities.  "", 'we were coming off an Alaskan cruise and craving a comfortable space and some home cooked meals.', 'it will certainly be the first place we will try for any future trips to Seattle!We had a great time in the Greenlake area and very much enjoyed the Storybook Tudor house.  ', 'We had a fantastic three weeks staying in this perfectly-located apartment!    ', 'It was spotless when we arrived', 'and we had everything we needed to be comfortable.  ', 'We found it clean, spacious, comfortable and convenient.  ', 'It was close to the walking traili at the lake, close to shops and dining and very convenient to get downtown via the bus, which we did many times.  \r\n\r\n', 'The home was very clean and well appointed upon our arrival and Natalie maid the process extremely easy and fluid.  ', 'This is a great spot for anyone coming to Seattle that wants a home in a nice neighborhood.  ', 'It was a great location, very close to everything.', 'The place was cute and clean.', 'During our stay, the weather was perfect and we were able to walk around the lake one day - no problem.\r\n', 'The kitchen was fully equipped and we found everything we needed.\r\n', 'The master bed was comfy and the bathroom nicely renovated. \r\n', 'Check-in was easy and when I had a question late at night, Natalie got back to me right away.  ', 'Storybook Tudor was a perfect spot for us.  ', 'The house was perfect for the two of us.  ', ""Natalie's home is the perfect place to fully experience the essence of the best Seattle has to offer with its proximity to Greenlake, coffee shops, restaurants, PCC (Natural food stores), and it is a great walking neighborhood."", 'I looked at other choices in this Seattle area and nothing beats this location and accommendations!This is a wonderful place in a fantastic location just steps from Green Lake.', 'For groups of six that need a little privacy it may be a little tight but for families of six with children or two couples with two children it would be absolutely perfect.', 'I did not meet Natalie myself as she was out of the country but all of my interactions with her where very positive, and the check-in and check-out were a breeze.', 'The home itself was charming, clean, and comfortable, and the check-in process was easy.  ', 'It is worth mentioning that it is an older home with an apartment below, so it was important to keep the kids quiet, especially their little feet!  ', 'House was very clean.', 'Very well located.', 'Great location, comfortable house.', 'Air con was a plus on hot days.', 'Backyard seating area while not private was very lovely.', 'The house was clean, spacious, exactly as described... and Natalie was professional, responsive, and helpful.', 'Nice restaurants and grocers and shops.', 'Organic market just down the street.', 'The home is cozy and comfortable, with great entertainment options too.', 'Very prompt at responding to emails with questions.  ', 'It was perfect.  ', 'Nothing out of place and very clean.  ', 'I had a few questions during our trip, nothing urgent, and I heard back from Natalie even though she was on vacation too.  ', 'The home was very cozy and inviting and fit the description and the reviews completely.', 'It was in a great location, easy to find and close to Green Lake.\r\n', 'Good restaurants and local organic market also are within a short walk.  ', 'We loved the easy access to bus service into downtown Seattle, Freemont and other sights we visited.', 'Host Natalie was out of town but easy to contact on the few occasions we had questions.  ', 'The house was nice.  ', 'The AC instructions were difficult and it was a hot night the first night', 'The neighborhood is amazing!This place was perfect for gathering with family at Christmas.', 'Everything was as expected.']"	"['Absolutely beautiful, very clean and well decorated, and amazing neighborhood!', 'Would /definitely/ stay here again :-)We had a wonderful stay, the house is perfectly furnished and very clean.', 'The master bedroom was very comfortable and quiet with dark curtains, plenty of storage and a comfy bed, and the whole house was clean and modern, including a spotless renovated bathroom.', 'The place was pleasant and clean.   ', ""Natalie's place was in a great neighborhood, SOO close to Green Lake, and it was spotless with all the necessary amenities.  "", 'It was spotless when we arrived', 'We found it clean, spacious, comfortable and convenient.  ', 'The home was very clean and well appointed upon our arrival and Natalie maid the process extremely easy and fluid.  ', 'The place was cute and clean.', 'The home itself was charming, clean, and comfortable, and the check-in process was easy.  ', 'House was very clean.', 'The house was clean, spacious, exactly as described... and Natalie was professional, responsive, and helpful.', 'Nothing out of place and very clean.  ']"	"['Absolutely beautiful, very clean and well decorated, and amazing neighborhood!', 'Would /definitely/ stay here again :-)We had a wonderful stay, the house is perfectly furnished and very clean.', 'The master bedroom was very comfortable and quiet with dark curtains, plenty of storage and a comfy bed, and the whole house was clean and modern, including a spotless renovated bathroom.', 'The place was pleasant and clean.   ', ""Natalie's place was in a great neighborhood, SOO close to Green Lake, and it was spotless with all the necessary amenities.  "", 'It was spotless when we arrived', 'We found it clean, spacious, comfortable and convenient.  ', 'The home was very clean and well appointed upon our arrival and Natalie maid the process extremely easy and fluid.  ', 'The place was cute and clean.', 'The home itself was charming, clean, and comfortable, and the check-in process was easy.  ', 'House was very clean.', 'The house was clean, spacious, exactly as described... and Natalie was professional, responsive, and helpful.', 'Nothing out of place and very clean.  ']"
