	home_id	num_of_reviews	num_of_sents	aspect	num_of_sents_0.5	num_of_sents_0.6	num_of_sents_0.7	sents_0.5	sents_0.6	sents_0.7
12	3208330	52	414	cleanliness	149	23	21	"['- maybe it was the yummy breakfast that he cooked each morning\r\n- the great conversations on a variety of topics\r\n- the super comfortable bed\r\n- the beautiful kitchen (check out the vegetable garden or the chicken coop!)\r\n\r\n', ', his company was fun and communicating with him was easy.\r\n\r\n', 'He was a very warm and welcoming host, the room was comfortable, and the neighborhood safe and walkable.', 'If you like to cook, do take advantage of the beautiful well stocked kitchen, gardens full of green goodness, and fresh eggs.', 'It is very clean and decorated with interesting pieces.', 'The bedroom and bathroom that we used were upstairs and the bed was comfortable, the bathroom was clean and the shower worked fine. \r\n\r\n', 'The house is very conveniently located with easy access to Fremont, Ballard and downtown Seattle.', ""We didn't take our car from the street parking hardly at all since it was easy to walk or take the bus to most of our destinations. \r\n\r\n"", 'That being said, he was very accommodating  and was sure to help us with whatever we needed.', 'Tiberio is very friendly and I am sure he would have been fun to hang out with if we were at the house more, but we were more interested in going out on the town together, enjoying our weekend away from home. \r\n\r\n', 'and I am very satisfied.', 'I felt at home in his house and was very comfortable.\r\n', 'The room was just great, very cozy and comfortable.', ""The bed was high quality and really comfortable, there's also a dresser and closet, which was convenient. \r\n\r\n"", 'The ensuite bathroom was very clean and perfectly adequate.', ""Tiberio provided big soft towels (but no face cloths; he's European, so bring your own if you use them)"", 'body wash, shampoo and blow dryer.', 'There is a great washer/dryer and good Tide soap and Downey fabric softener was provided, which I really appreciated.', ""He's good about responding to texts and very attentive."", 'Tiberio is very relaxed and laid back and pretty much lets you run with things.\r\n\r\n', ""I generally don't feel comfortable staying at other people's homes, yet I felt completely comfortable here and Tiberio was an`instant friend."", 'Decoration and colours chosen with much uttermost care.', 'Tiberio is a very kind and helpful host and made us feel very welcome.', 'The location is not very near to the center, but with the nearby busstop (3 min. walk) you can directly get to the center of Seattle for just 1$.', 'The house has lots of plants (both the front yard and integrated into the living space directly) and the fresh eggs directly from the hens was a novelty.', 'It was all very clean and he left instructions for everything just in case.  ', 'The wifi was super fast and it is decorated nicely.  ', 'There is plenty of parking in the street and easy to get to.', 'He has put a lot of thought into making things comfortable for his guests. \r\n\r\n', 'We road his scooter to downtown and looked at art, went to the park and ate at a local Turkish restaurant.  ', 'He set me up on where to go next on my road trip and called a few host friends.  ', 'His house was easy to find even in the dark.  ', 'On our first morning, we woke up to the smell of coffee and fresh bread, and once up and about we had the most intriguing first conversation which made us feel completely at home with Tiberio.', 'The rooms were spotless and the atmosphere relaxing and fun.', 'The house and its bedrooms and bathrooms is very clean.', 'You share the space with Tiberio but it is big and bright. \r\n\r\n', 'The neighbourhood is safe and leafy.', 'Tiberio is a chef, he is social and there is always something happening in the house, whether is preparing for a big catering gig or a fellow chef dropping by for a chat.\r\n\r\n', 'We are very self sufficient and loved the kitchen and fresh eggs', 'We were not fortunate enough to meet our host.', 'However he sent very welcoming emails and was very accommodating regarding helping us out with a second sleeping space.', 'He offered fresh eggs from his hens which we did not stay long enough to take advantage of.  ', 'Room was very private, clean and I loved the windows.', 'Cannot rave enough on how much I adored his home.', ""We didn't spend too much time at the house, but the area was perfect, it was close enough to downtown but far enough away from the traffic and bustle of the downtown area."", 'There are a lot of nice restaurants and parks near the house.', ""Parking was easy to find on Tiberio's street."", ""Tiberio wasn't home the whole time we were there, but he made everything very easy to find and arranged others to be available in case we had any problems."", 'The room was exactly as pictured and his home is very beautiful.', 'Tiberio made us feel at home right away; He even cooked us breakfast with fresh veggies from his garden, and fresh eggs from his hens - quite a treat!!', ""If you're looking for an engaging and warm B & B experience, this is definitely the place."", 'From the moment we arrived, we had seamless service and communication with Tiberio; the room was clean and comfortable and we had an abundant selection of breakfast items including free-range eggs from his chicken coop.  ', 'Tiberio was warm and welcoming, and we felt very comfortable there.', ""And you can't beat the fresh eggs!"", 'The Greenwood neighborhood was great, shops and restaurants nearby, and easy access to the rest of Seattle.', 'The room is nice and clean with a private bathroom and you can use the awesome kitchen.', 'Great Airbnb experience!Tiberio was warm friendly and the perfect host.', 'Very cool space.', 'I was hungry and tiberio was kind enough to whip up a little pasta for me.', 'Very nice guy!', 'Tiberio himself is SO wonderful, warm and friendly and WHAT A COOK!', 'Fresh is best!', 'My husband and I stayed up late chatting with Tiberio after my parents went to have a wonderful quiet nights sleep in their big upstairs bed with private bathroom.', ""Tiberio waived the 'shoes off' policy for my older parents, which was nice."", 'My parents had never even conceived of something like Air BnB and they were very impressed with how fun it was.', 'Prepare yourselves for a fun night of stories and celebration if you want, or like my parents did you could just crash early ahead of a big day of travel.', 'A culinary wizard, he has created an amazing kitchen/living space where nothing is wasted and everything is in reach.  ', 'One of the highlights of our trip was sharing an evening of culinary exploration with our host, who is not only a great cook but a generous and warm human being.  ', 'He tempers his outgoing personality with a courteous respect for your privacy, making sure you feel comfortable and relaxed.\r\n', 'The room was clean and the bed cozy, a very nice base from which to explore the surrounding area which is chock full of excellent eateries and cafes.  ', 'Tiberio was a very walm, welcoming host!', 'We were able to have a flexible check-in time, borrow his bikes (with helmets and locks) to cruise around the city, and slept very comfortably in the private upstairs room.', 'The kitchen is just as amazing as it looks in the pictures and the water pressure in the shower was awesome!', ""Tiberio's place was perfect!"", 'The room and bathroom were VERY clean.', 'Neighborhood was quiet and I felt safe walking around.  ', 'Tiberio was very welcoming and just has a great energy about him.', 'I wish I had time to utilize the kitchen and take advantage of the fresh eggs', 'We received a warm welcome by Tiberio that showed us the place', ', it was simply perfect for us.', 'A big, fully equipped and comfortable open space kitchen with nice couch next to the window for your last glass of wine.', 'Tiberio leaves fresh eggs from his chickens every day, or if you prefer you can pick them up directly from the coop.', 'Rooms and bathrooms are really clean.', 'Really nice neighborhood at  only 10 mins from downtown and 5 mins from greenlake.', 'Tiberio is really nice and loved to share with us his amazing recipes, including wild mushrooms he pick up everyday from the forest.', 'He had good suggestions about things to do.', ""If you want to be in a quite, clean and quality place near to main Seattle attractions...that's the place to be.\r\n "", 'Both Tiberio and his place are warm and unique.\xa0 ', 'Guest room is private and clean and comfortable.', ""Location is good for public transportation so you don't need a car"", ""He is very welcoming from the minute you step into his lovely home and an added bonus is he's an amazing chef!"", 'My partner and I were in town to visit some friends and we needed a place that was comfortable and convenient.', 'It was easy to jump on the bus on 8th Ave to head into downtown.', 'However, Tiberio was very flexible and welcoming.', 'The bedroom was spotless and very comfortable.', 'Again, Tiberio fed us with delicious treats: moist lemon cake, and home-made kombucha.', 'Thank you Tiberio!Tiberio lives in a quiet, classic Seattle neighborhood; lots of fun houses to look at, close to bus, and easy walk to neighborhood shops.   ', 'Tiberio is a very welcoming and warm person, fun and interesting to converse with, very creative, very knowledgeable - especially concerning anything ""food"" - he also is very respectful of privacy.\r\n', 'Tiberio obviously goes the extra mile with preparation for guests - the house is very clean and tidy.  ', 'Also our room had a beautiful bouquet, comfy bed, and a very special tray of home made treats to welcome us.  ', 'Tiberio is  very creative with reuse and repurposing which is a delight to notice - he is also a forager and we witnessed the entire wood table you see in the picture covered with morels!!  ', 'He made us a delicious midnight snack of the most perfect Morel Carbanara ever, and then taught us how to make it, as well.', 'Just an incredibly warm, cheerful person.', 'Tiberio is a REALLY cool guy.', 'He was very friendly and eager to share his passion for good food!', 'The room is very private, on the top floor around a staircase.', 'Very convenient to public transport, and has bikes available to his guests!', 'Tiberio was a gracious host and made us feel comfortable.  ', 'He was very helpful with questions on where to eat and what to do.  ', 'His place is in a quiet neighborhood within walking distance to a great little shopping/eating area.  ', ""Tiberio's house was immaculately clean and the room was spacious and private.  "", 'I think the best thing about staying with him was his interest in us feeling comfortable.  ', 'My husband, my 2 year-old son and I stayed for two nights at Tiberio’s beautiful, clean, interesting and cozy house.', 'He was so generous even to offer us to use his king sized bed in the master’s bedroom for he was worried for my son to fell off the bed upstairs, but the bed was big enough and comfortable.', 'Also, Tiberio let my son pick up the eggs from the chicken coop (my son loved your chickens), made us delicious dinner with fresh veggies from his garden and fresh eggs from the coop and...', ""Everything happened at Tiberio's was perfect.\r\n\r\n"", "", we love you (and we will be back)\r\n\r\nKanako, Sergio & ShintaroTiberio wasn't able to be there when we first arrived due to a friend's emergency, but he left clear instructions and had let us know in advance.  "", 'His home is colorful and comfortable, and well located.  ', 'We enjoyed our stay there very much and would recommend it to others.', 'Tiberio is a great, friendly, very interesting host with many interests, accomplishments and stories to tell.', 'Nice quiet clean room and bathroom on their own floor.', 'Woke up each day in quiet neighborhood with basket of fresh eggs from his chickens (quiet) to make breakfast in an amazing,  unique kitchen.  ', 'Really nice town along Greenwood Ave.', 'We had everything we needed and his location is perfect!', 'His home is beautiful, he is obviously very passionate about the art of cooking.\n\n', ""We loved everything about Tiberio's!"", ""The neighborhood is a foodie capital and Tiberio's bikes made it easy to get around!  "", ""But then somehow there was a lot of miscommunication because he said he wasn't going to be there but that a friend would meet me."", 'Black linens and black curtains make it very goth seeming.', 'It was creepy being there alone and very hot without fans.', 'And the location without a car would be very far from most anything.', 'The room was comfortable and we sampled fresh eggs one morning.', 'The bedroom is clean, well decorated, and very comfortable and offers total privacy as well with its own bathroom.', 'Room stays cool at night if you keep the windows open during the summer and Tiberio also got us a fan for the room before it got hot outside (high of 90 during the day). \r\n\r\n', 'The following days were full of a great sleep in a cozy room, more good food, and plenty of entertaining conversation.', 'Parking is easy.', ""He is very warmful and kind in improving guests' travel experience."", 'If you enjoy cooking and having party，Tiberio is a very nice choice！Tiberio is awsome! as well as his house!', 'It was walking distance for everything I needed during my stay.', 'He was welcoming, friendly, and full of great stories.', 'The neighborhood was perfectly situated between Phinney, Wallingford and Ballard... with loads of tiny book shops, cafes, unique stores...', 'it was a perfect get away in a quiet neighborhood still close to everything!', 'Having a private bathroom was nice too.', 'He was very welcoming and checked in with me to make sure that I had what I needed.', 'One night he even invited me to eat dinner with him and his friends.', 'The food was great and the company was very pleasant :) .', 'The place itself is very creatively decorated, very clean, and in a nice, cute neighborhood.', 'There is a cute little park down the street that was great for yoga and hula hooping.', 'The neighborhood also was very safe to walk in (As a woman travelling alone, I found that to be very important).']"	"['It is very clean and decorated with interesting pieces.', 'The bedroom and bathroom that we used were upstairs and the bed was comfortable, the bathroom was clean and the shower worked fine. \r\n\r\n', 'The ensuite bathroom was very clean and perfectly adequate.', 'body wash, shampoo and blow dryer.', 'There is a great washer/dryer and good Tide soap and Downey fabric softener was provided, which I really appreciated.', 'It was all very clean and he left instructions for everything just in case.  ', 'The rooms were spotless and the atmosphere relaxing and fun.', 'The house and its bedrooms and bathrooms is very clean.', 'Room was very private, clean and I loved the windows.', 'From the moment we arrived, we had seamless service and communication with Tiberio; the room was clean and comfortable and we had an abundant selection of breakfast items including free-range eggs from his chicken coop.  ', 'The room is nice and clean with a private bathroom and you can use the awesome kitchen.', 'The room was clean and the bed cozy, a very nice base from which to explore the surrounding area which is chock full of excellent eateries and cafes.  ', 'The room and bathroom were VERY clean.', 'Rooms and bathrooms are really clean.', ""If you want to be in a quite, clean and quality place near to main Seattle attractions...that's the place to be.\r\n "", 'Guest room is private and clean and comfortable.', 'The bedroom was spotless and very comfortable.', 'Tiberio obviously goes the extra mile with preparation for guests - the house is very clean and tidy.  ', ""Tiberio's house was immaculately clean and the room was spacious and private.  "", 'My husband, my 2 year-old son and I stayed for two nights at Tiberio’s beautiful, clean, interesting and cozy house.', 'Nice quiet clean room and bathroom on their own floor.', 'The bedroom is clean, well decorated, and very comfortable and offers total privacy as well with its own bathroom.', 'The place itself is very creatively decorated, very clean, and in a nice, cute neighborhood.']"	"['It is very clean and decorated with interesting pieces.', 'The bedroom and bathroom that we used were upstairs and the bed was comfortable, the bathroom was clean and the shower worked fine. \r\n\r\n', 'The ensuite bathroom was very clean and perfectly adequate.', 'It was all very clean and he left instructions for everything just in case.  ', 'The rooms were spotless and the atmosphere relaxing and fun.', 'The house and its bedrooms and bathrooms is very clean.', 'Room was very private, clean and I loved the windows.', 'From the moment we arrived, we had seamless service and communication with Tiberio; the room was clean and comfortable and we had an abundant selection of breakfast items including free-range eggs from his chicken coop.  ', 'The room is nice and clean with a private bathroom and you can use the awesome kitchen.', 'The room was clean and the bed cozy, a very nice base from which to explore the surrounding area which is chock full of excellent eateries and cafes.  ', 'The room and bathroom were VERY clean.', 'Rooms and bathrooms are really clean.', ""If you want to be in a quite, clean and quality place near to main Seattle attractions...that's the place to be.\r\n "", 'Guest room is private and clean and comfortable.', 'The bedroom was spotless and very comfortable.', 'Tiberio obviously goes the extra mile with preparation for guests - the house is very clean and tidy.  ', ""Tiberio's house was immaculately clean and the room was spacious and private.  "", 'My husband, my 2 year-old son and I stayed for two nights at Tiberio’s beautiful, clean, interesting and cozy house.', 'Nice quiet clean room and bathroom on their own floor.', 'The bedroom is clean, well decorated, and very comfortable and offers total privacy as well with its own bathroom.', 'The place itself is very creatively decorated, very clean, and in a nice, cute neighborhood.']"
13	3352685	10	48	cleanliness	17	0	0	"['Allison was a very friendly and accommodating host.', 'It was easy to get to the bus to downtown and there were several nice parks within walking distance.', 'The treehouse is the perfect getaway for a couple to experience Seattle.', 'The treehouse was overall cozy - the bed was great and there was a nice fireplace to keep things warm.', 'Allison was very accommodating.', 'Very cool place to stay right in the middle of Seattle.', 'Allison was very helpful.', 'Allison gave great directions for finding it and was incredibly accommodating in leaving extra pillows and blankets so that we could use the couch for additional sleeping space.', 'Everything was great! enjoyed the piano and the record player.', 'Peaceful treehouse with a nice view of the lake!The treehouse was just as described by Allison.', 'It was a perfect place for my husband and I to stay while in Seattle for a couple of days.', 'The neighborhood was very safe and was near the majority of sites we wanted to see while we were in town.', 'It was absolutely adorable, and the location was perfect for our sightseeing plans.', ""so it's a little more rustic than a hotel."", 'Allison as a host was very responsive especially during our visit there.', 'This place was in a great location close to everything.', 'There was everything you could ever need in a place.']"	[]	[]
14	3986793	26	84	cleanliness	43	13	13	"['Fang is a great host, her house is very clean and light, in a nice part of town.', ""Her service was impeccable, we received all the info we needed right away as well as towels and keys, we didn't need to ask one single question!"", ""I'd definitely stay again, her place was very relaxing after days of hiking in the Olympic national parkIt was quiet and very comfortable, she provided coffee and tea (which I didn't use), towels (which I did use), let me know any rules right away."", 'Everything about my stay was perfect: quiet and clean and bright.', 'Room was clean and I had the place to myself.', 'Fang was a wonderful and gracious host who saw to it that we were nothing but comfortable and attended to.  ', 'Thank you!Fang gave me a warm welcome and told me some great places to visit in Seattle.', 'The room was as expected, everything was tidy and clean.', 'Nice, clean, comfortable and peaceful.', 'I will recommend it!This spot was perfect!', 'The entire experience was seamless.', ', we contacted Fang, and the rest was easy.', 'The house and room is super clean, and a par drive to downtown Ballard.', 'She was there to greet me the moment I arrived and gave me a nice walk through of her home.', 'She was extremely welcoming and made me feel very comfortable.', 'It was located in a safe and quiet neighborhood, only a 20 - 25 minute drive from downtown Seattle.', 'Great space very helpful for check in!  ', ', she was very kind and helpful throughout our stay there.', 'It was clean and comfortable.', 'It was a nice neighborhood.', 'A very accommodating experience.', 'Super-clean and quiet with easy parking.', 'Host is really lovely and the place is clean, quiet and really beautiful.', 'Warm, welcoming and friendly a guest could not expect a nicer host than Miss Fang.', 'Her happy and smiling face brightened each day and her helpful suggestions made getting around Seattle easy and fun.', 'Fang is very kindly host.', ""She's lovely house is very queit & comfortable."", 'Her home is very clean and the backyard is a beautiful place to just sit and chat.', 'Quiet and safe neighborhood, with a beautiful garden and detailed instructions.\r\n', 'I loved the little basket with the towels and chocolate.', 'Fang was very welcoming, but also considerate of our privacy.\r\n', 'Her home is in a very safe neighborhood and it is easy to get around Seattle from this address.', 'We had been traveling for 10 days and this was the perfect place to take a deep breath and relax.', 'She had some wonderful touches - a basket filled with chocolate treats, fluffy white towels, hand towels, and a clearly communicated sheet that explained how to use her lock system, as well as her house use preferences.  ', 'Everything was clean and well maintained.  ', ""I'd recommend this spot for any traveler to Seattle - thanks, Fang!Beautiful house, very quiet, clean, peaceful!Clean and close to downtown (20 min drive)."", 'Feng was a good host, she gave us food recommendations for food and parking tips.', 'Fang was very nice and gave us some good tips on things to see and do in Seattle.', 'Bus service to downtown is available and easy to use.', 'The room  was very nice and quiet.', 'It was very comfortable place to stay.', 'Fang was extremely nice & accommodating.', 'Her house is incredibly clean and well kept.']"	"['Fang is a great host, her house is very clean and light, in a nice part of town.', 'Everything about my stay was perfect: quiet and clean and bright.', 'Room was clean and I had the place to myself.', 'The room was as expected, everything was tidy and clean.', 'Nice, clean, comfortable and peaceful.', 'The house and room is super clean, and a par drive to downtown Ballard.', 'It was clean and comfortable.', 'Super-clean and quiet with easy parking.', 'Host is really lovely and the place is clean, quiet and really beautiful.', 'Her home is very clean and the backyard is a beautiful place to just sit and chat.', 'Everything was clean and well maintained.  ', ""I'd recommend this spot for any traveler to Seattle - thanks, Fang!Beautiful house, very quiet, clean, peaceful!Clean and close to downtown (20 min drive)."", 'Her house is incredibly clean and well kept.']"	"['Fang is a great host, her house is very clean and light, in a nice part of town.', 'Everything about my stay was perfect: quiet and clean and bright.', 'Room was clean and I had the place to myself.', 'The room was as expected, everything was tidy and clean.', 'Nice, clean, comfortable and peaceful.', 'The house and room is super clean, and a par drive to downtown Ballard.', 'It was clean and comfortable.', 'Super-clean and quiet with easy parking.', 'Host is really lovely and the place is clean, quiet and really beautiful.', 'Her home is very clean and the backyard is a beautiful place to just sit and chat.', 'Everything was clean and well maintained.  ', ""I'd recommend this spot for any traveler to Seattle - thanks, Fang!Beautiful house, very quiet, clean, peaceful!Clean and close to downtown (20 min drive)."", 'Her house is incredibly clean and well kept.']"
