	home_id	scores_cleanliness	scores_location	review_id	comments
39046	153967	9.0	9.0	495949	"Very nice house in West Seattle, in a residential neighborhood.  The description of the house was very accurate, so there is little we can add.  It was nice to have so much room, and we also enjoyed the chairs and table on the front lawn on one sunny afternoon.

Even though it looks like this is far from the downtown, the connection is very convenient: bus stop is two blocks away, bus ran every 10 minutes and was near the Pike Place in about 10-15 minutes.  Buses have a special lane on the Seattle Bridge, so they can often get to downtown faster than a car.  We have friends of a friend who live in West Seattle and they use the bus every day.

West Seattle is a cool destination itself.  The beaches are nice and full of people, views of Seattle from the east side are spectacular, and there is an abundance of bars and restaurants to choose from--especially along the Alki beach and California Avenue.

One last thing: read carefully the house rules/manual.  Even though you pay a cleaning fee, the guests are supposed to clean after themselves, including washing the towels and linens. The cleaning fee is refunded afterwards.  We spent good 2 hours cleaning up the house (especially because it takes that long to wash and dry towels). We knew about it, so it did not come as a surprise, but I can imagine this could be problem for some people, especially if they need to leave early in the morning.  "
39047	153967	9.0	9.0	568333	Perfect location, close to friends. 
39048	153967	9.0	9.0	766248	"This was a great little cottage with easy access to downtown.  West Seattle has great food options so we enjoyed being able to get good food close to ""home.""  Meg's instructions for the house were very easy to understand and the place was clean and cozy.  The only thing we didn't love was having to do the sheets and make our own beds (one of the beds was a double bunk bed that proved to be quite difficult to make,) but Meg discloses this upfront so no one should be surprised by the request!  In general, the place was a great house to have at a very reasonable rate!"
39049	153967	9.0	9.0	1053740	This place was exactly like Meg states. Really comfortable and in a great location. Easy trek over the bridge gets you downtown. West Seattle is a real cute place and we had a great time. Meg was very quick to respond to Nything and we really enjoyed our stay. 
39050	153967	9.0	9.0	1094626	It felt home away from home... It was wonderful!
39051	153967	9.0	9.0	1263500	Meg was awesome, everything she describes about her cottage is true. Everything was really easy to check in and a detailed list lets you know where everything is. Everything you need, groceries, coffee, whatever, is close distance to the cottage. 
39052	153967	9.0	9.0	1421429	A lovely small cottage in a quiet part of West Seattle - the place is stocked with just about anything you could need or want during the stay. Meg's cottage was a perfect place to escape to during our visit to Seattle. It was quiet, peaceful, the neighbors were very friendly, it is only 10 minutes from Downtown, and very close to a cafe that apparently has the best dirty chai latte known to mankind from what I'm told by my wife. We very much recommend a visit if you're in this neck of the woods.
39053	153967	9.0	9.0	1952857	We had a nice stay in this cottage. What we very much appreciated was Meg's responsiveness and flexibility. For a family with kids the garden was perfect. This was also helpful when we had to clean the house, the only part of the deal, which was not so good, as your simply not sure, whether the next guest have similar standards as you or not, and also, as it costs two hours of your stay. 
39054	153967	9.0	9.0	2331182	"This cottage is a great deal for the number of people it sleeps! The number one reason I would recommend it is the affordable price. It is also in a great location: 5 minutes from I-5, just blocks off the West Seattle Bridge. It is close to Trader Joe's and a neighborhood with cafes, restaurants, bars, and other amenities. It is a long, but pleasant, walk to the water (over two miles). The kitchen facilities were adequate, and the laundry facilities were convenient. The yard is quite large for any city, and we enjoyed eating meals at the outdoor table and chairs.

This would be a great house for a couple and kids. The king bed is very soft but comfortable (that room is quiet and dark as well). The full bed on the bottom bunk is claustrophobic and not good for two adults. Also, the entire bunk bed is unstable/shaky and feels like it might break soon. The queen sofa bed in the living room is relatively comfortable. There were some missing blankets during our stay, but it sounds like that was an accident that will be remedied.

The only other thing to be prepared for is a general lack of atmosphere indoors. The size is cozy and comfortable, but there are almost no decorations and lamps, and the location and number of windows allows for very little natural light. We were not very tempted to ""hang out"" indoors. That being said, it's a great place to come back to and sleep, being dark and in a quiet neighborhood. We felt very safe and enjoyed going for walks and runs around the neighborhood. And I don't think you can beat the price for 5 or 6 (or 7, though I wouldn't recommend 7) people!

Lastly, Meg is a great hostess - she is very easy to communicate with and is quickly responsive to questions."
39055	153967	9.0	9.0	2393881	The house was cozy.  Small but a GREAT deal for Seattle.  We enjoyed our stay.
39056	153967	9.0	9.0	2777145	"*I would actually give 3.5 stars if they allowed that*

My girlfriend, my dad, 2 aunts, and myself recently rented this cottage for a week while in Seattle for my graduation. My girlfriend and I previously lived in West Seattle and loved it, so were excited to find a rental in the area when traveling back. Overall we had a great experience, it was quiet, cozy, close to what we wanted yet far enough away to be comfortable, and it was nice to have amenities like a kitchen and living room. 

That said, I do have a few complaints/suggestions and things you should know upfront; 1) the couch in the living room was painfully uncomfortable!! This wouldn't be a huge deal, except that it was counted as a bed. I would highly suggest a new couch, or at least listing the place as ""sleeps 5+"" instead, because by no means did it make for a comfortable bed. 2) There were a few other updates that would have made for a more enjoyable experience (new towels, covering the old dirty chair, etc), nothing too bad, but its the little things that make a difference. 3) The owner had obviously not been there prior to our visit, it was really cold (55 degrees), the tv wasn't working, and there was a box by the front door. I have stayed at other AirBnB places and its just really nice when they take the time to ""prep"" in little ways like turning the heat on. Again, its the little things. 

And finally, 4) I know the cleaning thing is said upfront and others have mentioned it, but it truly needs to be reevaluated. Im happy to clean up after myself, but really didn't enjoy doing actual cleaning for the last 2 hours of vacation. I know we knew what we are getting into, but its just not a great last memory to have of a place. 

Again, overall it was a great experience and I would probably consider renting it again. I would though, first do some searching for something similar that had a more comfortable sleeping arrangement and didn't require this level of cleaning. "
39057	153967	9.0	9.0	3385905	"Great location, cute little place.  However, there are not enough blankets in the place and there were only 5 of us. Luckily, we had some in our car and were able to keep warm.

The couch would probably not be a very comfortable place - I would say this place comfortably sleeps 5.

Kitchen is not very well stocked.  We had a hard time cooking as pots were missing lids, the knives were horrible and basic tools weren't available.  Kitchen table only has 2 chairs so we ended up eating on the floor.

However, the place is very clean and well priced.  "
39058	153967	9.0	9.0	3854955	It was a great place to stay with perfect neighborhood and location. Clean and neat and the beds are comfy as well. 
39059	153967	9.0	9.0	3930222	"It was very conveniently located and the neighborhood was very nice. The kids enjoyed having a bunk bed and we enjoyed them having a place to eat breakfast in the mornings. 

This was a great alternative to a hotel and we would stay here again in the future if we were not moving to the area!"
39060	153967	9.0	9.0	5422026	Great little funky cottage in Seattle!  Super quiet residential area...we all slept like babies!  Large front yard perfect for kids.  Real comfy beds...especially the king size bed!  It was overall very suitable for the 5 of us - 3 adults and 2.  
39061	153967	9.0	9.0	5962064	Reasonably priced, easy connection to attractions, nice cottage, good experience. Only the view was not as good as expected. At least not from the garden.
39062	153967	9.0	9.0	6028051	Thanks Meg
39063	153967	9.0	9.0	6386525	"We rented this house for one week in August and overall it was okay. It was in a good location for us as we had relatives in West Seattle. It had dishes and cooking utensils, and washer and dryer that made life easier and less expensive then hotel. The big front yard was nice since we had family over the last night for a big dinner.  I like that it was alarmed and made me feel like my belongings were safe during the day on our travels. There was an issue with one bed, but Meg responded quickly and had in fixed on our third night. The area is pretty quiet.

There are several things that I did not like. 

First, I could only get one window open (Small one in kitchen). Other than the window I got open there were no screens in windows or on the doors. Since we had to open the doors for air we had to also deal with bugs. There was one portable AC in the main bedroom (which was nice), but it only cooled that room and the living room. The kids room has no fresh air flow and stayed fairly warm during the day. I am guessing for 9 to 10 months a year this is fine, but it was over 80 for several of the days we were there. 

Second, there is some drywall work that needs to be done in kitchen and bathroom. It looks as if cabinets and other items have been replaced or fixed, but the drywall has just been patched and not painted. There is a dishwasher, but it is not hooked up and can only be used for drying. 

Third, parking can be a problem. If you come back during the day you might not find parking within a half block of the house.
"
39064	153967	9.0	9.0	6487388	The cottage had everything we needed. Clean, reasonably priced, nice yard, and in close proximity to Seattle. Many thanks!
39065	153967	9.0	9.0	7169188	"Overall a wonderful experience and I wouldn't hesitate to stay there again.

PLUSES
- The ginormous shower head.
- The memory foam king size bed.
- The very very quiet streets
- The yard (It was pleasant to hang out with some friends on a sunny afternoon in Seattle out in the yard.)
- All the plates and utensils one would need are right there.
- Close proximity to many restaurants and markets by car.

There are 2 things that I'd pay extra attention to while staying there: 
1. The manual warned the wood floor for the living room is extremely soft and scratches very easily. That forced us to be extra gentle compared to carpet floors, but we also felt better knowing it's visibly clean.
2. The manual's text formatting made it a little hard to read sometimes. I wish it was spaced out over another extra page or two for better readability, but that's the graphic designer in me speaking."
39066	153967	9.0	9.0	7435421	Megs cottages was just perfect for our needs. good price nice secure and quirt neighbourhood, easy access to the city and airport good parking and daily shopping, I definitely come again ! 
39067	153967	9.0	9.0	8343610	The reservation was canceled 31 days before arrival. This is an automated posting.
39068	153967	9.0	9.0	9933366	My parents were coming to visit us from the Midwest and our West Seattle apartment just wouldn't have been very comfortable for all of us. My parents were initially leary about staying in another persons home, but with the welcoming fireplace and big bed-they could not have been happier.  The kitchen was well stocked so we were able to purchase ingredients to prepare and enjoy family meals-we could have even baked a cake!  This space was perfectly cozy for our needs.  Meg was very communicative and timely in all correspondence.  We will absolutely stay at this rustic-ish cottage again
39069	153967	9.0	9.0	10068037	Meg was extremely accommodating to any request that I had. The place was very clean and definitely accommodated the 7 people that were in the cottage. Thank you!
39070	153967	9.0	9.0	10567450	Nice, comfortable experience.  Thank Meg
39071	153967	9.0	9.0	11567768	"Hello :-) It was really fun to communicate with Meg. She knows this place inside and out, and there is no way to surprise her, which is nice. It means she loves the place, and it shows. 
My stay was a really memorable Spring stay. Sitting on top of the hill, so close to West Seattle groceries, and restaurants, and this time, the beautiful Old Growth Lincoln Park looking at the Sound and the Fauntleroy Ferry - it really made me like West Seattle a lot.
The cottage is exactly that, heated by a gas stove, and creaky in a comfortable way. Yet, everything works as if it is modern, and with windows open, it is light and airy.
As the Spring is coming, the outside table and chairs were calling me, but it was still raining on them, so they are there for the next guests :-)
I like having a washer & dryer, and cupboards full of useful things, just like in a cabin. 
I'd come here again, and would recommend it to anyone who respects a well-worn, well-maintained home with a good host. 
Thanks!"
39072	153967	9.0	9.0	12017249	"Staying at the Cottage was the perfect little getaway for my group of friends and I for the Easter long weekend! There were six of us and all of us sprawled out comfortably from the master bedroom, the room with the bunk bed, and the living room couch that turns into a double bed. Everything we needed was provided - kitchen utensils, a coffee machine, and even condiments, spices and beans that have been left in the house from previous guests to pass down to the next. 

The fireplace was so key in the place feeling like a true cottage! We sat in the living room a lot, relaxing and snacking from the delicious food we bought at Trader Joe's - just two minutes drive away! That place is amazing and I wish we had one in Canada. So many good local and organic foods for cheap/reasonably priced! 

In the morning, we made brunch and ate out in the front yard with the patio furniture set up. It was so SO lovely! 

I really appreciated how easy everything was - it can seem intense with the alarm for the house and the cleaning manual book, but it actually isn't at all! Meg lays out everything so simply and clearly that there's very little room for error. 
At the end of the weekend upon our leaving, the entire group got together to divide cleaning duties and put the cottage into pristine condition! It was actually a rather nice bonding moment and made us all feel like a team, and wrapped up our amazing weekend in Seattle wonderfully. I like how this is a guest-run cottage and it's cool to think who will be staying there next. Meg should perhaps start a guest book?!? Would be a cool idea! People can share little things like what they discovered in the neighbourhood or how to properly use the coffee machine, brunch recipes - whatever! 

Lastly - Alki Beach being three minutes drive was amazing! You get the whole westside city skyline from across the water! There's a boardwalk and a bit of a beach that you can explore. On the boardwalk is a cool restaurant called Ma Kai - Hawaiian/Korean fusion restaurant! We had panko breaded fish and chips with kimchi and miso tartar sauce! They also had a patio to relax on too and got a great view of the water...

Anyways, I strongly recommend staying here. It's perfectly simple and what you make of your experience.
"
39073	153967	9.0	9.0	13176871	"Everything went smoothly at Meg's cottage. The place has a lot of charm. The neighborhood is quiet and safe and close to Alaska Junction.
I'm not sure I've ever slept on a more comfortable bed!! I would definitely stay at Meg's again."
39074	153967	9.0	9.0	14169103	We had a group of 6 adults stay in this cottage for one night and there was plenty of room for everyone. The check-in and out process was completely hassle free thanks to all the information provided via email by the host. The cottage was clean and had everything a person needs for a visit to Seattle. It is also perfect location, only a 10 minute cab ride to the stadiums and a short drive to downtown. West Seattle is also a neat little area with a ton of restaurants and cafes. Would definitely go back. 
39075	153967	9.0	9.0	15910813	This cottage is very cute and comfortable. It is also very well located, in a quiet and safe neighborhood, close to downtown, by car and public transportation. It is also pleasant to have a garden to enjoy outdoor breakfast or dinner.
39076	153967	9.0	9.0	16347258	Great spot for our families to soak up Seattle. Communication with Meg was flawless and we felt it was our little home away from home. The front lawn area was just what the doctor ordered for the kids to stretch their legs. Nice quiet neighborhood.  
39077	153967	9.0	9.0	16672041	We had a great time at Megs's cottage, it was very well kept and has good transport links to downtown Seattle. There were 9 of us and we fitted fine and all had a thoroughly enjoyable experience!
39078	153967	9.0	9.0	18049263	Great place to stay and just minutes from so many great places in Seattle! Meg was extremely helpful and responded to all of my messages within a minute or two. I would definitely stay here again!  
39079	153967	9.0	9.0	18630486	"What a wonderful place! I would highly recommend Meg's cottage for those staying in Seattle.  We hope to be back again soon!

"
39080	153967	9.0	9.0	18873844	We had a great time and enjoyed the cottage
39081	153967	9.0	9.0	21531002	Nice place, nice neighborhood.  Easy rental.  Host was on top of everything from the security to the cleanliness.  You do have to clean the place yourself, and the cleaning list is a bit involved which made a 1-night stay a little stressful, wouldn't be bad for staying several nights.  Eat at Chaco Canyon cafe while you're here, right down the street and so good!
39082	153967	9.0	9.0	24321609	"We spent four days at the cottage, and had our family Christmas there. It뗩 a beautiful location, on a hill overlooking Seattle. It뗩 a cute, family-friendly neighborhood. The cottage is small, but cosy and heated well by a wood stove. The stove was on and had heated up the place nicely when we arrived. 

The bed in the master bedroom is very comfortable. We also found everything we needed in the kitchen to make and serve our meals.

Overall, we really enjoyed our stay. But we had a couple of issues:  There was a big crack in the frame of the top bunk bed (which my younger son had looked forward to sleeping in). He didn뗪 feel safe sleeping on it, so my older son volunteered to lay out a bedroll on the floor and give him the bottom bunk for our stay. 

Then on our last day, as we started using the washing machine to wash the linens, stinky sludge started backing up in the bathtub. The kitchen sinks began draining very slowly. Part of the deal at the cottage is that you do the cleaning at the end of your stay (which should take about 2 hours). Unfortunately, the backups made this a messy, stressful time닱ot the best end to our stay. 

Meg was friendly and responsive to our texts, but the holiday wasn뗪 the best time for getting people in for maintenance and repairs. "
39083	153967	9.0	9.0	25539786	Lovely cottage that holds up to the description. Meg is very quick to respond to any questions/concerns and makes you feel very welcome. Great place to stay in a quiet residential area just a quick drive from excellent restaurants and scenery. 
39084	153967	9.0	9.0	33067789	Meg was very great at communicating before and during our stay at the cottage. The description and information we received was accurate and the house looked as expected. We loved her cute cottage! I would definitely recommend staying here. It is in a cute neighborhood in West Seattle. 
39085	153967	9.0	9.0	35478380	The cottage was everything Meg had described and pictured. Cute and clean home not far from the city center. Meg is responsive and is a great host.
39086	153967	9.0	9.0	39240415	I thought this house was very convenient for a small family to stay in. It has a washer and dryer if you you need to clean your clothes, a fully functional kitchen for cooking, and a living room area equipped with a tv. The appearance of the house is well kept and i would recommend to any of my friends coming to stay that this house is the place to be. not only are the living quarters awesome but also the person who own and runs the cottage. If ever i had a question Meg would respond minutes after messaging her. 
39087	153967	9.0	9.0	40195664	The cottage was clean and had a cozy feel to it. The yard space was great for eating out on the table provided and for having the 2 toddlers run around in. We appreciated some of the kitchen cupboard items left by past guests such as sugar, seasonings etc... and left a few of ours for future guest. (great idea!) The area felt very safe and its location was close to many stores/attractions.  We only had 2 problems.  The coffee maker didn't work on day one but after contacting the owner, a new one was delivered through Amazon within 8 hours!! Super impressed!  Also the twin bed leg broke and we appreciated the prompt attempt to repair it.  We would be happy to stay there again should we ever be in that area.
39088	153967	9.0	9.0	40603456	Meg was an informative, responsive host, eager to make our stay memorable. Our family of five had a wonderful stay in her cozy, clean cottage, as we explored Seattle for a few days. Particularly memorable was the water taxi from the West Seattle dock (just 8 min away) to the Seattle Pier. The cottage exceeded our expectations, offering a quiet, relaxing retreat after our days of exploration. 
39089	153967	9.0	9.0	40891003	Lovely home in wonderful neighborhood.   We loved having a kitchen and the front yard was such a perfect place to sit out in the sunshine and read and have meals.  Although comfy quarters for the 6 of us, it worked just fine and we were completely happy.  The location in West Seattle is amazing as it was an easy hop for us to get to downtown, the beach and to nearby shopping.   Definitely a great spot!
39090	153967	9.0	9.0	45238485	Everything was as advertised, the place was really great. Me and the family have never been to Seattle and we were there for PAX. This was the perfect place to come back to from the Busy city. Cant say enough good things about the location and the surrounding area.
39091	153967	9.0	9.0	45650062	Meg was very responsive and communicative. The cottage was very homey, cute and conveniently located. Our guests enjoyed their time. 
39092	153967	9.0	9.0	49279075	The cottage was the perfect place for my stay.  Meg made everything really easy and it was a great stay. I would recommend this cottage to anyone.
39093	153967	9.0	9.0	55340765	Loved the location, easy to find.  Host was very accommodating.  Perfect size for 8 of us.  I would definitely stay here again when I return.
39192	158953	10.0	9.0	403029	"We first reserved the guest bedroom, but then reserved the master too, so we could have the whole place to ourselves.  This place is great! Within about a mile, there is a golf course, beaches, tennis court, coffee, bars, bread makers, cupcakes, stores, gas stations... it's like staying in a small town, right over the W. Seattle Bridge, minutes to downtown! There's a great Irish pub, great sushi, great pizza... without the hassles of city parking. It's the perfect location, and Meg is great, too! We will definitely stay with Meg again on our next trip to Seattle!
"
39193	158953	10.0	9.0	540744	We rented the main bedroom at Meg's house mid week and ended up with the whole cottage. It was just as wonderful as we expected. Such a cute place with lots of character. Large yard to enjoy coffee in the morning and close to everything. We loved it!
40109	4518037	10.0	9.0	22940345	Very beautiful house with nice and cosy bedroom. 
40110	4518037	10.0	9.0	23001996	Nice place.
40111	4518037	10.0	9.0	23620326	Celine's home was so warm and welcoming. It is a beautiful home and Celine has added a lot of lovely details to make it really comforting. The room itself was really cosy and comfortable, and absolutely perfect, especially at the price. The decor and the little touches also makes it feel like home. She was also incredibly accommodating, even when I was late checking in, and gave me good directions and advice on exploring Seattle. 
40112	4518037	10.0	9.0	23739509	The room itself was clean, comfortable, beautiful and neat. The couple are friendly,  quiet and easy going. Would absolutely recommend them as hosts.
