	home_id	scores_cleanliness	scores_location	review_id	comments
46003	7013085	10.0	8.0	45804596	"For my review, I found it easier for my train of thought to break it down into three categories as follows;

The Booking
While I was researching the area for total of 4 people, this location had a very competitive price point. The photos of the house looked really neat and eclectic. When I read the reviews and started asking questions, I believe Dane was the only person I corresponded with and he was extremely polite, patient and helpful (I asked a LOT of questions). He had told me he was working on some updates in the house and each bedroom would have an AC unit which was great since it was really hot in the weeks prior.

The House
The location of this place is super convenient. While it’s a short drive from the freeway, the location itself is prime because of all its access points. It took us 5 mins to reach the entrance to the 5 South, and about 5-10 min to reach the 5 North. You can walk a block from the house to the light rail also. There is enough parking for 2 cars in the driveway, but what you are renting is the top floor of the house. The house itself is full of fun things to see, and uniquely decorated indeed. Regretfully, we didn’t have a dining table during our stay, so meal times were a little uncomfortable. Dane did tell me later that they were working on that aspect so hopefully there will be one for the next house guest. There was a previous review about the light rail noise, and I will say that if your window is open on the west side of the house, you will hear it from time to time along with the dinging noise it makes to notify vehicles/passengers that a train is approaching. If you are bothered by light noises such as this, sleep in the bedroom whose window faces north. The person who slept in that room said they couldn’t didn’t hear anything from that side. 

The Area
While the house was great and in a convenient location, my personal feelings about the neighborhood was another matter. It seems like the general area is in the process of “redeveloping” and “upgrading”, so to the north of the house are newer builds and to the south of the house, I didn't prefer to go there. If you need to go to a grocery store, I liked the Safeway north of the house on MLK Way (Starbucks inside). Only once out of the 5 nights I was there did a neighbor across the street have a debacle that woke me up a couple times.

Thanks Dane for all your gracious help, and letting us stay in your lovely home."
46004	7013085	10.0	8.0	46528151	Wonderful place to stay! Alanna is such a sweet person and a wonderful host. The area is safe and lovely but further from the nightlife we were going for. We loved the decor especially...many pictures were taken. I defiantly hope to visit Seattle again soon and would love to stay at the Uncommon Abode again! 
46005	7013085	10.0	8.0	47008217	We got in late on a Sunday and Dane met us at the house to show us around. I was beyond impressed with how clean the house was. They had extra toiletries if we needed them, tea and coffee to use and he suggested a great Indian food restaurant that would deliver to the house. We had just been on a week long camping trip in the San Juan Islands and greatly appreciated the use of a washer and dryer. We did take an Uber to the house because we were getting in so late but were easily able to walk to the light rail the next morning. I would highly recommend staying here if it's available. 
46006	7013085	10.0	8.0	47392838	We just got back from 2 nights at the Uncommon Abode.  The location was perfect, as we had an all day meeting at the Museum of Flight at nearby Boeing Field.  (BTW, the Museum was fabulous!) We've been to Seattle many times, so didn't want to go downtown this trip.  I was surprised to see how close the light rail station was, though.  In response to a couple of earlier reviews: we didn't hear any noise from the light rail, though we slept in the bedroom facing that way.  Also, our bedroom had a window air conditioner, which we didn't need as the days were nice and the evenings cool.  I did enjoy looking at all the memorabilia, and wondering which play it might be connected to.  I am definitely going to have to Google more about the Grimaldis!  Unfortunately, we didn't get to meet our hosts.  They now have a lock box system, so we got our key by inputting the code.  They did nicely call to inquire if we needed anything, though.  Thanks for letting us stay there!
46007	7013085	10.0	8.0	47698215	My girlfriends flew in before I did and Dane was great at helping them settled in so super thankful for the extra accommodation on that end. The house had all the basics that we needed and had funky art work and art pieces that were fun to look at. The neighborhood was a quick drive to downtown and capital hill so great for someone who has a rental car. The only downside to our experience is on Saturday night Dane knocked on the door to ask us to be quiet because they were trying to sleep. It was 2am and my girlfriend and I were just talking in the kitchen. We are both loud talkers, I will give you that, but we were never informed that there were quiet hours and it was not like we had music on, or lots of people or were partying, just two girls talking. Overall it was a great experience, just a bummer to feel like our parents were yelling at us as adults on a great weekend getaway. Just wished the expectations were set and clear understanding how much noise carries through the house was expressed.
46008	7013085	10.0	8.0	48047559	Staying at the unconmon abode was an amazing experience, the house is super cool with all kinds of props and decorations and has everything you need including a fully equiped kitchen and laundry facilities. Dane was very welcoming and helpful during our stay. 5/5 would stay here again!
46009	7013085	10.0	8.0	48156981	The flat was as pictured, filled with lovely cinema memorabilia and roomy. It was tidy, clean and had just enough equipment in the kitchen for us to make breakfast. We were a family of four adults and a baby; with the futon mattress in the living room that Dane provided, there was enough space for everyone. We only stayed one night so it was enough for us, anyway. We didn't explore the immediate area so can't say what there was in terms of things to do but there were two Safeways within 5mins driving distance as well as various eateries and conveniences. The neighbourhood was safe during the day but again, we didn't walk around and we didn't spend time in it at night. One thing to note: the flat has busy streets on three sides and it's on the path of planes flying in and out of Seatac. The bedroom at the back of the house has a window air conditioner so sound comes in through the vents. As a result that room is quite noisy for normal-to-light sleepers. Also, there was a misunderstanding about check-in time: as we were in transit that day and didn't get Dane's email that was sent around 11am, we arrived at 3pm but weren't able to get into the suite until 4pm. That part of the booking could have been smoother.
46010	7013085	10.0	8.0	48771079	The host canceled this reservation 2 days before arrival. This is an automated posting.
46011	7013085	10.0	8.0	48782952	Great little place! Very close to the light rail. The unit was very clean and the bed were extremely comfy :). Would stay here again!
46012	7013085	10.0	8.0	49022911	Dane's house is clean and tidy. And he prepared something we need. We can use the whole kitchen and the laundry. It's convenient. And we can take the link just walk 5mins,to the downtown just 20 mins. Everything is good.
46013	7013085	10.0	8.0	49781082	we felt very welcome, with responses to questions about what to expect and what light rail stop to get off .  neighborhood quiet and a great location between airport and downtown with a grocery store 1 light rail stop away.
46014	7013085	10.0	8.0	50347534	Alanna and Dane were very accommodating and understanding, especially when we ran into some issues with communicating with them when we were running late. They made sure we had all the information we needed and let us know that they were available if we had questions. The house was very clean and close to the light rail station which was really nice. Lots of interesting things to look at in the house! A great place to stay! 
46015	7013085	10.0	8.0	50966747	We had a great time staying here. Dane was flexible and accommodating with our schedule and the house itself was very entertaining with all of the props and things to look at. The house, bed linens and towels were clean and we felt right at home with all the amenities provided. It was close enough to walk to light rail so we didn't need a car and the neighborhood was pretty quiet. No complaints and we would stay again if ever in the area.
46016	7013085	10.0	8.0	51597443	We were very happy with our stay at the uncommon abode. Dane was kind enough to let us check in early so that we could spend the day in Seattle touring around. The house was clean and quiet. 
46017	7013085	10.0	8.0	52030320	The home was wildly decorated and awesome! It's on the main floor and the homeowners live/rent on the basement, ground level floor. It's a great home for a fun night!
46018	7013085	10.0	8.0	52504707	Dale welcomed us at the apartment and gave us a quick tour before letting us get settled in. The unit was bright and airy as well as conveniently located just two blocks from the light rail line.
46019	7013085	10.0	8.0	53359650	The house was very nice!  Dane was kind enough to let us drop off our luggage early our first day so that we didn't have to walk around with it. They provided us with towels, and had many necessities such as shampoo, body wash, etc available for use.  The location was very conveniently located close to the light rail, so it was very easy for us to go back and forth between downtown, albeit a bit long.  A very good experience overall :)
46020	7013085	10.0	8.0	54107176	Great hosts! The house was clean and had everything we needed..parking, washer, dryer, close to train station,  etc...and had great decor! Dane and Alanna answered all of our questions regarding the house and Seattle promptly and had thoughtful touches throughout the home that made us feel welcome and comfortable. Would definitely recommend staying here!
46021	7013085	10.0	8.0	54616281	"Dane and Alanna were really great hosts.  
They helped with some great suggestions on how to spend our weekend to get the most out of Seattle.  
The place is great.  Fun and interesting decor.  
Great location. Easy to access everything we wanted to get to.  
Thank you.  "
46022	7013085	10.0	8.0	55017723	My daughter and her classmates felt very happy in your house.I wish they can come again in future.
46023	7013085	10.0	8.0	55290264	The Uncommon Abode was a good stay for us. Didn't see Alanna or Dane except for the quick tour, but that's what I was looking for, so it worked out greatly. The place was homely, a little ways from Downtown Seattle, but wasn't too bad with a car. The place had everything one could possibly need, from full kitchen to washers and dryers, and the rooms themselves had quirks to them. Overall, the stay was good.
46024	7013085	10.0	8.0	56637749	The host were extremely helpful with their knowledge of Seattle and with the hospitality they gave to us. The listing on the website was extremely accurate and their house was very nice. The location is awesome because of the proximity to the airport and to the light rail. 
46025	7013085	10.0	8.0	56959698	Just checked out this morning from a weekend stay. We really enjoyed the home. Beds were very comfortable & loved the eclect design. Very fun!!  We were back at the house both evenings to hang out and would have liked another comfy chair in the living room. One couch really didn't work very well for 3 adult women. It also would have been nice to have a small dining table to sit at to eat. Hosts were responsive to our request for a couple more washcloths. We would definitely stay again & highly recommend to our friends. Great value & perfect location for us. Thanks so much. 
46026	7013085	10.0	8.0	57160443	We had a really good time, it was a really nice central area & the light rail is super convenient. We loved the house, it was very cute & cozy. The hosts were also very helpful and informative. 
46027	7013085	10.0	8.0	57834750	"집안정리가 잘되어있고 인테리어 또한 독특하다
하지만 해골들이 여러개(2개 단지 장식용)있어 오싹한 마음에 침실에서 거실에 나올 수 없었다 
이벤트적인 방문은 환영한다 하지만 어린 아이들과 여행이라면 무서울 각오는 해야한다
"
46028	7013085	10.0	8.0	58629233	Staying in Dane and Alanna's place was a good experience for us. Rooms were clean and decorations are stylish.(My friend didn't like the decorations inside the house, he told me it is a little weird. But I like them.) The house is five minutes' walk from the light rail station, and it will take you to Seattle downtown within 20 minutes.
46051	1672979	9.0	8.0	9170762	Wonderful south Seattle hideaway. Heather and Jorge were warm, friendly, welcoming hosts. Our room was clean and the bed super comfy and the soft fuzzy robes were a really nice touch. Nice selection of breakfast foods. If you are lucky you might just get some of Heather's home-made brownies or zucchini bread. Highly recommended. 
46052	1672979	9.0	8.0	14057654	Charming and comfortable home on a quiet street.  We had a great experience.  Our hosts, Heather and Jeorge, went over the top to ensure that we were well fed and well connected to all the cool places in their neighbourhood.  Big thank you - we will be back.
46053	1672979	9.0	8.0	14214531	Heather and Jorge were very kind and hospitable. They looked after us well and we hope we will see them again in the future. The house was tidy and the bed comfy and the shower hot and powerful, great place to stay.
46054	1672979	9.0	8.0	14757252	This couple has the recipe for AirBnB success; providing all the comforts of a safe home .  The location is great and the hosts, Heather and Jorge, are very special folks, as are their two wonderful cats.
46055	1672979	9.0	8.0	15779967	We had an excellent stay in a nicely furnished and very clean home. Very much appreciated the hospitality and friendliness of our hosts who made us feel at home from the first day.
46056	1672979	9.0	8.0	16118760	"From the first day Heather and Jorge were like family. 
Their home were both welcoming and clean.
The neighborhood is nice to walk in.
We would love to stay there again."
46057	1672979	9.0	8.0	18092746	We had a very nice stay in Heather and Jorge's lovely home. Everything was as advertised with a comfy bed and a great shower. The neighborhood was quiet and safe. Heather was very welcoming in providing a clean space and laying out breakfast each morning. Highly recommended!
46058	1672979	9.0	8.0	18757809	Heather was very accommodating during my trip to Seattle. I couldn't have asked for anything more.  
46059	1672979	9.0	8.0	18953795	Wow, what a great stay! Heather and Jorge were perfect hosts (along with Sammy & Ani). We had an early flight in and had no problem droppiny our bags off before the check in time. Jorge was also nice enough to let me borrow a rain jacket and use his Orca card for the duration of our stay! My friend and I got wonderful sleep (the bed was really comfy) and the bathroom had a relaxing shower. Coffee and light breakfast in the morning made it the PERFECT stay! Location wasn't too bad either! Thanks again Heather and Jorge!
46060	1672979	9.0	8.0	20123616	Jorge and Heather were really helpful with any issues I had. The bus was a few minute walk away—it was really easy to get to Chinatown and downtown.
46061	1672979	9.0	8.0	33166909	Heather and Jorge were wonderful! The house was very cute, and it was in a great location. Although our stay was fairly short, we had a relaxing stay and enjoyed exploring Seattle. The bed was comfortable and the cats (which they kept out of the guest bedroom) were sweet and playful. Heather and Jorge were even kind enough to leave breakfast, coffee, and tea out in the morning for us. They're very active and have great knowledge of all-things-outdoors in the Seattle area. I highly recommend staying with them, and will definitely try to stay here again on trips back to Seattle.
46062	1672979	9.0	8.0	34816913	Très accueillants ! Jorge et Heather m'ont fait sentir comme à la maison. Ils sont très sympathiques et toujours prêts à m'aider pour le transport, etc. Ils m'ont même emmenés avec eux à un brunch avec leurs amis. La maison est très sympathique et la chambre très confortable
46063	1672979	9.0	8.0	36563438	Wow! Jorge and Heather were the best hosts i've stayed with so far and I use airbnb frequently. The kitchen was available and had a good variety of healty foods to pick from like fruits, yogurt, bagels coffee etc. One morning we all sat at the table, chatting as we ate breakfast which was awesome. The room I slept in was neat and there was a clean and dedicated bathroom just for me. They also parked on the street allowing me to use their driveway with meant a dedicated and ever available parking spot. Some people do this just for the money, but Heather and Jorge in addition actually enjoy hosting andbgetting to know people. This will be my first choice stay whenever i'm inbthe area. Heather and Jorge, thanks for a wonderful stay. 
46064	1672979	9.0	8.0	37359696	Heather& Jorge r such nice people. I felt like as if they my old friends. They r always ready for help and trying to understand guest's life style. The room size was enough for 3 of us ( me & 2 kids) and clean just like the same as the photos in Airbnb. The only issue was the hot weather. When I visited, the weather in Seattle was extremely hot, therefore my room which located upstairs were hot as well. Thankfully, they already set up a nice A/C in my room that I can control in my taste, but it still took couple of ours to cool down my room temperature. Sometimes I should turn on the AC whole night, witch was noisy and made my throat dry. But, the hot weather is not their fault. Who can even control the weather? The important thing was Heather & Jorge was always concerned of my hotness and trying to do their best to satisfy my stay!! I was so impressive of there hospitality! I can strongly recommend this house to anyone who wants to visit Seattle.  
46065	1672979	9.0	8.0	40341052	My wife and I stayed at Heather and Jorge's home. The home was comfortable and our stay very enjoyable. Both Heather and Jorge were outstanding hosts and made us feel very at home and part of the family. The bedroom was comfy as well as the sleeping arrangements. They even gave us use of the driveway for our rental car. We were even given access totheir wifi. I would recommend their home to any couple or single who happens to be in the Seattle area.
46066	1672979	9.0	8.0	41125446	"Heather and Jorge are amazing hosts that make you feel instantly welcome in their home! Very close to a bus that drives you straight downtown (take the 7 to Westlake, final stop)
The room is great, awesome bed and plenty of space. Exactly what we needed! They were extremely helpful and caring and we loved the cats (who were very affectionate, one of them almost hid in our luggage on the way home)
we'd come back if they'd have us! :) 
"
46067	1672979	9.0	8.0	41449712	"Heather was a wonderful host.  Our arrival was delayed, but she accommodated us well. Our room was great, bed comfortable. We were out visiting and sight seeing most of the time.  
Neighborhood was a good walk to the park for us - an insignificant jog for Heather!!!
Thanks for your great hospitality."
46068	1672979	9.0	8.0	43108021	"My mom and I had a great stay with Heather and Jorge. They have a very clean and quiet home, and coffee and breakfast was ready even though we are early risers. Heather made communication very easy and provided us with great recommendations. Bed was super comfy, and their cats are the cutest!
"
46069	7388899	9.0	8.0	41008892	Catherine is so sweet! The moment we arrived to the house (which was clean and very well decorated), she seemed genuinely happy to meet us, gave us something to drink and even offered to give us a ride downtown (15mins away) as she knew we'd be out drinking. The next morning she made us her famous home made waffles and they were delicious. We only stayed one night but I wish we could have stayed longer!
46070	7388899	9.0	8.0	42008277	Catherine's home was a great option for myself and my friend while visiting Seattle. The location was good, twin beds nice to have, and both Catherines are very friendly and helpful. I hope to see them again next time I visit Seattle!
46071	7388899	9.0	8.0	42638915	"Staying with Catherine was our very first Airbnb experience. We had no idea what to expect. The house is located close to the 'Ale House' in Columbia city where we had great food and beer before heading to our night's lodging. When we pulled up to the house Catherine was out on the street looking for us. It was a very warm welcome! We chatted for a while before we settled in to our room. Our room was very clean and the beds super comfortable. It was a very positive experience and I highly recommend staying with Catherine :)
"
46072	7388899	9.0	8.0	43399735	Catherine was so welcoming and kind! She made our stay in Seattle very special. The property has been decorated beautifully and our room had a nice fan that kept cool, fresh air moving all night. Thank you again for everything, Catherine!  p.s. To be on the safe side, arrive well before nightfall. The neighbourhood is fine (we met lots of lovely people) but not a great place to walk around after dark. On the plus side, the 106 bus runs directly from downtown to right across from Catherine's house, which is great.
46073	7388899	9.0	8.0	43719421	Great host & great house. Clean & beautiful living space with friendly people. 
46074	7388899	9.0	8.0	44016935	I feel well welcomed by the host all the time during the staying. And the room, including public area was pretty neat. The location is pretty close to I-5 High Way and the airport. I think it is a good option to stay at Catherine's place without too much budget.
46075	7388899	9.0	8.0	44217067	This was my first airbnb experience and Catherine did an awesome job in ensuring I enjoyed my stay. The individual who stayed in my room the night before checked out early and Catherine emailed me to let me know that I could check in early - which worked out well since my flight landed early. Her house is very welcoming and warming - she even gave me a glass of her kool-aid which was delicious and I have tried a lot of kool-aid. The room and house were clean and nice. I definitely will be staying here again next time I am visiting Seattle.  
46076	7388899	9.0	8.0	45277525	"Our stay in Seattle was amazing.

The host was very warm and welcoming and very friendly, there was a permanent resident living in the house. We spent many a good hour chatting to them when we they were about. The host made regular visits to the house and we did have some very nice chats. Lead to a nice feeling and welcoming presence.

The house was very nice, layout was good, and was easy enough to get to. The suburb was just like any suburb back home in Australia. There was a bus stop to Downtown Seattle a few metres from the house, which made it easier.

I would recommend anyone this house, and host, if I ever visit Seattle again, this is where I will choose to stay."
46077	7388899	9.0	8.0	45523482	"THE BREAKFAST!

Our stay was great, cute little home outside of the hustle and bustle was comfortable. We avoided the heavy Seattle traffic by taking Rainier into town. The bedroom is comfortable and the innkeeper is super nice. 

Catherine is a great host, so nice, cheerful and a great cook! She made us fried pancakes with eggs, potatoes, grits and fruit, mmmmmMMMMMmmmm. "
46078	7388899	9.0	8.0	45725209	Both Catherines were very accommodating and friendly. Catherine showed us around the place and to our room and gave us a wonderful recommendation on dinner options nearby. I would stay here again!
46079	7388899	9.0	8.0	46500907	"Catherine is so great host,she had everything ready when we arrived to her house. she is very kind and she helped us a lot. The house is what we expected warm, clean and comfy. We really enjoyed a lot staying in her house, thank you so much for your hospitality. Catherine  ! p.s thanks for your kool-aid and the hot dog were very tasty. Definitely, it is a really nice place to stay in Seattle. 
"
46080	7388899	9.0	8.0	48459135	Cathrine is the most beautiful and warmheart women i have melt!i love her and anther Catheine~thank you ao much.i have a American family now~
46081	7388899	9.0	8.0	50418388	"We had a great stay at Catherine's place. We arrived in the evening when catherine was out but there was a number to call and we got into the house with no problem. The house was clean and as described. Catherine came to see us in the morning as we had got back late the previous night, to make sure she caught us before we left. We were offered breakfast but declined as we were running out but there was some cake left out for us all the same!

There were some other air bnb-ers staying so we were sharing the bathroom but that was no problem.

For a comfortable, easy stay in Seattle I would recommend Catherine's place. Thank you!"
