	home_id	scores_cleanliness	scores_location	review_id	comments
21990	1856970	10.0	9.0	13540432	"Our stay in Seattle will certainly remain a very special experience thanks to Carol who was extremely friendly and warm-hearted. She instantly made us feel at home in her cosy kitchen and showed us her lovely garden where you can sit and relax.
Our room  was spacious with a  large closet and a very comfortable bed;
the  bathroom also rather big and very clean.
Carol's place is in a pleasant residential area, where  you can easily find parking space. Furthermore it is not far away from Chinatown with its excellent and reasonably-priced Korean and Chinese restaurants. Major places in  downtown Seattle can be reached in a 25 minute - walk. 
We enjoyed how openly Carol responded to us, how helpful she was  and how interesting our conversation with her turned out to be.
Thank you, Carol, we'll try to come again!
"
21991	1856970	10.0	9.0	13735807	"Carol was such a wonderful host! Her home is located in such a convienient location, close to the highways and to the city. The room was spacious and comfortable, and the bathroom was updated and clean. Carol's backyard is a peaceful little oasis to sit and read a book or drink some tea. I was also able to find street parking in front of her house without any issues. 

Carol was warm and welcoming, and made me feel so comfortable while staying with her. She is easy to talk to, and it truly felt like I was staying with a close friend rather than a host. She also has the most adorable cat, Mimi. I was out early for most of my stay, and Carol so thoughtfully provided some easy grab and go breakfast items such as yogurt, muffins, and fruit. 

I would highly recommend staying with Carol if you are visiting Seattle!"
21992	1856970	10.0	9.0	13859079	The room is clean and large, and the bed is very comfortable. The rest of the home is also clean and comfy. Carol is sweet and helpful, and treated me like family. I would definitely stay at her home again!
21993	1856970	10.0	9.0	13923071	It was great to stay st Carol's in Seattle! The house is a lovely old dwelling and Carol keeps it beautifully. The garden is a delight with a number of outdoor spaces. We appreciated Carol's clear instructions, local knowledge and interest in the world. The location is close to the international district and an easy bus trip to downtown. 
21994	1856970	10.0	9.0	14080155	Carol is a wonderfully warm host and her house is like a home! From use of the kitchen to use of the garden, I really enjoyed my time! Mimi the car helped with ensuring I was enjoying myself too lol. 
21995	1856970	10.0	9.0	14117811	"Very nice, pretty, well kept and clean home. Carol did a great job making us feel at home, offering tea and some things to nibble on if we needed it. The room itself is very cozy, the bed comfortable, bedding soft, and pillows fluffy (much better than the bed on the cruise we had for the past week!). The bathroom is shared, although there was absolutely no issue with that, and it is just outside the bedroom, with, as an added bonus, a door that closes off the hallway with the bedroom and bath. 

The house is very close to a few bus stops, and the light rail isn't TOO far either (we walked from the house there after a full day of walking all over- but we only had bookbags and a single rolling duffle- if you have a lot more, catch the bus) and Carol left an assortment of bus schedules and attraction brochures on the dresser as well. If you are more of a walking type, the hill is not steep (compared to most of the other streets) for Jackson St, and you can take that all the way down to the water. All in all, a great experience with a lovely host in a great city!"
21996	1856970	10.0	9.0	14172041	"Carol was a fantastic hostess! The room was spacious, clean and ready with fresh towels upon my arrival. She had a light breakfast and coffee available on my next morning, and I truly enjoyed holding a conversation with her! She's as warm and very welcoming as her home is charming! Such a delight.

I definitely recommend!"
21997	1856970	10.0	9.0	14292629	This was our first airbnb experience and it was a good one. Carol is warm and her home is clean and comfortable. Very comfy bed! We didn't have a car and were able to walk everywhere we wanted to go, including to the light rail to the airport. Nothing fancy about Carol's--just homey and restful, which was just what we needed.
21998	1856970	10.0	9.0	14354464	Our one-night stay with Carol was perfect.  The home is very nice and centrally located--we walked to Chinatown, Pioneer Square, Pike's Place Market, etc.  And easy on-street parking, to boot.  Thanks, Carol!
21999	1856970	10.0	9.0	14512902	Thoroughly enjoyed staying with Carol. Gracious host who provided helpful hints for places to see and eat,  accommodations were comfortable with great views and nice back porch. Location was walking distance to Chinatown/ little Saigon and downtown area. Many great Asian restaurants nearby. Be advised that if you  are coming via the airport light rail, and plan to walk with luggage, its about 3/4 to 1 mile uphill to her house.  
22000	1856970	10.0	9.0	14865839	Carol was the sweetest lady and host. She has a lovely home that is very welcoming. The room is very cute and comfortable. Her location is perfect if you like to walk and see the city. She is a 20 minute walk to the prime part of Seattle and minutes away from Stumptown coffee. I highly recommend staying with Carol you wont be disappointed. 
22001	1856970	10.0	9.0	14969727	We stayed with carol for one night while visiting Seattle for a Mariners game. She was very quick to respond to any message and a fantastic hostess! Very kind, great to talk to. Her house is very cute and close to the stadium. We were able to walk to the baseball stadium and to Pikes place.  Great location, great trip!
22002	1856970	10.0	9.0	15103269	"This was more than a stay, it was a real connection. Even though Carol was working long hours when we were visiting Seattle, we managed to chat and I felt that we had a lot in common, including our attitudes towards life. This is probably because Carol has created a warm and welcoming atmosphere in her beautiful heritage home. This house is located within walking distance to downtown and Safeco field, which was very convenient for us as my partner, Joseph was going to a Mariners game while I could take the bus to explore Fremont's Sunday market. Also close to International Village - I highly recommend ""Jade Garden"" for dim sum. 

Carol's home is comfortable and very clean and tidy. You have full use of the kitchen and she provides breakfast items for you to help yourself. However, she made sure to leave us a pot of French press coffee before she left for work! 

Highly recommended- we are certainly going to try to stay here again the next time we're in Seattle.

Thank you Carol for sharing your home and your life with us."
22003	1856970	10.0	9.0	15213507	"Carol was really nice and we felt very welcome. She had yoghurt, fruit, bread and something sweet every morning for us. The room is great. Nice bed, enough room and clean. We were also very welcome to use the chairs in her backyard to relax and read. The house is a bit noisy and the bathroom is shared with Carol & her grandson, but if you don't mind: great place to stay.

One thing to consider is the neighbourhoud. It is a 20 minute walk to downtown, which is great, but the neighbourhoud didn't feel the safest. We always took the bus back at night instead of walking back. There is one really good Vietnamese restaurant though (entrance at the end of a parking lot, but really worth going there!). But maybe Carol has some good tips for other nice places around."
22004	1856970	10.0	9.0	15262851	Carol was really nice and fantastic hostess. She has a lovely house with a beautiful backyard. This house is located within walking distance to downtown,  light rail station and Chinatown. The room we lived in is comfortable, clean and with enough space. Carol had yoghurt, fruit, cake in the morning for us. I highly recommend this place, we are certainly going to stay here again the next time we're in Seattle.
22005	1856970	10.0	9.0	15569900	We enjoyed our 2 stays with Carol very much. She is a warm, welcoming, generous host. Her home is charming, set in a beautiful city garden, which were so enjoyable this summer. Besides her warm welcome, we were grateful for the home's central location, with a bus stop to downtown just 5 minutes away, as well as convenient neighborhood restaurants and easy parking. We would surely choose Carol's house for another visit to Seattle.
22006	1856970	10.0	9.0	15631112	Carol is lovely! She takes the time to make your stay as comfortable and private as possible. It was hot when we visited, so she got us a fan or our room. The location of this place also cannot be beat. Only minutes away by walking, bus or car to the wharf and the like. The bed was comfortable, the room just as described, carols company was lovely, and she even greeted us with coffee when we woke up and offered us breakfast. This is a great place to stay in Seattle !
22007	1856970	10.0	9.0	15758043	"Carol is a lovely person who graciously received us at her home at a late hour, as we had warned her could be the case. We had a short chat before all heading to our beds. Our room was extremely comfortable and we slept well: Carol had set up a cooling fan for us because she considered the weather was much hotter than usual.
In the morning we got to know each other better over the lovely ""continental"" breakfast that Carol provided. She advised us on transport for our planned activities of the day and was most helpful.
We stayed 2 nights in Carol's cute home. It is very conveniently located for a Seattle explorations. We safely parked our car in the street outside.
We highly recommend Carol and her AirBNB."
22008	1856970	10.0	9.0	15910751	We had such a great stay at Carol's. Her house is beautiful and the location is perfect, only 15 min walk to downtown. The room was clean and cosy.  We had lovely conversations with Carol on all sorts off topics. Would definitely stay there again!
22009	1856970	10.0	9.0	16003971	Carol was absolutely wonderful and the room was just as beautiful as on the pictures (and the bed really is super comfortable, and the breakfast was light and delicious -- exactly how we like it)! We thoroughly enjoyed our stay there and I have nothing bad to say. The only recommendation I would give to future travelers: The walk to her place from the Amtrak station on South King felt a bit sketchy on some parts (the neighborhood where she lives is beautiful though!) 맙o next time I'd take the bus if arriving in the evening, or walk on Jackson instead.
22010	1856970	10.0	9.0	17039535	We totally enjoyed our stay with Carol Hughes.  It felt more like being with a family member or an old friend.  It was great.  Carol did everything to make our stay enjoyable with a lovely breakfast and conversation every morning.  Our room was comfortable and clean as was the bathroom.  There was no problem with coming and going at our leisure.  Carol was very knowledgable   with the area and helped with sightseeing activities.  Her home is located close to just about everything.  There are awesome running paths close to her home which we enjoyed throughout our stay. I would definitely stay with Carol again should we ever return to the Seattle area. 
22011	1856970	10.0	9.0	17560814	"The stay at Carol's house was perfect.
The room and the shared bathroom were nice, clean and comfortable. 
We enjoyed staying here. Breakfast in the morning was really good ( fruits, cake and coffee), and we really enjoyed talking to Carol.
We would definetely stay again! !"
22012	1856970	10.0	9.0	17758995	I had a great time during 3 days stay at Carol's home.She was such a nice woman so that I did enjoy everything what I experiences there.She made me a delicious breakfast every morning, which made me happy. She also asked me about what I did in Seattle every day, so I felt stay with my family or close friends. Thank you so much for everything!!   
22013	1856970	10.0	9.0	18004525	Carol has a very nice and clean home. The room was great. Location-wise it is a little too far to walk to the center, however, taxi proces are reasonable. Would definitely stay there again.
22014	1856970	10.0	9.0	18171711	Thanks Carol for a wonderful stay. I appreciated your friendly and attentive hosting. Your place is homely and welcoming. It is a comfortable 15 minute walk to King St station to access the airport, and an easy 30 minute walk to access the waterfront and downtown. Thanks for helping make my stay so fulfilling. I recommend your place.
22015	1856970	10.0	9.0	18330478	"Carol was a pleasure to meet-we arrived almost on midnight and she waited up for us and helped with our bags. The bed was most comfortable and breakfast delightful, she even went out and bought cereal for me for the second morning.  The location was very good close to Pioneer square, Pike street markets and downtown which we were able to walk to.
We have no hesitation in recommending her lovely heritage home to other visitors to Seattle"
22016	1856970	10.0	9.0	18468493	We stayed for one day on our way back from a road trip up the Oregon Coast. The place was beautiful and the room was perfect. Everything was exactly as advertised. We didn't get a chance to meet Carol in person because we checked in and immediately went to see a Mariners game. Although we didn't meet in person, gaining access to the house was easy seamless. We wish he had more time to spend in town because the house was beautiful.
22017	1856970	10.0	9.0	18538579	"What a pleasure! 
Carol welcomed me, made me feel at home and made sure I knew where everything was and how to use it.
The room is pleasant, the bed is comfortable and the garden is a refuge in the heart of the city.
I whole-heartedly recommend Carol and her home. It was a delightful visit.
"
22018	1856970	10.0	9.0	18874181	Carol and her home were great, very inviting and accommodating of our weird schedule. Breakfast even when we slept in was unexpected and very welcome. 
22019	1856970	10.0	9.0	19005680	Carol made us feel very welcome to her house despite our late arrival. The bedroom was large enough for us with a comfortable bed, albeit a bit shortish. We enjoyed the French press coffee and the muffins for breakfast. We stayed just one night but we wished we could have stayed longer in her beautiful house and to explore nearby International District/Chinatown. It is a 15 minute walk uphill from King Street Station to Carol's house. If we would return to Seattle we would love to staying in Carol's house again. 
22020	1856970	10.0	9.0	19132283	Carol was a great host and took good care of us. We had good conversations & got a delicious organic breakfast in the morning. The walk from the International District station to Carol's place took about 20minutes. We took the Jackson street more often, because it was better enlightened. The house is on a walking distance from the sightseeings. We would definetly stay at Carol's place again! all the best to Carol wishes the social girls. :)
22021	1856970	10.0	9.0	19370125	Carol was a great host. We arrived late n she welcomed us with a smile n open heart. She made sure that we were comfortable n made sure that we liked what was in the breakfast. During our departure also she did not hesitated in letting us leave our luggage at her place even after check out time. Her willingness to help us in any way was much appreciated. U highly recommend staying at her place. Also location was very near to downtown also. 
22022	1856970	10.0	9.0	19483358	Carol's place was great for us! She was so friendly and made us breakfast. Could advice everybody who is looking for a affordable and nice place to stay in Seattle.
22023	1856970	10.0	9.0	19540359	We had one night in this beautiful home. Carol was very welcoming of me and my active three-year-old. Hot delicious coffee in the morning along with yogurt, fruit, pastry. Great tips on local restaurants in walking distance.  The bed was super comfy and one of the best night's sleep we had while on vacation. The gardens out back were lovely, refreshing, remarkable quiet ... we would definitely stay there again (as an FYI if you are traveling w/ children, it's quite a steep climb from street level up the stairs to the front door and no hand rail - the only thing that made me a smidge nervous with my fearless kiddo). 
22024	1856970	10.0	9.0	19616517	"This location is ideal if you wish to see the tourism highlights of Seattle.
We were able to get around town quickly and easily .
My our host open hearted in conversation and makes one feel like you have been friends forever!  Anyone would enjoy staying here."
22025	1856970	10.0	9.0	19827393	I  had a really great time in this C arol beautiful house ! she friendly and made me breakfast for me . this house safe and well connected!  I   and would definitely stay here (website hidden) ank you for Carol   !
22026	1856970	10.0	9.0	20139423	we stay at Carol's lovely house for threes nights, we're very happy to stay with Carol. everyday she prepare breakfast for us, she give me lot of advice for getting around Seattle, we have very nice conversations, Carol make me feel so warm.and we really love Carol's house, very good condition, very comfortable and warm. we'll stay again if we back to Seattle someday. thanks Carol and take care!
22027	1856970	10.0	9.0	20217741	Carol was very, very kind. Her house is beautiful. She loves to have conversation with her guest which is a plus. Her place is in a very convenient location with regards to the train and bus access. If ever in the Seattle area again will look to have tea and conversation with this wonderful woman.   
22028	1856970	10.0	9.0	20490215	If you are skim reading reviews- look no further for a great place to stay in Seattle. Carols house is very calm  and she is just the best host we have found so far. She is a very interesting lady and we spent several hours chatting with her and getting great ideas for things to do and places to eat. The house is approx 30 mins walk from the city but on a good bus route and close to the Amtrak station. Breakfast each morning was always fresh and delicious. All in all - a fantastic stay - thank you! 
22029	1856970	10.0	9.0	20631648	Carol was very welcoming and informative. Her place is very comfortable and clean. Such a perfect location to start exploring downtown seattle. Will definitely consider coming back to her place. 
22030	1856970	10.0	9.0	20651091	My boyfriend and I stayed with Carol for a very quick night as we were traveling through Seattle.  She was very friendly and accommodating with our arrival.  Her home is clean, comfortable, and warm -- and the coffee in the morning was a very nice touch.  
22031	1856970	10.0	9.0	20751109	Staying at Carol뗩 Hughes house was a very pleasant experience. The house is located in an area that is easily accessible from the I-5 highway, in a neighborhood that has small, quiet streets with trees and houses with little yards richly filled with a variety of shrubs and flowers. The house makes a very nice impression of stability and warmth. The room was as I was hoping, cozy and comfortable, bathroom clean and the shower worked great. Morning coffee with a toast and fruit was perfect. The host has a talent to make me wanting to come back. 
22032	1856970	10.0	9.0	20915847	Carol's home was a lovely refuge during my busy trip to Seattle. The house was exquisitely clean and welcoming. The bed linens were so soft! Her tiny garden was also a treat. The house is close to downtown and easy to get to. I appreciated her warmth and care - and professionalism.
22033	1856970	10.0	9.0	20970828	Carol was very friendly and welcomed us even though we arrived early! We had a nice chat she gave us some tips and even made us a small breakfast!We walked into the city it took about 30,40 minutes through parts of Chinatown. The room and bath were both clean and we felt very comfortable.  
22034	1856970	10.0	9.0	21146035	"Carol was a very nice and helpful host. I arrived in Seattle from Vancouver at night and couldn't figure out her place well at first time. Thankfully, she picked me up from a bus stop. And also, she arranged a cab when I left. For the breakfast, she considered various tastes of guests and prepared. She is interested in various culture and enjoy learning about the culture via her guests. I also had a good time while I talk with her.
Her place is clean and tidy. I could hear train(?) sound sometimes, but didn't bother me a lot.

屎넒몫述 尸럷맫涯 習놻밒述젋룬긛긳. 崧굾 嘯얿멂쑧醇넓 긮詢멄聖 宵궋醒 參 煞덞굾꼻 習 芟쩗쑺衫껇 煞덞굾꼻 嘯벏롮珹쩗 細얿쇍쟗끣 涯떩 蔘젋롃 鉥 稅昇쮥멂꼢珹쩕옯馴. 崧靄덠둗꼢긛 習崧 昇뻚몦 曖쫿듼끣 떫膝쩗긮參 習놺끣 衫뻚碍걻궛긛긳. 宬멂 姓껆굾 參왨돐衫껇 煞굾宵됆끣 鉥 詢껆먃蝨섥 醇쇍졟習 꼻省섦긳 膝쩖먃參 碍걺굾꼻 煞럷롲崧述 섧맷述 뢝쒇 錞넒몦馴 屎뫫롃 諄얾맫述젋 涯얿밒醇걻궛긛긳. 
崧 勢뀗럎 所述얾롶 述얿돞蔘 涯떫긮굾 三 瑟詢涯떫긮參 섦룳葉 왨돖 긳醒젊떪롶 細젌똆醇 涯 葉굾 三 瑟詢涯떫덟 崧ㅖ 姓 煞뙓롮 昇뻚븯긮參 述얿돞蔘썴뎾洗얿 崧끣 鉥섦싲鉥걹쑯 習걺꼦 三 煞뙓궛긛긳.
習놻 衫뻚涯떩옯馴, 蔘썲씾崧術쩖몦 嵩썳뛀涯떩쟚 涯럶꼻 煞 蔘썳쌷껆붧(?) 煞뙓三 葉벎붧꼢珹쩕옯馴. 崧굾 섥쑯 멁쒛 蓴썳롮習굾 詢귋뎾諄얿뚮."
22035	1856970	10.0	9.0	21306724	"As a young person, this was a great place to come ""home"" to. Clean, private, and easily accessible from downtown by transit, walking, or cab. Carol was kind and made everything so smooth! The stadiums are so close, we wish we had bought tickets to a game (where everyone was!). Make sure you know where you'd like to go for food/drinks/fun before you head out."
22036	1856970	10.0	9.0	21428272	Fantastic room in a central location. Carol was incredibly nice and helpful with suggestions. I woke up to a breakfast and good conversation the next morning. It was an incredible experience. I will absolutely stay here again on my way back into Seattle. 
22037	1856970	10.0	9.0	21612885	Carol was an absolute pleasure.  She was a great resource for finding things to do in seattle.  She provided breakfast every morning.  on top of that,  parking was plentiful and the location was great.  I would definitely recommend to friends and family and stay there again myself if ever in the area.
22038	1856970	10.0	9.0	21692595	I had a great time in her house. Carol was so kind. The room and bath was clean and beautiful. I was  so relaxed in the room. Carol's break fast was also good!
22039	1856970	10.0	9.0	21751250	Carol was most welcoming and a pleasure to stay with.  Her communication was excellent.  Her house was lovely, clean tidy and the bed was excellent!  Also very easy to get to via public transport with good places to eat nearby.  
22040	1856970	10.0	9.0	21780244	"The stay at Carol's place was one of the best stays through AirBNB we've ever had.
Carol has a large house so the room seems very private. The bed was very big and comfortable.
Carol was extraodinary host, very friendly and she even prepared a breakfast for us. She also gave sightseeing tips for Seattle which were very useful. Also she let us keep the bags with her after the checkout time which was very convenient for us.
Thanks a lot!"
22041	1856970	10.0	9.0	21920716	Carol's place was right in downtown Seattle. It's a great location & was super quiet. The room was perfect for my needs. The bed was very comfortable & the bathroom was very clean. She gave me a huge poppyseed muffin & a yogurt for breakfast which was so nice! Even though you are sharing the house it's really like you have your own suite because you can close yourself off completely from the main part of the house. I would stay here again for sure.
22042	1856970	10.0	9.0	21955764	"Carol is a wonderful host!  She was very accommodating and friendly, she made us feel comfortable sharing her home for the night.   Her charming and clean historical home is conveniently located in the Central District.  It is evident that Carol wants to give her guests a ""bed and breakfast""/""home sweet home"" feel to their stay.  We enjoyed our interaction with her, and were pleasantly surprised to have tea and toast for breakfast.  Thank you Carol!"
22043	1856970	10.0	9.0	22155255	Carols home was very nice and had a lot of character to it. It was pretty central to many different locations in Seattle. Easily accessible bus routes to downtown, if you desired to use them. The room was a good size for 2 people. The bed and pillows were very comfy. She provided small toiletry items to use. She also provided breakfast and coffee in the morning which was wonderful. 
22044	1856970	10.0	9.0	22325211	"I already miss Carol so badly. T^T
She is very nice and friendly. And her house is also very clean and warm. 
All my family are in different country, but Carol makes me feel like I'm at home. I like to sit in the kitchen and talk with her. Thank you Carol for helping complete my ""secret mission""! I will go back some day and still stay in you place.
I think the greatest gain from this trip is met Carol.  :-)"
22045	1856970	10.0	9.0	22369076	"I had a great time staying in Carol's home. She has a cute private room to stay in, didn't mind me using the bathroom for quite a while in the morning while getting ready for an interview, and makes a great cup of coffee.
She is also walking distance from the light rail, which makes transportation from the airport a lot simpler and more affordable. I hope to stay with her again in the future :)"
