	home_id	scores_cleanliness	scores_location	review_id	comments
47461	1599856	9.0	9.0	9571134	"Joseph met us at the apartment exactly on time and was very helpful. The apartment was  charming and had everything we needed including coffee and creamer! The location was perfect for where we needed to be. The only problem was that there was a quite a bit of noise from the upstairs neighbors however it was new year's eve so perhaps that is unusual. 
We felt it was a great value for a 2 bedroom in Seattle."
47462	1599856	9.0	9.0	9663238	"Lovely flat which was very well stocked with all we needed including an excellent espresso machine and an interesting selection of books.  Would definitely recommend and would use again if I am in Seattle again.

Thanks Joseph!"
47463	1599856	9.0	9.0	9693882	Joe was very responsive to my texts and was willing to work with me to arrange the keys. His place was very clean and cozy, accomdating 5 ppl easily. The location was great. I would definitely be wiling to stay here again if I return to Seattle
47464	1599856	9.0	9.0	9762499	Joseph and the total experience of booking, finding, and lodging at 2.5 Blocks from Anywhere was fabulous! Really good communication at all points and the place was exactly as I expected. And the neighborhood of Columbia City is amazing! ;) 
47465	1599856	9.0	9.0	9824108	The apartment was very nice. Very close to light rail and the CC Main Street. Big ups for the coffee and real cream. Would certainly stay there again. 
47466	1599856	9.0	9.0	9971697	"We had a great stay at Joseph's place; he and his mom were so helpful and responsive.  the place is perfectly located, you can walk to any one of Columbia City's restaurants and its great little movie theater, plus you can walk to the train.  The apartment itself is clean, cozy, warm; we were able to do a laundry when we needed to, no fuss about linens and plenty of towels.  The Huffords made everything easy.

Highly recommend!"
47467	1599856	9.0	9.0	10041591	"2.5 Blocks from Anywhere was a great place to stay while on a short trip to Seattle. I stayed here with my fiance and two other couples over a weekend in late January.

The apartment was very comfortable and well appointed. They even had some great coffee there for us waiting in the freezer!

The location is perfect for taking in sights as it's out of the hussle and bustle of downtown, but close enough that you can get there in about 20 mins on public transit. There are tons of shops, bars, and other great spots just half a block away on Rainier street as well, so it's a win win. They even have a shelf of books you can read from and even take with you when you leave!

The only issue we had was with the heat which seemed to only come out of the vents in the living room, so if the bedroom doors were closed, it could get a bit chilly at night. 

All in all an awesome home base for a trip to Seattle. I'd definitely recommend it to friends."
47468	1599856	9.0	9.0	10244792	I had a great stay here for a whole week with my coworker. The hosts were very quick to respond to any questions. The place was great and comfortable and close to everything Columbia City has to offer. The upstairs neighbors are a bit loud and affect the water pressure, but the hosts are in communication with them and looking into it. Loved staying here! Thanks!
47469	1599856	9.0	9.0	10587413	The place has a genius location in Seattle, a real house very close to a lot of restaurants and also to the train station, all are walkable conveniently. Joseph was busy at that time, but he delegated some other person who was very helpful and generous in cooperation. Our stay was too much pleasant and convenient. The neighbourhood was very calm and nothing had disturbed our sleep. The neighbors in the upper floor were hardly heard, and they were very calm and polit. The overall experience is perfectly great, I think I was too much accurate and lucky to have such a place and people, I definitely recommend it for whom seeking calm stay and tourist and also for business in the downtown. Thank you.
47470	1599856	9.0	9.0	10679831	"Joseph (& his helpful mother, Dana) could not have provided a better experience! They were prompt and careful in replying to all questions, the apartment itself is adorable and completely stocked with anything you could need.  The neighborhood is great, the train truly is 2.5 blocks away and gives easy access to Seattle proper. I would definitely return! 
"
47471	1599856	9.0	9.0	10844067	Top marks to this clean, comfortable, reasonably priced rental with easy airport access.  Columbia City is charming, a neighborhood I otherwise probably wouldn't have discovered, and bus and light rail to downtown, Capitol Hill and other central areas of Seattle are convenient.   If you intend to spend a lot of time in further north neighborhoods like Ballard and Fremont, though, the transit can be on the lengthy side, especially in off-peak hours.  We didn't do much more than sleep at the apartment but felt that the hosts were easily accessible if we had needed anything.  Highly recommended!
47472	1599856	9.0	9.0	11011138	"Cannot get a better location!

It was a quiet neighborhood and all the residents were cheerful and polite. We spent an equal amount of time between this home and venturing out to explore the city. It was a lovely reprise from some of the busy days we had. It is just as nice to stay in, make a french press (they have a couple of them), and read a book, as it was to go out and explore. 

Downtown Columbia City was a treat in itself. Go into town to have a coffee and excellent breakfast goodies at Columbia City Bakery. A rugged in town drinking well called the Hummingbird Saloon makes stiff drinks. Walgreens is down the main road for any items needed at the home front, plus Lottie's had a great brunch!

Beds and bedding were comfy with the apartment able to heat up and cool down very quickly. The kitchen was stocked with everything necessary for a meal and the coffee they left us was a nice touch. Neighbors upstairs were very easy going and down to earth. Washer & dryer beat out all the tough stains. There were tons of extra blankets, down comforters, towels, and linens for your hearts desire. 

Bring an extra book! There is a communal bookcase where you can leave behind a book and take another one with you. I ended up with a great read I had wanted to get my hands on for a while now! 

There is no need to rent a car here. The easiest public transportation I've ever used. $4.50 for an all day pass and it brings you right into the heart of Seattle. If you want, pay another $4.50 for a round trip pass on the monorail that takes you to Queen Anne were the EMP Museum and Space Needle are to name a couple of places!

The communication was quick and thorough. We were given a list of recommended places to go to right from the start, and any questions we had while staying at the property were answered quickly. Prompt, helpful assistance from everyone who helped us with the apartment. 

The price of this place is very reasonable for what you are getting (I personally think a steal), and it makes it that much better with the assistance we got, and the terrific town we were in. Will definitely stay here again when we come back!"
47473	1599856	9.0	9.0	11274148	"Joseph's place was a cool little bottom floor apartment that accommodated the 4 of us well for our 3 nights. The heating worked well and the beds were comfy. 
The full feature laundry and kitchen are great if you need them and there was plenty of little extras for your use such as toiletries and condiments. There is however no TV so if thats what your into beware of that.
The highlight of the place is the location, 2minute walk to the main drag in Columbia City which has a plethora of drinking and dining options from literally every cuisine imaginable, its also  an easy 8 minute walk to the light rail to take you into the city or airport.
Joseph also is very knowledgeable about the district and provides plenty of literature on good places to go whilst on your stay.
Would definitely recommend
 "
47474	1599856	9.0	9.0	11331307	Cute place in a great neighborhood. Dana called to take care of us and make sure everything was all right--very sincere and helpful. Had a few road bumps with some ants and a broken dishwasher, but Dana was very attentive. Would recommend
47475	1599856	9.0	9.0	11666235	Had a great stay right in the heart of Columbia City! It's a vibrant town and Joseph's place is literally two blocks from anything you might need/want! The two bedrooms actually have more light than it might seem in the pictures and everything was exactly what I needed for my stay (also didn't need a car at all!). So grateful to Dana and Joseph for being such great, caring (but not overbearing!) hosts. 
47476	1599856	9.0	9.0	11800968	This is a great spot close to lots of great restaurants. Great communication with hosts. House was clean and very true to pictures. We enjoyed our stay and would return if in the Seattle area again. Thank you Joseph and Dana!
47477	1599856	9.0	9.0	11878818	Joeseph has a nice place.  Clean, well appointed,  diverse library and awesome location.  He was great about communicating with me and flexible with meeting plans.  Overall an easy and enjoyable experience!
47478	1599856	9.0	9.0	12243604	Wonderful hosts. Easy, clean, comfy, crows (you'll understand later). Would  recommend and stay again.
47479	1599856	9.0	9.0	12268998	"Great location!  I think it was more like 1.5 blocks (vs 2.5 blocks) from the train station and the little downtown area with lots of nice restaurants and shops.

The apartment was very well equipped, though we didn't really need to use much of it as we only stayed for 1 night.  Four of us fit very comfortably; cozy, which was really nice, yet the 2 bedrooms allowed for privacy.

I'd highly recommend this place if you want to stay in Seattle but want to avoid the exorbitant hotel rates downtown.  

 "
47480	1599856	9.0	9.0	12890559	"LOCATION LOCATION LOCATION

Like all other reviews stated before me, this was a great place to stay at. It was a great location, easily accessible from the airport & downtown Seattle, and most important check in/out flexibility. The apartment was nice, cozy, and clean. Joseph's mother, Dana, stayed in contact with my mother in law and was very quick to respond. Even though we didn't walk around late at night, the location was safe and quiet. Overall, we had a great experience staying at Joseph's place. When you have a good location, very good price, great reviews, and a home away from home, you can't beat that! "
47481	1599856	9.0	9.0	12993780	Prefect place for our stay! Joseph accommodated us at such short notice and late night arrival, the keys in the lockbox was convenient. Upon entering the sheets from one of the bedrooms and the futon were pulled as if they were going to be replaced/cleaned. The apartment was not ready for our arrival, but luckily there were clean sheets and blankets in the closets. We weren't too put off by it. I'll chalk it up to miscommunication as they mentioned they did not expect our arrival until the next day. The rest of the place was nicely kept. We did not make use of public transit near by but everywhere we needed to go was within a 15min drive. 4 of us stayed more than comfortably for 2 nights, definitely will return when in Seattle again. Thank you Joseph!
47482	1599856	9.0	9.0	13418679	host met us at the house.  Although it was 2.5 blocks from anywhere you need to take public transportation 15 minute to downtown to be anywhere.
47483	1599856	9.0	9.0	13613977	Joseph was able to accommodate our request for an earlier check-in, which we were grateful for.  The place was spacious for the three of us, and it really felt like a home away from home.  Without a car, we were able to easily access the light rail from the place, and we were only a block away from the lovely restaurants and coffee shops of Columbia City.  I recommend this place for any looking to enjoy a respite in Seattle. 
47484	1599856	9.0	9.0	13883181	My family of four had an awesome stay at Joseph's place. It had all the ammenities needed for a weeks stay, full kitchen, comfortable beds and lots of reading materials, games and puzzles. The location is fantastic, so close to the light rail system and easily accessible by car from main highways. They graciously accommodated our early check, Joseph's mom Dana came, showed us the property and answered questions.  After that we had 5 nights and 6 days of fun, fun, fun.  We love Seattle and Joseph's place.  Also, the neighborhood restaurants are a short walk away, plenty of variety, and the ones we went to were great. This was truly a great way to celebrate my 50th birthday.
47485	1599856	9.0	9.0	14003782	"Joseph's apartment is really nice, clean and silent. 
We were 5 people and could easily fit in this place. The neighborhood is also great. The public transportation is nearby and the parking is free. 
It's the perfect spot to stay if you want to explore Seattle!"
47486	1599856	9.0	9.0	14085972	While we didn't get to meet Joseph, he was very clear in communicating and let us pick up the keys in a lock box when we were delayed getting to our meeting time.  The apartment was clean and quiet but we hardly got to use it because there were many cute restaurants and bars on the main strip of Columbia City we wanted to try.  Getting to/from downtown or the airport was very convenient via the light rail so it is a great place to stay if you want to get away from the more touristy side of Seattle.
47487	1599856	9.0	9.0	14344888	Perfect for our girls weekend getaway! Both Joseph and his mother were great hosts! We arrived in the evening and were greeted at the apartment by Joseph's mother, Dana! The Columbia City neighborhood was very quaint and friendly. Dana had lots of great recommendations for restaurants in the area and provided great info for the rail hours. The place was very clean and welcoming and just as it appeared in the pictures. We didn't nearly have enough time to do the things we wanted to do in Seattle and would come back and stay here again, in a heartbeat!! Great place!
47488	1599856	9.0	9.0	14568021	This place was great! Had everything we needed and lots of space. Kitchen had tons of dishes and appliances. Joseph was easy to get in touch with and very helpful about exploring the area. Everywhere we ate was within walking distance and tasty! When we come back, we will definitely stay here again!
47489	1599856	9.0	9.0	14736696	Great place to stay. Joseph and Dana were very helpful with lots of information about the area, and they made us feel very welcome. The location is great, only a few minutes walk to the light rail transit system which goes into downtown Seattle. Half a block to many great restaurants and pubs. We parked our vehicle in the driveway when we arrived and then were able to use public transport to get around the city, very easy and convenient. Will definitely stay again if we are back in Seattle.
47490	1599856	9.0	9.0	15026495	We had a great 6 day stay at Joseph's place with our two little kids! It was truly perfectly positioned, a short walk from the light rail and from the adorable downtown area of Columbia City. The place itself was nice and clean, with two full beds and space in the living room for us to set up the portable crib we brought with us. We weren't able to meet Joseph, but his mom Dana stopped by to make sure we had everything we needed. This was one of if not the best airbnb experiences we've had and we hope to stay again if we find ourselves in Seattle. Also, this is a great place to stay with kids as there is a playground across the street as well as around the corner, and beautiful Seward Park is just a short drive away.
47491	1599856	9.0	9.0	15528389	We had a great time staying at this apartment. Very comfortable and user friendly, equipped with all the necessary supplies for a home-like experience. Joseph's mother, Dana, came over the first day to give us some basic info, and one night we even came home to find some children's books waiting for us! It was a very comfortable size for me, my husband, and our 3-year-old, who enjoyed having his own bedroom. The kitchen is easy to cook in. It is on a cute little residential street that's truly convenient to a lot of things. In one direction you get the cool businesses on Rainier Ave., where we had breakfast at the Columbia City Bakery (fantastic croissants!) more than half the days we were there, and pizza at Tutta Bella on our first night in town. The house is also right across the street from a playground. In the other direction there's the light rail stop, which was a really easy way to get downtown, and to Seattle Center (via the monorail), with a little kid. We were in town for a wedding weekend where many of the festivities took place in South Seattle, and those locations took less than 10 minutes to drive to. The master bedroom gets a lot of sunlight in the morning. Some nighttime noise from the upstairs neighbors walking around, but you get used to it. The only improvements I'd suggest would be a more conveniently located bathroom light switch (it's on the hinge side of the door, outside the bathroom, so you can't reach it from inside the door), and more shelves or drawers to put your clothes. Overall a very nice place to stay, and friendly hosts!
47492	1599856	9.0	9.0	15748536	"We (family of 4) stayed at Joseph's place for 3 nights, and we can report that all was as advertised--especially charming was the multicultural and just plain cool neighborhood.  

We were even allowed to check in early (back from a cruise early in the morn) and check out late (late flight).  Also, the hosts left a full bag of coffee beans to grind.  Nice touch. 

All  in all, to be recommended."
47493	1599856	9.0	9.0	16016717	Apartment was really spacious and location was excellent - easy tram to both downtown and airport.  The neighbourhood was great - lots of bars / restaurants within easy walking distance.  Joseph is a great host - made me feel really welcome after a long flight.  I recommend staying here!
47494	1599856	9.0	9.0	16072271	We had a great time at his place, very straightforward, comfortable and lovely experience!
47495	1599856	9.0	9.0	16345239	Just great! Very responsive and helpful hosts, excellent apartment that suited our family of four (two adults, a teen and a tween) just right. We have deep roots in Columbia City and loved being in the middle of our old stompin' grounds! Also the beds were super-comfy. Will be back for sure. 
47496	1599856	9.0	9.0	16477449	This listing was an awesome place. So close to everything and very clean. We hope to visit again in the future. 
47497	1599856	9.0	9.0	16993018	Joseph was a great host and easy to get ahold of.  The apartment was just as described and close to the subway line into downtown.  There were a lot of pamphlets and maps about Seattle so those were a great reference.  The neighborhood was nice too.  There were quite a few bars, restaurants, and shops within a very short walk.  
47498	1599856	9.0	9.0	17147095	Logement tr칟s propre et tr칟s bien am칠nag칠, parfait pour notre groupe de 6. Bien situ칠 par rapport au centre ville de Seattle, dans un quartier calme. Joseph et Dana se sont montr칠s tr칟s accessibles et chaleureux. Je recommande :)
47499	1599856	9.0	9.0	17428468	Great place, great neighborhood.  Plenty of space, just as described.  Hosts are available for any questions or recommendations.  I would definitely stay again!
47500	1599856	9.0	9.0	17552669	Communication with Joseph was fast, friendly, and very helpful. The place was just as advertised - clean and comfortable, with lots of reading material (both Seattle-specific and wide-ranging fiction and non-fiction). The maps of local establishments were particularly appreciated. The heart of Columbia City is a block away, with endless culinary possibilities. We also took the Light Rail to downtown Seattle to a Mariners game, again very convenient and quick. Lake Washington and Mercer Island are also a short bike ride away, and there is a bike shop just down the street. Next time I plan a trip to Seattle, the first place I'm going to check is Joseph's, and hope he isn't completely booked.
47501	1599856	9.0	9.0	17687465	In a word, great. Joseph was helpful and flexible. Thanks for a great stay!
47502	1599856	9.0	9.0	18169967	We had a very enjoyable experience staying here.  The place was as described, in fact even better.  Good internet connection and an ample kitchen.  Joe and his mother were gracious hosts, with quick response times, and willing to go above and beyond to help us out.  The location was as described, near the light rail and walking distance from some nice areas and restaurants.   Overall, our small group was very pleased and would definitely stay here again.
47503	1599856	9.0	9.0	19279030	Great location and the apartment was charming.  Beds slept comfortably.  Kitchen well stocked with everything needed to cook.  Lots of restaurants very close by.  Light rail 2 blocks away and a great way to travel.  So glad we cancelled our downtown hotel and stayed here.  Did not get to meet Joseph, but did meet his mother, Dana.  She was very helpful I getting us settled.  
47504	1599856	9.0	9.0	19392581	"What a nice place to stay!!!
Joseph did everything to feel comfortable at his home and welcomed us very warmly by providing some maps of the surroundings, which helped us to find a restaurant in the close area. We arrived very late, but that was no problem. The flat is very clean, looking exactly like the pictures promised and is perfect for 4 to 6 persons, additionally there is a washing tube and a dryer. We haven't met Joseph during our stay for 2 nights, but he gave me very helpful informations by phone. His mother wanted to welcome us, but unfortunately we haven't been there, when she planned to see us. Probably we will meet the next time, because it is a wonderful place to stay in Seattle with lots of different italian, american, indian, chinese, greek restaurants nearby and a famous bakery to get a delicious breakfast there. Additionally a public transport stop is very close to get to downtown. (lasts about 25 minutes)
We definitely recommend it to further guests."
47505	1599856	9.0	9.0	19729154	The location in Columbia City is outstanding with easy access to light rail and bus service. There are excellent restaurants, coffee shops and a bakery close by. While there is a Walgreen's pharmacy within a 15 minute walk, there is no supermarket located conveniently nearby. This was a negative. The duplex was well equipped with working wifi, but there was no tv. It would have been nice to have one to watch the news. The hosts responded promptly to our questions. I would recommend this location to Seattle visitors.
47506	1599856	9.0	9.0	19841329	This apartment was a great place to stay for our trip to Seattle! We felt very welcome the entire time we were there, and the place was very close to downtown. Joseph was helpful and quick to respond to questions, and his mom Dana stopped by to make sure everything was going good. We were also very close to a street with a ton of restaurants, and a nice farmer's market was just a street over. I would definitely stay here again if I go back to Seattle, thanks Joseph and Dana for the hospitality! 
47507	1599856	9.0	9.0	20091773	The house was perfect! Joseph and Dana were so helpful and responded very quickly to any questions we had. The house was very clean and walking distance to very good restaurants.  We will absolutely be staying here the next time we come to Seattle. Thank you Joseph and Dana!
47508	1599856	9.0	9.0	20188825	One of the things I love about Air BnB is that you get to stay in places with personality, and this place had a lovely personality.  Really felt like a home, with a great personal welcome from Joseph and a wide variety of coffee making methods and ingredients provided.  Columbia City is a lovely area and extremely well served by restaurants so I didn't even bother looking for a grocery store.  Geraldine's for breakfast is recommended. There's also a farmers market Wednesdays from 3pm.  The place is a bit out of the centre, but close to the light rail and you're anywhere in town in around 15 minutes.  A perfect choice if you're coming in and out of the airport.  Highly recommended and I'm sorry my stay wasn't longer.
47509	1599856	9.0	9.0	20491452	"Joseph and his mother were great to work with. They tried to stop by to meet us a couple of times, but we were out every time. We didn't spend a lot of time at the house because it was our first time in Seattle and we had lots of exploring to do. We were also in town for a wedding so we were pretty busy. 
The photos of the house are accurate and the space was nice. We had plenty of blankets, towels, etc. We didn't need anything, but Joseph and his mom offered to help if we did need anything. 
As other people mentioned, we could hear the renter above us, but it didn't bother us. We felt guilty for talking too loud or making noise when she/he was sleeping, but we couldn't figure out their schedule.
We really liked the location. It was really close to the light rail and you could see the little main street from the house. We ate at Geraldine's twice and liked Empire coffee and sandwiches! We thought the street that the house was on was precious. The little houses were cute and it felt safe. We had a couple of Seattle locals (who live in other neighborhoods) tell us that Columbia City was dangerous or sketchy, but we never got that vibe. Overall we liked the house and loved the price! "
