	home_id	scores_cleanliness	scores_location	review_id	comments
22194	6411986	8.0	8.0	38293695	"Tim was very helpful; he left a detailed note describing rules, amenities, and tips. Replied quickly, and offered directions on how to get there from the airport most efficiently.

The space itself was more cluttered than I would consider comfortable; not that it's not livable, but it seemed every counter, corner, and wall-space was packed and stacked.

The bathroom was in good condition, clean, albeit a tight squeeze, especially in the shower for 6'2"" me. Just be prepared.

I appreciated the extra blankets and sleeping bags! Most of them smelled like dog though, which was a bit off-putting. To be honest, I must have skipped over the part of the listing that said they had a dog. Totally my bad. The listing DOES say they have a dog.

The kitchen was a bit of a mess - there was a cloud of gnats around the sink the entire time. 

It got rather hot at night, and there's no AC or fans. Windows don't have screens (and those that do are ripped open), so I didn't feel comfortable leaving them open.

In summary, Tim was a gracious host, but the space could use some work.

P.S. We had far too much fun with Alexa, the Amazon Echo."
22195	6411986	8.0	8.0	41110315	We were really happy with this place!  Spacious living room and kitchen, garden and great we could use Netflix and plenty of other utilities. The bed was super comfortable. Nice decorations too, with an endless amount of books and movies. It's doable to walk to the center, otherwise a taxi won't cost much. Tim and his roommate are very nice and they helped us where necessary. Also, we basically had the whole spot to ourselves the whole weekend! 
22196	6411986	8.0	8.0	45848567	The bed was super comfy! Tim was out of town but his roommate Rob was very nice and welcoming.
22197	6411986	8.0	8.0	46309920	Tim was great from the get go, super prompt with all correspondence and very helpful directing out of towners :) the house is older but adorable, really nice just outside the city, and everything was very clean. The bed is large and comfortable, the bathroom is clean and large, and the linens were great. Tims roommate is very quiet and conscientious and was really helpful setting us up with getting into the house. Great for young people exploring the city!!
22268	7048843	8.0	8.0	39826794	两个学生对这个住宿很满意！
22269	7048843	8.0	8.0	40145959	Great communication and easy to check in.  Place was simple and just what I needed.  Many thanks for your fast responses to all questions I had.  I enjoyed my stay.
22270	7048843	8.0	8.0	40773937	The room is spacious, Kevin is very friendly. The location is a bit inconvenient but still accessible with public transport. 
22271	7048843	8.0	8.0	41975083	Before my arrival, as well as during, Kevin was very informative and gave very detailed directions to places to eat nearby, as well as sources of transportation around downtown Seattle. The room is quiet, very spacious, and the King sized bed allowed both my friend and I to sprawl out and sleep very comfortably. The complimentary water and shampoo and body wash were a nice surprise. If I'm ever back in Seattle, I wouldn't hesitate to book again.
22272	7048843	8.0	8.0	42938088	Our stay with Kevin was great. We were late checking in, but Kevin was very accommodating and the process was smooth and simple. Kevin was very friendly when we met him outside. The neighbourhood is quiet and pleasant. The room was nice and spacious enough to comfortably accommodate a King bed and Queen mattress. The place in general was very clean. The bathroom was shared with ~2-3 other rooms which was a bit of an issue in the morning but not much. Though we didn't use the kitchen at all, it was somewhat sub-par and probably the only negative of the place. Overall we enjoyed our stay and would recommend the place for a short-term rental.
22273	7048843	8.0	8.0	43541957	Kevin answered my questions very quickly and promptly with tons of helpful information. The room was clean, bed was comfortable, and a clean bathroom. There was a fridge in the room which was great. There was 2 complimentary water bottles, cups, and shampoo.  It was a very comfortable stay. Location was near public transportation. 
22274	7048843	8.0	8.0	43732053	This was my experience using airbnb is was a great! The host was phenomenal very welcoming, made sure that my friends and I were comfortable! It was a great experience and surely I would contact the host again.
22275	7048843	8.0	8.0	43981559	My stay at Kevin's place has been very pleasant. Prior to arrival, Kevin has provided me with very informative messages about checking in as well as tips of getting around the house. The room itself is spacious, bright, clean, and very comfortable. I also had no problem contacting the house owner when I needed help and was replied immediately. Highly recommend this place!
22276	7048843	8.0	8.0	44331789	Kevin gave me all the information I needed to make my trip a breeze. Directions, near by restaurants, and clear instructions of getting into the room. The house itself was a little old so you really had to pull the doors hard to open and close them which was a little noisy, but everything was clean and well maintained. The shared bathroom only posed an issue one morning when I had to wait about an hour to use the restroom because everyone was showering right after each other. However that's expected when 3 rooms share 1 bathroom. Overall it was an easy visit and I'd recommend it for a low maintancene trip. 
22277	7048843	8.0	8.0	44703015	Although we didn't meet in person, the host was very helpful, placing an extra Queen sized bed to accommodate 3 people and also providing useful information on Seattle. The only issue was the toilet was shared among the occupants of 3 rooms. Still on overall a good place to stay and I would definitely stay again when I am back in Seattle.
22278	7048843	8.0	8.0	45122393	Kevin was a great host. My cousins and I were in Seattle for just the weekend so we only needed a place to pretty much freshen up and sleep, so the 4 of us were looking for to squeeze into one room. Kevin's large room not only had a king size bed, but he also provided another queen size mattress to help us be more comfortable. Everything went smoothly this weekend and the location is prime as all areas of Seattle were within a quick, cheap uber ride away. The bathroom was shared with 3 other guests, but this didn't turn out to be a problem for us and hopefully not for them either. Overall great stay!
22279	7048843	8.0	8.0	45697553	Kevin was very insightful and helpful in our stay and provided us with very convenient methods of checking in and checking out. Was very good at replying messages promptly and catering to our needs.
22280	7048843	8.0	8.0	46172861	My group of four had a wonderful stay at Kevin's for bumbershoot weekend. It was easy to check in and the room was exactly as described along with an extra mattress. It's in a nice neighborhood with easy bus access to downtown and a chill place to get some good pizza within walking distance. Kevin was excellent at communicating all the information needed to make our stay in Seattle the best it could be and was always quick to respond to any messages. 
22281	7048843	8.0	8.0	46768024	Very hands off and low-key, which I loved. Less like a room in a house and more like a hotel room. Kevin was very gracious about communication and recommendations. Also came across another person that lived in the house and she was extremely polite and friendly :)
22282	7048843	8.0	8.0	47276733	"My friends and I loved the airbnb room. It was perfect for our needs. 
The listing description was accurate. We loved that the house was near a big park, community garden, and bus stops. I appreciated that the host always responded back to my questions ASAP. For the affordable price, the room was high-quality, spacious, and clean. No complaints here. "
22283	7048843	8.0	8.0	48894807	Phenomenal location. Great place to crash. Sitting to eat a bit of a challenge (if you want to eat in). GRACIOUS host. Clean rooms. VERY accommodating. 
22284	7048843	8.0	8.0	49393038	Great communication, easy access, everything was clean and just as described! Great place to stay.
22285	7048843	8.0	8.0	50054209	A great value for Seattle. It's nothing flash, but if you want a good location and to save a little money, this is the spot. Kevin runs his Airbnb house smoothly so there is a lot of flexibility for check in and coming and going without host interaction. 
22286	7048843	8.0	8.0	50492543	The host is nice to give many food and traffic message. This room is lovely, but too small for four person. The kitchen and bathroom is not clean enough. Too many tenants at the same time in this house, so we should wait to use bathroom and kitchen, it's not conveninent. And the other tenants didn't wash dishes immediately, so the kitchen sink is dirty and messy.      
22287	7048843	8.0	8.0	50785364	We are really dissapointed. The bathroom was very dirty. The house smelt not well. The hallway was not clean. We will not come back to this house. 
22288	7048843	8.0	8.0	51061197	Near downtown. The room is ok. The landlord offered many information.
22289	7048843	8.0	8.0	52782373	Wonderful place!!! Located in a quiet, clean, safe neighborhood. Very close to multiple bus routs making it very easy to get anywhere.  The Room was large, clean and offered many wonderful amenities even had fridge and  tea kettle in the room. Would definitely choose to stay here when returning to Seattle 
22290	7048843	8.0	8.0	54218593	Kevin has his Airbnb down to a science. Everything was nice and easy, check in and check out is all automatic. Room was exactly as pictured, everything seemed great. For the price it was really good deal.
22291	7048843	8.0	8.0	55444574	We enjoyed the stay-nice host! Easy and fast to go to downtown and nice bedroom. Only wished that the washroom and kitchen is more clean.
22292	7048843	8.0	8.0	56685043	Kevin is easy to work with and the stay was nice. The bus routes are by his house and are easy to get to the downtown or Udub.
22293	7048843	8.0	8.0	57826018	Was very comfortable, Kevin responds quickly to messages and I will stay again in my next visit
22655	9532861	8.0	8.0	55326289	Beautiful loft. Internet did not work, which was unfortunate. Great place if you are looking for minimalism and a convenient location.
23851	3316219	8.0	8.0	16211604	"We stayed in the downstairs unit at Gavin's. Located close to several bus lines to both downtown and the U District in the gorgeous Eastlake neighborhood, Gavin's place was the perfect space for our stay. The unit was spacious, contained all the essentials (including cookware, hairdryer, towels, etc.), was easy to access using the security coded doors and, with two bedrooms and two couches, allowed the three of us to stay very comfortably. 

The unit is also just blocks from Lake Union and nearby several restaurants, as well as the famous Voxx coffee and a few bars. It's also just a 20-minute bus ride from downtown, Pioneer Square, CenturyLink Field, Safeco Field, the waterfront and Pike Place Market. 

Gavin was very responsive and his manager Pushpa was available for any questions or needs while we were there. Parking was also available for those who will be bringing a car. Be aware that the house is right next to Interstate 5, so you may have to get used to noise but within a day or so we were used to it. Overall, we had a great stay and would recommend the space to anyone looking for an ideal location without being in the middle of downtown.

"
23852	3316219	8.0	8.0	16725335	My friends and I enjoyed our stay at this residence. The housekeeper, Pushpa, was readily available to answer questions and was very accommodating with our early check in and late check out. The room with 2 Queen sized beds was really a room with one Queen sized bed and a Queen sized mattress on the floor. The space did not look like the pictures. The location was pretty good but you really should have a car. We used Uber to get around everywhere. There is wifi but it wasn't the fastest. There are a few places to eat and a convenient store down the hill. Overall it was clean, not too noisy, and in a relatively good location. 
23853	3316219	8.0	8.0	16987716	"The house was on a busy street and a little difficult to park and get in and out of driveway. The housekeeper was nice and easy to get in touch with. 
"
23854	3316219	8.0	8.0	17137581	Nice big space, convenient location.  The flat could have been cleaner and the wifi network was non existent. 
23855	3316219	8.0	8.0	17779755	"Busy/noisy location near the freeway. Parking was a challenge, but we worked it out with other tenants and some car juggling. 

Unit was not as clean as I would have expected for the price (dirty towels hanging on backs of doors for example), and some maintenance needs to be done in the bathroom and kitchen to bring the unit up to snuff. We were unable to close the bathroom window, as it had apparently been 'painted open' instead of 'shut'. The window is alongside the back deck, which could easily be reached from the ground. This was a little unnerving to my wife, who wondered if we would be safe as we slept. 

I would suggest a modest investment in a plastic tray to help unjumble the mismatched flatware, and perhaps a set of matching plates/glassware for the cupboard. As it was, it seemed like all the kitchen utensils were purchased at Goodwill. It looked like a paint job had been done in the recent past, but I don't think the painters paid a great deal of attention to detail. That could be revisited to good effect.

The online photos look very nice and might be a little misleading. On close examination that only comes with actually being there, it didn't seem as clean/straight as the pictures looked. (I don't think that's deception on the part of Gavin: I'm just saying that pictures only tell so much and they looked nicer than reality) Someone more discerning than I might be disappointed.

Gavin was polite, responsive and pleasant, but our dealings were with his coordinator, who was 40 minutes late for our check-in (2:40pm), then wanted into the unit 20 minutes early the next day. She was polite, but it was mildly inconsiderate, given their *strict* check-out time of 10am the next morning. I understand that there were unusual circumstances that weekend, but given the lateness of our check in, I would have expected the courtesy of waiting until the agreed upon check out time to come knocking at the door.

The bedrooms/living room were fine and comfortable. The bathroom and kitchen could use some work. I would have been OK with all of this if the price had been more reasonable. As it was we could have stayed in a very nice hotel for the $200 we were charged.

It must sound like I was very unhappy, but I wasn't. The place was 'ok'. With a few improvements in maintenance and process I would upgrade it to a B. Drop the price to an appropriate $125 and I think Gavin has a very reasonable place to stay for a quick visit. At it's current state/price point, I don't think I would book again however."
23856	3316219	8.0	8.0	18006701	I'm sorry to say that our stay was less than desirable.  The house, albeit old, was in a somewhat dilapidated state, especially where the plumbing was concerned.  Also, we don't think our bed sheets had been washed and there were small blood stains on the sheets.  The hot water handle on the bathroom sink is missing a screw so the ceramic handle kept falling off.  I think a youth hostel would have been more comfortable and clean. There was a towel in one of the drawers that had stains on it.  Super gross!
23857	3316219	8.0	8.0	18246169	The place was as advertised and easy to get to from the bus line. Thanks for having us!
23858	3316219	8.0	8.0	18567316	Gavin is being very helpful. The space is clean and nice, located right off the highway. Slightly loud if the windows are opened. Love the parking space. Great experience overall. 
23859	3316219	8.0	8.0	18612679	"We stayed for a quick night at Gavin's after coming back from a backpacking trip on the Olympic Peninsula -- some showers, a dinner in Eastlake, and then fell asleep and left first thing in the morning explore the city -- and it suited our needs just fine. I should note also that we ended our hiking trip a day earlier than expected, so we booked Gavin's place last-minute in the afternoon of the day we planned to arrive; it was great to be able to find something so quickly.

It is right near the highway,  but we didn't have any problems with traffic or noise. Our main suggestions would be that the shower and lighting could be updated a bit (the place definitely looks better in the daylight of the pictures, but to be fair, we arrived at night and left early), and on a warm night it was a little hot with no fans that we could find and some windows that wouldn't open. I did call the manager Pushpa to clarify where we were supposed to park (the language in the house manual was a little confusing) and it went straight to voicemail -- but, it was a last-minute booking, and we didn't end up having any problems with it."
23860	3316219	8.0	8.0	18631547	The place was in a convenient location and clean and tidy - great for our quick one night stay.
23861	3316219	8.0	8.0	19042762	My trip to Seattle was amazing and it wouldn't have been possible without Gavin. The house was beautiful, clean, and just a few minutes from down town. It was right off of the 5 making it so convenient to get to, didn't have to worry about getting lost in a new city. The drive way was big enough for 2 cars (if you really squeeze them in there) which is impressive for being so close to down town. Although I did not personally meet Gavin, he had amazing response time and was vary helpful with questions I had. If I visit Seattle again (which I plan to) Gavin will be the first place I look!
23862	3316219	8.0	8.0	19205406	Gavin's place suited our needs perfectly, as it is situated in a convenient location and was a short walk from where our family we were visiting live. It is right nearby the I-5, but we didn't find the noise to be a problem at all. 
23863	3316219	8.0	8.0	19365157	A tad disappointed! Water pressure in sink very bad! Kitchen old and inadequate! Windows didn't close! TV didn't work due wifi down! No clothes iron. A little bit away from life (25 min walk) all in all very disappointed as this was my first and worst airBnb experience  
23864	3316219	8.0	8.0	19537799	"The house was a mess when we arrived at check in. The house keeper didn't come until two hours after we checked in. 

There is NO wifi and if you tell Gavin about this he will begin to read his laundry list of excuses of how it's not his fault or problem but either yours or the internet providers... neither of which is was (because I called the company on his behalf). 

The shower leaks on the ground.

The windows are propped open with no way to lock.

The floors feel unswept and mopped, which makes me even more concerned about if the sheets are actually changed. Seems like the cleaning lady just spot cleans.

The location is really great. 

There is lots of space for plenty of people to have a nice comfortable time.

The pull-out is literally a giant mattress you pull out of the closet in back... but that frees up an extra couch.

Honestly, I'm tired of AirBnb hosts thinking they can buy properties, rent them all out to make an income, evade tax laws of the hotel industry because of this, and just treat their guests with no respect. WE ARE PAYING CUSTOMERS, NOT HOMELESS PEOPLE YOU ARE PUTTING UP FOR FREE. Gavin spoke to me like I was indebted to him for some reason and yet made no effort to seem conscientious that his lack of care and misrepresented amenities created an awful amount of trouble for us as working professionals trying to make a quick weekend getaway home for a reunion possible amidst our busy work schedules.

If you just want a party house and don't care about anything but a place to crash and pack in a ton of people in a good central location, this house is a perfect rent for you. Just don't tell him how many people you have because he'll never know anyhow. When we asked him if he could come by to help us with his archaic wifi router, he insisted it'd take hours since he in not in the area but he could send his house cleaner by, who was a very nice woman, but he expressed directly as ""not able to understand technology, even basic email communication was difficult"".

Anyhow, we are happy people and still were able to look past everything, but don't believe the hype. This is just a conveniently located place to drop your stuff off and go find the real beauty of Seattle elsewhere.


"
23865	3316219	8.0	8.0	21648357	The place was clean, furnished well, and very spacious. 
23866	3316219	8.0	8.0	22508545	The house was clean and has a lot of character. It was a perfect place to stay for a few nights and in a cool location. 
23867	3316219	8.0	8.0	22780325	Good stay. Exactly what I was looking for. 
23868	3316219	8.0	8.0	23118527	Gavin was a very gracious and laid back host. He was nice enough to bring us more towels. The apartment is relaxing and it posesses a quaint charm. You can hear some road noise but that did not bother me. I liked the neighborhood and being so close to the lake and some cute houseboats. 
23869	3316219	8.0	8.0	26789404	It was a great time to stay for a girls night in so cozy and spacious apartment. It is very nice, vintage and close to restaurants. Thanks Gavin! 
23870	3316219	8.0	8.0	27419890	"I had a last minute trip to take family from AZ to visit Seattle for a site seeing and possible future move, so finding a place close to downtown and easy to access was great! We arrived late after touring the back roads from Portland to Seattle and enjoying the Bremerton Ferry view of the city. I received info from Gavin in a detailed text message while out of phone service and had everything we needed to access the house. The apartment was clean, neat, made beds and towels ready. A great last minute find for a quick overnight trip. Gavin offered places to visit in the neighborhood, but we had a short schedule to get around the city. The best part was off street parking and walking straight into the apartment. No, parking 3-4 blocks away and taking everything out and repacking in the morning.

Great access to Pike Street, Space Needle, Capitol Hill, and beyond. I would stay here again. "
23871	3316219	8.0	8.0	27478631	"The place was nice, with typical old place ""quirks"" (lack of electrical plugs, somewhat placated by extension cords placed here and there, squeaky floors, old school kitchen etc), and the photos are very accurate (though now they have some nice dark leather couches instead of the white cloth ones shown in the pictures. 

I had trouble (my own doing) getting in, Gavin was available by phone quick and walked me through it. Place was SUPER CLEAN, and though it is almost right next to the I-5 highway, wasn't too bad on noise, especially in the back bedroom.

Kitchen is well stocked - dive into the cupboards and you'll even find a hand blender, mixer, lots of bowls and stuff to cook with, good amount of glassware, etc. There's even candles and such to light up in the evening if you want. 

Be aware - there's a TV, but nothing plugged (there was a remote for something to access netflix, but couldn't find the actual thing to make it happen). If you bring a Chromecast, you're set.  

Internet speed was okay. Horrible going up (I tried to upload my photos to the cloud storage, that was mission impossible) but good enough down to your computer to watch netflix or something else.

Overall, a great deal, for a reasonably close stay to ""the happenings"" in Seattle - 2 blocks down a hill and you're in the Eastlake village area. Hop in your car, drive on Boylston / under the highway, and you're a few minutes away from 12th and the Broadway Capitol hill neighbourhoods. 

Recommended, and I'd stay here again."
23872	3316219	8.0	8.0	27501134	Very convenient and centrally located!!! Worked out perfect for our one night in the city!!!!
23873	3316219	8.0	8.0	27879038	The apartment is spacious and easy to get to. We drove so don't know how convenient it is for public transportation. The code to get into the apartment door didn't work but the host responded right away and sorted it out. The wifi was spotty and slow at times. The upstairs guests were loud and running footsteps could be heard all afternoon when one of us stayed in. We didn't actually meet the host but he was helpful and quick to respond via the app. We had a great trip to Seattle.
