	home_id	scores_cleanliness	scores_location	review_id	comments
39754	1484651	9.0	8.0	36324127	The space is spacious and unique.  The host was very welcoming and accommodating.  The location was a quick Uber ride from the International district and short walk to the SoDo Link station, which made getting around town a breeze.  There's a Tully's on the same block for a breakfast.  Next time, I'll make time to book a massage! 
39755	1484651	9.0	8.0	36599301	Jeff and Mary are very kind and thoughtful hosts, and they worked very hard to make sure our stay was comfortable. The hostess who checked us in did everything she could to mitigate the fact that we arrived in the midst of an unprecedented heatwave and brought us every fan in the building! We also really appreciated how helpful and flexible they were when there was an initial mishap with our booking dates. The space was clean and comfortable, despite the heat. I particularly liked that the space could accommodate several adults with multiple beds, and had several bathrooms with luxurious bathing options. 
39756	1484651	9.0	8.0	37879505	Our family of four enjoyed our stay at the Little Red Day Spa very much!  We were able to get out and explore Seattle during the day, using public transportation easily.  At night, we refreshed ourselves with a hot tub or a bath and explored Jeff's beautiful artwork.  We are early risers which was probably just fine since the weekday traffic noise did build up quickly.  Mary was very responsive to our questions, and made sure that we had everything we needed.  
39757	1484651	9.0	8.0	38296469	This place is great for anyone who wants to take advantage of a relaxing nights stay.  The listing had great amenities, the check in was very easy, and Jeff was very communicative to all my concerns.  I would highly recommend this to anyone looking for a tranquil retreat. 
39758	1484651	9.0	8.0	38597119	Super great place! Staff was amazingly sweet and helpful! The space is unique and the artist is very talented. Lots of perks with hot tub and sauna use!
39759	1484651	9.0	8.0	39089772	What an incredible discovery! The accommodation was fantastic, the facilities were sublime, and whole experience was a pleasure. Thank you for making this wonderful place available to guests - what a treat!
39760	1484651	9.0	8.0	39229778	We checked in Sunday and were greeted by one of the workers at the spa.  Never met Mary or Jeff.  Although she was friendly, the young woman was not able to provide info on things such as how to get around or places to eat.  The area is pretty isolated it seems as it is in an industrial area. I suggest that maybe a guest book with bus or metrolink info as well as places to eat nearby be provided for guests.  On to the accommodations.  Being that so many people gave such high ratings, my expectations were high.  I hate to say it but I was disappointed. The place is unbearably HOT!!. Might be a good thing in winter but our stay was in summer.  Had to sleep with the fan blowing in my face all night to be remotely comfortable.  Especially upstairs where the beds are. The room is interesting but is in need of some updating.  One bed is just a mattress on the floor and the other has an extremely soft mattress.  Our heavy material at the windows fell at some point since they were not really drapes but just clipped up at the window.  This place has potential but needs some attention to detail.  Having access to an iron to take the wrinkles out of our clothes once we unpacked would have been nice.  On the good note, bathrooms are very nice and having the body scrubs were a nice touch.  Mary was also very accommodating in allowing up to stay way past check out since we had a late flight and the spa is closed on Monday. And it is nice to have the place to yourself. But overall I found the place to be very dark and in need of more attention.  Wish I could give a better review but have to be honest. 
39761	1484651	9.0	8.0	39587806	What an amazing place!  I had a last minute meeting in Seattle and needed a place to crash.  Within minutes of requesting a reservation, i was emailed by the host.  They were able to accommodate me and were extremely friendly on the emails.  The place is honestly AMAZING!  
39762	1484651	9.0	8.0	39684536	"When arriving at the Little Red Day Spa, it takes just a second to adjust to the fact that there is no receptionist desk, or the standard spa feel with product line plastering the walls and sale signs on everything from candles to lotions.  Instead, you walk into the door of a charming historic building with renovation touches that compliment the tradition within.  One can not help but immediate notice the 20 foot tall paintings, the old hardwood floors from yesteryear, and of course this is your impression just in the blink of an eye.

The Moroccan room is the room that is offered for couples (or a party of 4) which is up on the third floor. The iron staircase you climb to the top is adorned with lighting both ambient and whimsical and more paintings and wall murals adorn your trip to the top.  Once into the long rectangular room, one notices that this is going to be unlike any stay one has every had before.  The lighting is most certainly inspired by a Moroccan theme and the wood furniture, all help reinforce the theme. The room has a bohemian sparseness about it that makes one instantly feel comfortable.

While we didn't use the cable tv, or the Amazon Prime movies that were offered, we did enjoy having the run of the place after the staff left. The hot tub in the Art room was wonderful and all the little touches that were left around for our use were kindly used. Scented Sea Salt rubs for the skin helped remove the clay mud applications that we placed on each other and the giant rainfall shower helped cleaned us off.

The best thing about the Little Red Day Spa is its promising potential. While already getting a solid 5 stars from us, this unique venue has so many blank walls for the host to adorn with his paintings or murals that I am eager to return again in a year and see how much greater an already great thing can be!"
39763	1484651	9.0	8.0	39958903	Though somewhat tucked away in an industrial area, based out of a section of the old Ranier Brewery, the Little Red Day Spa offers amazing space, soaring ceilings on the main floor, to the large bedroom loft on the third floor, rich fabrics and soft lighting... Mary, the General Manager of the day spa, Stevie, and staff were friendly and helpful, and ensured we had a comfortable stay. For a unique Airbnb experience, the Little Red Day Spa is a must see.
39764	1484651	9.0	8.0	40532262	"It was great, they actually have a team of people around working on various aspects of customer service. When you show up at the front door though, they are 100% focused on you. I had phenomenal communication from this team of people. 

Pretty much everything people are saying about the unique charming character of the place and the artwork and amenities are spot on. I won't restate them. "
39765	1484651	9.0	8.0	40696451	What a great find in the Seattle area - way better than staying at an overpriced hotel! Booking was a breeze, I mainly communicated with Mary the spa/reservation manager who made sure there was someone there to greet us and make sure we had everything we needed to get settled in. The rooms were clean, spacious and beds comfy. We also made full use of the spa facilities (mud, salt scrubs, etc...) and hot tubs, which were a treat after a long day of shopping. One little thing I would caution on is that the rain shower downstairs beside the hot tub can get a bit slippery especially if you've followed instructions and showered with soap before getting into the tub. So to avoid a tumble like I did either bring flip flops (highly recommended) or tread carefully if you decide to take a rinse after soaking in the tub. Otherwise a great stay and would definitely return! 
39766	1484651	9.0	8.0	41176028	"The little red day spa was truly a treat and place I would love to return to. We started our arrival off by first visiting the winery next door and enjoying a lovely tasting. We then checked in and were shown to our room. We chose to stay on the second floor suite with the master bathroom. Both suites were beautiful, but the third floor suite is much much bigger in real life then it shows in the picture. I thought it was only the floor bed when I looked online so we booked the 2nd floor suite. Doing it again, we would probably choose the 3rd floor suite-not to take away from the room we stayed in, which was absolutely beautiful as well. 
My husband and I enjoyed the spa to the fullest. I was expecting a small space with a hot tub and maybe a couple of massage tables but we were blown away. 
Upon our arrival there was music playing, candles lit and the hot tub ready (with the perfect temperature for summer). A beautiful grand space with body scrub and mud mask were out for us to enjoy. We left feeling totally relaxed, reconnected and completely pampered. 
I couldn't recommend this place enough. Jeff's artistry really shows in every corner of the little red day spa. "
39767	1484651	9.0	8.0	41568402	"The suite at the Little Red Day spa is excellent and great value for money. The hot tub in the lobby was a great amenity and my wife enjoyed the complementary mud pack. I didn't get to try the sauna on this trip. 

Highly recommend this to anyone looking to unwind after a long day of checking out all that Seattle has to offer. "
39768	1484651	9.0	8.0	42437807	Had a good stay. The use of the spa during the evening was a nice perk! The location was convenient for getting to the metro to head downtown or to the stadiums. Please note that when staying in the room on the third floor, if there is someone in the suite on the second floor, you will be required to use the communal bathroom on the first floor. 
39769	1484651	9.0	8.0	42630478	Host's were very welcoming and flexible with arrival times. The spa was clean, nice, and has a very relaxing feel to it ( go figure! ). A little warm on the 3rd level when we arrived, but with the fans provided in the room we were able to sleep well. Would definitely stay again.
39770	1484651	9.0	8.0	42669297	It was a great experience. Such a nice hot tub. Convient to the metro link. Inside the old Ranier brewery!
39771	1484651	9.0	8.0	42860045	We had a great time and the whole process of checking in and out was very easy.  Loved the accomidations and the people there were very friendly and quite helpful. 
39772	1484651	9.0	8.0	43705928	The hosts were attentive and welcoming.  They let us drop our bags off early which was much appreciated.  However, when we returned to our room for the evening our experience was not so great.  Someone walked in to our private bathroom while it was in use.  The inner door to the bathroom was closed but we did not see an outer door to the hallway and another guest walked in.  This was partially our mistake but we feel that the owners should make it clear that the bedroom/bathroom on the second floor are private.   There was also loud drumming coming from one of the other buildings in the complex.   The location is not a residential area so the drumming may have come from another business.  We contacted the owner and both issues were addressed but the experience was unsettling. The bathroom was beautiful but the bedroom was dark and did not have windows.  The bedroom was long and had a bed and a massage table so I assume it is used during the day for massage.  The mattress on the bed was nice but we both had trouble sleeping  because the room was quite warm and stuffy.  There was a small fan and we left the bathroom door open to allow for air from the bathroom window but it was still uncomfortable.  This location may be a good option for some because it is reasonably priced and the owners were helpful but we did not have a great experience.   
39773	1484651	9.0	8.0	44059161	Very comfortable, nice big space. 
39774	1484651	9.0	8.0	44209658	"My husband and I were very excited to stay here for our anniversary. A few words of advice for people booking here, however. 

Call ahead and schedule your check-in time. We didn't do this and we weren't able to check-in until about 4.30. We called a number of times earlier in the day but Mary was in session with clients and couldn't pick up the phone. We hung out at Bartholomew wine next door which is awesome. 

Secondly, before you make your reservation, get clear information on the use of the hot tub, sauna and other communal areas. Again, we were excited to arrive in the afternoon and have time to use the sauna and hot tub before heading out for the night. We were able to use the sauna which was great but the staff seemed a bit annoyed about turning it on and giving us access to the room. We were really sad when we found out that clients were using the room with the hot tub and we wouldn't have access until 10pm. 10pm became 11pm and we had an early flight in the morning - just a bit disappointed. 

We stayed in the Sky Suite which is spacious and the bathroom is great and was very clean. The bed is essentially a mattress on the floor and that was fine, but there are no windows in that bedroom. Also, the door to this bedroom does not lock - that always makes me nervous given that other guests are wandering around the spa at all times. 

While the downstairs was a bit dark and dim, this didn't bother us too much because we checked in so late in the day.

We didn't have too much interaction with the staff and while everything was fairly explained to us, we were just disappointed overall, especially at $224 a night. We were excited to celebrate our anniversary and had mentioned this to Jeff ahead of time. We had read other reviews of wine and the like being provided but I think given how busy the spa was that day, we were a bit of an afterthought. 

Overall, very cool venue, I would just be sure you can check in early and if you do, that you can actually use some of the services in the Spa. "
39775	1484651	9.0	8.0	46142237	The Little Red Day Spa is an absolute gem in the midst of an industrial part of the city. My brother and I stayed here for labor day weekend and were able to check in a little early and leave whenever it was convenient for us on the day of check out. The whole checking in and out process was thoroughly easy. Jeff and Mary are absolutely accommodating and kept us informed of what is to be expected (with their spa clients, hours of operation, etc). We were able to use the spa facility which was very nice. We felt as if we stayed in our own home. This is most definitely, a recommended spot! 
39776	1484651	9.0	8.0	46839846	Amazing place and great price for what you get!
39777	1484651	9.0	8.0	48362962	Was so great staying here! The room was great and use of the spa was a huge bonus. 
39778	1484651	9.0	8.0	48916509	My friends and I had a wonderful experience staying in the Moroccan suite at the spa! The location is convenient to downtown, the room is huge and fit three women and all our stuff easily, and everyone working at the spa is so welcoming. They have bottles of wine for purchase (only $10) and it was delicious. We weren't at the spa much, since we were out exploring both days we were in Seattle, but every time we came back it was so peaceful and relaxing to be there. We especially loved the little fireplace and cashews on the mantle in the lobby!
39779	1484651	9.0	8.0	53306950	"We were in late at night and out early in the mornings, so unfortunately we didn't get a chance to interact with the hosts in person, but they were very responsive and helpful by text message.  The room was great - two comfortable beds, tastefully decorated, and all the amenities you would hope for.   

The downstairs areas were absolutely incredible and are the main reason I would highly recommend staying here.  The hot tub and shower room is enormous (20ft+ ceilings), beautifully lit, and filled with amazing paintings.   Showering in that room in the morning was the best way to wake up."
39813	3544964	10.0	8.0	16325702	Chris is a wonderful host! From the moment I arrived she made me feel right at home. The location is just a short walk to the Link railway that takes you right into downtown in about 20 to 25 mins, so for me it was perfect. Chris is so chatty and was very considerate to my needs, and I loved wondering around her garden! The room was very comfortable and cheery and was a pleasure to come back to in the evening after a long day of walking around the city. I left here feeling like i was leaving a friend. I would definitely consider staying here again.
39814	3544964	10.0	8.0	16376449	Cris was a fantastic host and honestly, could not have been any more helpful.  She was very welcoming and kind, and was extremely responsive and attentive to all of my questions and needs both before and during my stay.  The room and bed were also very comfortable and I got a great night's sleep.  Highly recommend her and the place and would gladly return!
39815	3544964	10.0	8.0	16759369	Good stay. Hospitable people and a clean house/room. Only negatives were that the bed was a little firm for my liking and that the neighborhood was confusing during the evening. 
39816	3544964	10.0	8.0	17015661	Cris's place was nice! The neighborhood wasn't amazing but it wasn't that bad either. It was a pretty short walk to the light rail and bus. Her dog was also really sweet!
39817	3544964	10.0	8.0	17320816	It was great to stay at Cris house. The location of the house is just 10 minuets walking to the Light Rail. The room was clean and neat. Cris is a great host and helped me to know the restaurants nearby and how to go to downtown. Thanks Cris!
39818	3544964	10.0	8.0	18901026	"I put my family members up (a couple in their 50s) up with Cris and her husband, and right of the bat, they all had a great connection. Drinks and food in the kitchen came complimentary with the room and the guests could enjoy a guest bathroom.

They still keep talking about the way in which staying with Cris made their trip so much better. Thank you for that!


For people looking to book: right between Othello and Columbia City light rail stations. # 8 bus runs right by.  It is not in the heart of the city, but conveniently located and easy to reach by public transportation.

Clear recommendation if being very close to downtown is not a high priority for you.

"
39819	3544964	10.0	8.0	20210879	"Cris is a great host who is doing a very professional job. The house is clean, organized and amenities have easy access. Cris and husband share the common areas with guests, but it's fine since they are friendly. I'd recommend this place for a short or extended stay.
"
39820	3544964	10.0	8.0	21013523	"Cris and her husband were warm and friendly hosts. The room was as described and the minor issue with the TV channels were fixed before I returned from work by Dan (the manager) the next day. 

I'm glad I had a car, as the hill to get to the buses and/or light rail would have been a challenge. Cris watched a Seahawks game with me on the big TV in the living room, and though she didn't know a lot about the game, her enthusiasm for the Hawks to win was adorable. 

I was not aware that there are dogs living in the house (one belonging to the host and another with a guest), and would have liked to have known that prior to booking. 

Overall, it was a welcome respite during this time of transition in my life, and I hope to see Cris and her husband again in the future to thank them for their hospitality and kindness. "
39821	3544964	10.0	8.0	34261960	"Cris was great at responding to my late request to stay. The room was quiet, clean and comfortable and Cris was a terrific host. I was even given a lift from the light rail stop nearby so my rather tired, jet lagged body didn't have to cope with the walk. 
My main reason for the trip to Seattle was to visit the Boeing museum and while this was a great spot to stay for that purpose, the convenience of the light rail made getting into downtown really simple too. I would be happy to stay again if I return to Seattle."
39822	3544964	10.0	8.0	34812563	Cris was the ideal hostess. Room was perfect. In fact the entire home and yard were fabulous. Super clean. Quiet. Her little dog fell in love with me cause I gave her popcorn. She was so generous. Coffee YUM! Parking was good. Neighborhood was safe. I would definitely stay here again. Their air conditioning was not good so if it is going to be hot in Seattle rethink your stay.
39823	3544964	10.0	8.0	36902290	"I had a great experience staying here! I stayed for about a week and half when I first moved to Seattle for a new job. I was pretty blown out from the move and new job and it was wonderful to have such a welcoming and quiet home to come back to! Cris is extremely kind and a very welcoming host. They really have set up their home to make their guests feel as comfortable as possible, even if that just means giving them space. Cris gave me a tour right away and worked to make sure I felt at home. I would definitely stay here again!

        HIGHLIGHTS:
• The shared bathroom was very clean and right next to the room.
• They have coffee, croissants, and fruit available for you every day!
• She gave me fridge space and I was able to cook when I needed to.
• I was able to do laundry and the washer and dryer are new.
• You get your own room key and the house code when you arrive.
• There is filtered water in the kitchen.
• The bed was comfortable and the room was clean and exactly as shown (but with new comforter and sheets).
• There was always plenty of parking and easy Light Rail access.
• I was in Seattle during a heat wave and there is no AC in the house, but there was already a fan in the room and Cris brought me an extra one and checked in just to make sure I was comfortable!
• Cris has a little dog who is very sweet and quite smart. She might bark a bit when you first arrive but not in an excessive way and is very well behaved. I loved having her around!
• I think smoking is allowed on the porch and outside. So you might smell it a touch but I have asthma (and am quite sensitive) and it never bothered me once. Cris and guests are very considerate."
39824	3544964	10.0	8.0	37244550	Staying with Cris and her husband was very nice, they were very welcoming and the room was nice. They also gave us nice advice on what to do in Seattle. The room doesn't have any aircondition though, so it was a bit hot. Buy a very nice stay and I would definetely recommend staying there!
39825	3544964	10.0	8.0	37515613	"The room was great!  The room was very pleasant and the entire house (room, kitchen, bathroom, etc) was clean and neat.  Cris is extremely welcoming, helpful and has a very wonderful energy about her.  The train is an easy ten minute walk away, which takes you directly downtown.  Good location.
I was a really warm weekend to visit (mid 90s), however there were two fans provided and kept us quite cool through the night.
Would recommend staying with Cris!!
"
39826	3544964	10.0	8.0	38309278	"Thank you Cris for providing us with a great room for our trip.  Your hospitality and warm personality made us feel welcome; and we enjoyed your dog too! Bed very comfortable, space immaculately clean, quiet at night. It was perfect for us!
"
39827	3544964	10.0	8.0	42544881	"The room was fine, it's called sunset because the sun hits the window at sunset :D 

Cris is a great host, there are some included extras (like free coffee) that should be an example to other Airbnb's; also Cris is well organized and she will assign you an allocated space in the bathroom for your personal things and in the fridge or freezer.

I loved her dog Jening, it's lovely and well trained. 

Location is 10 minutes walking to the link station and 5 min to bus 36. If you are going to downtown at morning, its worth those extra 5 to catch the link and avoid traffic. Safeway is next to the station as well.

Nice place, nice host, just exactly what I expected :D"
39828	3544964	10.0	8.0	42763381	Cris is a warm-hearted and charming lady. Her house is tidy and cozy, and her dog jennie is so cute! Apart from her house, the neighborhood is also quite, safe and clean. I thank her for holding us and truely mading us feel like home.  
39829	3544964	10.0	8.0	42914669	"Chris and her husband, Raul, were awesome hosts! They were friendly and made us feel at home. The room and bathroom were clean and comfortable; exactly like the photos. 
The location was a short walk to the train, which made it easy to get around. Great experience!! "
39830	3544964	10.0	8.0	43136618	We had a great experience here and would recommend it to anyone looking to stay in the Seattle area. The room and house were very welcoming and clean. 
39831	3544964	10.0	8.0	43710602	This place has been the most successful place ever since I started airbnb. Cris and her husband were so nice and friendly, and the room was perfect with tourist books and a map of neighborhood including markets and restaurants. They kindly answered whatever questions we asked. The room, kitchen, and bathroom were so clean, and well organized. I highly recommend this place. 
39832	3544964	10.0	8.0	44342685	Thanks for the great place to stay Cris! Everything was as described and the location is excellent. The walk to the train terminal was sub 10 minutes for me and it was easy to find, a short and easy 2 minute drive off of I-5. Cris is an excellent host and had a great little sheet with some helpful details about your stay, and some of the restaurants within walking distance. The bed was a little firm for my taste but some people might prefer that. Thanks again for the accomodations and hospitality. 
